Title,Date,Views,Likes,Comments,Category,Duration,VideoID,Extracted,LTV,CTL,Diff
¡Conoce a la científica que desveló los secretos de los elementos radioactivos! #shorts #pixelart,2024-11-04T16:15:00Z,7747,190,44,Gaming,0:00:18,6XXM3VXEPZY,2024-11-14T00:00:00Z,0.024525622821737446,0.23157894736842105,252
How to Install Windows on a USB Drive,2024-11-04T01:33:35Z,1787033,103447,1236,Gaming,0:01:00,jBkmtqRV-lw,2024-11-14T00:00:00Z,0.057887571186430245,0.011948147360484112,252
I Made an Android App in MINUTES with This AI Tool,2024-11-13T11:24:47Z,599704,24291,1595,PeopleBlogs,0:10:21,FbCA_qQSvYM,2024-11-14T00:00:00Z,0.04050498245801262,0.0656621794080112,243
£350k a week?!,2024-11-13T10:00:20Z,510236,3311,198,PeopleBlogs,0:00:21,MseEl3V1qDw,2024-11-14T00:00:00Z,0.00648915403852335,0.059800664451827246,243
CGなしで名場面が誕生,2024-11-13T08:00:43Z,8138465,194764,651,PeopleBlogs,0:01:00,r5QVDPHUhM0,2024-11-14T00:00:00Z,0.023931294169109284,0.003342506828777392,243
apt. by 부르나마나 & 젊어서노세 (Bruno & ROSE Baby version),2024-11-13T04:35:18Z,25218859,122299,4135,PeopleBlogs,0:02:41,CvZ0LEx8y54,2024-11-14T00:00:00Z,0.004849505681442606,0.03381057899083394,243
When a Helping Hand is Misread! Gym Kindness Story #shorts,2024-11-12T18:00:25Z,32200423,177965,277,PeopleBlogs,0:00:23,ezyWH0rionY,2024-11-14T00:00:00Z,0.005526790750543867,0.0015564858258646363,244
"Jaukeem Fortson's Performance of ""God Only Knows"" Blows the Coaches Away | The Voice Knockouts | NBC",2024-11-12T13:05:00Z,3595358,74285,3117,PeopleBlogs,0:02:14,eegPfUyyXko,2024-11-14T00:00:00Z,0.020661363903121746,0.04196001884633506,244
Nastya is throwing her friend the 10 worst dates ever in 24 hours,2024-11-12T10:00:34Z,8432953,33377,N/A,PeopleBlogs,0:09:44,ViX7sbrXASc,2024-11-14T00:00:00Z,N/A,N/A,244
模型だけど本物のような物,2024-11-12T08:00:04Z,14982,286,11,PeopleBlogs,0:00:54,ax81k4yEvXg,2024-11-14T00:00:00Z,0.01908957415565345,0.038461538461538464,244
just a practice 😜,2024-11-12T03:16:41Z,14,8,0,PeopleBlogs,0:02:12,YJCtjxqGYc0,2024-11-14T00:00:00Z,0.5714285714285714,0.0,244
"Jak zostać mistrzem w życiu, sporcie i biznesie, a nie tylko chwilowym zwycięzcą?",2024-11-11T21:30:06Z,12752,188,5,PeopleBlogs,0:49:20,o_yvqWD3HCY,2024-11-14T00:00:00Z,0.014742785445420327,0.026595744680851064,245
"Elon Musk Witnessed A Miracle Inside The Church in Vegas, Then Immediately Accept Jesus!",2024-11-11T21:14:42Z,80,0,0,PeopleBlogs,0:20:13,bM_Zfqu-1L4,2024-11-14T00:00:00Z,N/A,N/A,245
Will The BIGGEST BACKPACK Fit Through A DOOR 🎒🤪🚪,2024-11-11T20:02:32Z,34332743,634151,1335,PeopleBlogs,0:00:42,kIVGImLucQM,2024-11-14T00:00:00Z,0.018470735064774754,0.0021051768427393478,245
The BEST Singers Of All Time!,2024-11-11T16:00:36Z,1572849,15610,518,PeopleBlogs,1:53:06,hjFpdHDziJA,2024-11-14T00:00:00Z,0.00992466536838565,0.033183856502242155,245
What a friend do you have with Jesus he love you and gave his life #duet #jesuschrist #love #,2024-11-11T15:02:34Z,7111,1433,31,PeopleBlogs,0:01:21,wJHubQB_bbE,2024-11-14T00:00:00Z,0.20151877373083954,0.021632937892533146,245
I should have believed the comments.... #shorts #labor #pregnancy,2024-11-11T15:00:47Z,3391083,83199,697,PeopleBlogs,0:00:11,iEknqGt3qn0,2024-11-14T00:00:00Z,0.02453463981860662,0.00837750453731415,245
Simon is secretly the best 🫶 #sad #simoncowell #shortsfeed,2024-11-11T09:07:19Z,13250041,264974,5351,PeopleBlogs,0:00:10,NUPWF91PtVw,2024-11-14T00:00:00Z,0.019997975855319997,0.020194434170899788,245
未来を見せてくれるカメラ,2024-11-11T08:00:38Z,19896,418,2,PeopleBlogs,0:00:51,kCm4rTRosUo,2024-11-14T00:00:00Z,0.021009248090068357,0.004784688995215311,245
I Built a Theme Park In My House!,2024-11-10T21:19:41Z,75928739,721335,14889,PeopleBlogs,0:27:51,Hh5JHs4j5fI,2024-11-14T00:00:00Z,0.009500157772934961,0.020640895007174198,246
Getting pizza onto the peel #shorts #pizzatricks #gozney #pizza,2024-11-10T19:19:37Z,80261956,4055190,12985,PeopleBlogs,0:00:27,4vkHr4RYAFY,2024-11-14T00:00:00Z,0.05052443526295322,0.0032020694468076713,246
A Year in My Garden 🌱 Watch My Garden Grow Through the Seasons: 2 Hour Compilation ASMR,2024-11-10T17:00:19Z,323111,5154,207,PeopleBlogs,2:03:05,IIoOyj-UhmA,2024-11-14T00:00:00Z,0.01595117467371894,0.040162980209545986,246
Guns N' Roses - Welcome To The Jungle (Lyrics),2024-11-10T16:51:15Z,890395,7663,282,PeopleBlogs,0:04:31,CP3sn7T0rxY,2024-11-14T00:00:00Z,0.008606292712784775,0.036800208795510894,246
Girl Wakes Up as a Vampire and Faces the Nightmare of Living Half Human and Half Vampire,2024-11-10T14:23:00Z,347749,2664,64,PeopleBlogs,0:57:19,u3iiFxvF5sc,2024-11-14T00:00:00Z,0.007660697802150402,0.024024024024024024,246
DEATHTRAP! The Strange story of Air France flight 736,2024-11-10T14:00:49Z,2326602,63090,3602,PeopleBlogs,0:49:01,v--qJj_7PLQ,2024-11-14T00:00:00Z,0.027116799521362055,0.057093041686479634,246
ME PELEO CON FEDE! (BROMA A MIS VECINOS),2024-11-10T00:52:13Z,9017519,346379,14027,PeopleBlogs,0:16:46,yve0_jVXoh4,2024-11-14T00:00:00Z,0.038411784882294124,0.04049610397858992,246
Reaccionando a la creeppy pasta de pvz,2024-11-09T19:58:22Z,63,7,2,PeopleBlogs,0:10:14,seRZCIKYmZs,2024-11-14T00:00:00Z,0.1111111111111111,0.2857142857142857,247
1 Year Renovation of a 100 Year Old Silo | Start to Finish,2024-11-09T11:01:09Z,11633835,185966,6975,PeopleBlogs,0:38:21,trYsjl51Njs,2024-11-14T00:00:00Z,0.01598492672450658,0.0375068560919738,247
(국내매장판 A/S 가능) 노스페이스 여성 가벼운 따뜻한 경량패딩 버몬트 5종,2024-11-09T07:34:54Z,46,0,2,PeopleBlogs,0:00:12,lU4sXD2BlJI,2024-11-14T00:00:00Z,N/A,N/A,247
"Internet celebrity bridge, the rocking and laughing bridge, a great place for fun",2024-11-09T03:10:30Z,20624785,384994,2430,PeopleBlogs,0:00:18,TlhIIV9sqWA,2024-11-14T00:00:00Z,0.018666570342430237,0.006311786677194969,247
Mi suegra me ODIA 😱 outfit para caerle bien a tu suegra !!! TE VA AMAR ‼️,2024-11-09T02:24:37Z,25168678,753992,1464,PeopleBlogs,0:00:27,QuBIWZPEh2k,2024-11-14T00:00:00Z,0.029957552796376512,0.001941665163556112,247
子羊が脱出した理由,2024-11-09T02:00:12Z,3377205,124231,824,PeopleBlogs,0:00:55,BA0yvhslDXg,2024-11-14T00:00:00Z,0.03678515221906873,0.00663280501646127,247
Jake had QTNA‼️ #TheChi #Shorts,2024-11-08T17:00:01Z,469908,20845,119,PeopleBlogs,0:00:13,-vwSdVgQPiA,2024-11-14T00:00:00Z,0.044359747014309184,0.0057088030702806426,248
Being aware is a responsibility to protect yourself and your family🚨🙏,2024-11-08T15:42:36Z,77661146,2360381,57417,PeopleBlogs,0:00:47,IE-mpm4nsSk,2024-11-14T00:00:00Z,0.03039333207882356,0.024325310193566207,248
"Forced By Indebted Father, Poor Girl Had To Marry A Rich Old Man, Unexpected He's A Handsome CEO!",2024-11-08T15:00:00Z,783495,6680,162,PeopleBlogs,1:16:13,aJV5mwt2zYQ,2024-11-14T00:00:00Z,0.008525899973835188,0.024251497005988023,248
Prart2 I gave him a necklace to apologize for upsetting him! prat2 minta maaf beri kalung #funny,2024-11-08T09:49:30Z,11355354,264128,759,PeopleBlogs,0:00:43,pUfyXcgBR-w,2024-11-14T00:00:00Z,0.023260217162758643,0.002873606736127938,248
"Slicing a ""Silent Basketball"" to see what it really is...",2024-11-07T18:00:39Z,4332197,174256,10142,PeopleBlogs,0:00:56,uihB6r2bxuE,2024-11-14T00:00:00Z,0.040223470908640584,0.058201726195941605,249
Korn - Freak On a Leash (Lyrics),2024-11-07T13:58:47Z,554076,5574,147,PeopleBlogs,0:04:16,8MiuunmjvFo,2024-11-14T00:00:00Z,0.010059991770082082,0.0263724434876211,249
First time doing a different make up since I normally don’t use a lot myself 🙈🥰 love to #create🤩,2024-11-07T00:36:28Z,94,3,0,PeopleBlogs,0:00:13,VNIxtZLwHSA,2024-11-14T00:00:00Z,0.031914893617021274,0.0,249
The Wilkins family goes on a road trip!😬😭,2024-11-06T23:56:42Z,27904701,683281,8912,PeopleBlogs,0:01:00,4dcIHMMmGFY,2024-11-14T00:00:00Z,0.02448623262438827,0.01304295011861884,250
PARTIE 1 OUKOUMBI DE SARMIA & ALAMADINE A MARSEILLE,2024-11-06T18:25:05Z,789,8,0,PeopleBlogs,2:20:46,a1oPwD1uYlo,2024-11-14T00:00:00Z,0.010139416983523447,0.0,250
Mr Bean Has A Day At The Fair | Mr Bean Full Episodes | Classic Mr Bean,2024-11-13T16:00:26Z,3505410,13016,288,Comedy,1:13:27,T9w04frc8aw,2024-11-14T00:00:00Z,0.0037131177237470082,0.022126613398893668,243
JUGANDO A LAS ESCONDIDAS CON MI HERMANITA Y LA CHUKY BARBIE 😱,2024-11-13T15:58:31Z,1154728,11341,0,Comedy,0:15:03,EeAVmaQBge8,2024-11-14T00:00:00Z,0.009821360528193653,0.0,243
If you saw this what would you do ?,2024-11-12T23:43:59Z,1361,19,0,Comedy,0:00:19,UE5AcSePXP8,2024-11-14T00:00:00Z,0.013960323291697281,0.0,244
The most EPIC Gladiator flashmob! Get your tickets for GLADIATOR 2 in theaters this November 😍,2024-11-12T22:22:11Z,6590124,250390,1450,Comedy,0:00:59,10NTDVZoJX0,2024-11-14T00:00:00Z,0.03799473272430079,0.005790966092895084,244
He fell into a volcano 😳,2024-11-12T21:53:32Z,18806247,736187,8592,Comedy,0:00:18,qD3_wHK4iik,2024-11-14T00:00:00Z,0.039145875304094434,0.011670947734746742,244
Basic Spanish at U.A. High🗣️💀 | My Hero Academia Abridged #shorts,2024-11-12T19:42:29Z,5785888,373981,3751,Comedy,0:00:59,txIBYD58nEU,2024-11-14T00:00:00Z,0.06463675065953575,0.010029921306162613,244
How to Save a Falling Plane,2024-11-12T13:30:15Z,6653527,148829,1624,Comedy,0:00:24,TOcf6ZzDzS8,2024-11-14T00:00:00Z,0.022368437071045178,0.010911851856828978,244
Jon Stewart On What Went Wrong For Democrats | The Daily Show,2024-11-12T04:00:18Z,7448446,150102,21209,Comedy,0:14:45,TKBJoj4XyFc,2024-11-14T00:00:00Z,0.02015212300659762,0.14129725120251563,244
QUANDO OS FILHOS VENCEM A MÃE #shorts,2024-11-11T21:19:15Z,8499964,986650,464,Comedy,0:00:59,EWpI4w6tWr4,2024-11-14T00:00:00Z,0.11607696220831053,0.00047027821415902295,245
Light Yagami (Death Note) vuelve a terapia para demostrar que es “Kira” 👨🏻‍🏫 #animeterapia,2024-11-11T18:09:19Z,437496,47245,179,Comedy,0:01:54,ibzY3-N4678,2024-11-14T00:00:00Z,0.10798955876168011,0.003788760715419621,245
LEVEI AS MENINAS PRA CONHECER A NOVA ESCOLA DELAS!,2024-11-11T15:00:06Z,910874,14470,831,Comedy,0:22:59,wZrSzpNPtYs,2024-11-14T00:00:00Z,0.015885841510461383,0.05742916378714582,245
CAN YOU BUILD A COOL CAR FOR UNDER $5000!?! #cars #bmw #e36 #diy,2024-11-11T13:41:47Z,2181813,75290,507,Comedy,0:01:01,BRFvupY0JfY,2024-11-14T00:00:00Z,0.034507998623163394,0.006733962013547616,245
Teachers Having A Snack During Class 😂 #shortsfeed,2024-11-11T12:37:15Z,11617783,324631,2046,Comedy,0:00:21,Hhxq1A_6Q9Q,2024-11-14T00:00:00Z,0.027942594555260672,0.006302540422818523,245
Are you a buffalo? |  Stand up comedy by Manik Mahna,2024-11-11T08:39:46Z,4755996,178490,6350,Comedy,0:16:27,gWQzdnDBmSA,2024-11-14T00:00:00Z,0.03752946806515397,0.03557622275757746,245
When I rode in a Blackhawk Helicopter in Afghanistan 🎤😂  Brad Williams #shorts,2024-11-11T08:00:54Z,26237175,1935412,9159,Comedy,0:02:55,yae-J31BlsA,2024-11-14T00:00:00Z,0.07376602092260313,0.004732325727028664,245
How Much Tape To Stop A Lamborghini?,2024-11-11T02:36:19Z,1184,12,0,Comedy,0:00:15,CX3CgnbUoKM,2024-11-14T00:00:00Z,0.010135135135135136,0.0,245
When Your NAILS Say You Can’t Have a MOM,2024-11-10T23:23:46Z,22043459,407204,1717,Comedy,0:01:00,XawwAEvyne0,2024-11-14T00:00:00Z,0.01847278142690764,0.0042165597587450025,246
EMERSON CEARÁ - A mulher de 300 mil - parte 1 (A Magia do Boteco),2024-11-10T22:00:22Z,399882,22450,513,Comedy,0:20:45,lHpJcLzwLG8,2024-11-14T00:00:00Z,0.05614156176071941,0.022850779510022273,246
¿Cuántos snacks le comprarían a Cachetes? 😂,2024-11-10T21:45:33Z,7626530,676210,1338,Comedy,0:00:40,bueFGNbUsqo,2024-11-14T00:00:00Z,0.08866548744973139,0.001978675263601544,246
I Hired A F1 Driver To Beat My Friends At Go Karting,2024-11-10T17:15:01Z,7574069,169307,2406,Comedy,0:14:24,TETjrM_HiIQ,2024-11-14T00:00:00Z,0.022353506417752467,0.014210871375666689,246
I Spend a FORTUNE On GIANT Everyday Items!,2024-11-10T17:00:01Z,920180,38287,1814,Comedy,0:18:24,aciW9GEGhcQ,2024-11-14T00:00:00Z,0.04160816362016127,0.04737900592890537,246
Tips on how to pass gas on a plane 😂,2024-11-10T14:00:10Z,11341714,561447,2233,Comedy,0:00:39,9hp3T2LScOg,2024-11-14T00:00:00Z,0.04950283528574252,0.003977223139494912,246
When You Have a Mission,2024-11-10T13:30:23Z,12988619,336494,728,Comedy,0:00:51,g_KJas3TPeY,2024-11-14T00:00:00Z,0.025906834283152044,0.002163485827384738,246
A-Romantik - 383. Bölüm (Güldür Güldür Show),2024-11-10T07:30:10Z,697272,5450,155,Comedy,0:21:09,ZUewk4wK5yk,2024-11-14T00:00:00Z,0.007816175036427678,0.028440366972477066,246
Baaka - The Lake Monster | Take A Break Horror Specials,2024-11-10T03:30:02Z,2965821,63794,3156,Comedy,0:26:09,6puoLMmGJSI,2024-11-14T00:00:00Z,0.021509726986220678,0.04947173715396432,246
Reaccionando a CANCIONES con 0 VISITAS #6,2024-11-09T22:42:54Z,7677340,301656,14083,Comedy,0:15:54,uLa0_V0zPFo,2024-11-14T00:00:00Z,0.03929173385573649,0.04668562866311295,247
CONSTRUÍ una PISTA DE AUTOS SECRETA para BABY RICK,2024-11-09T18:30:32Z,1158636,12938,1626,Comedy,0:11:26,rjF-qno7n3Q,2024-11-14T00:00:00Z,0.011166578632115695,0.12567630236512597,247
CRIMINALLY Underrated Conference Room Meetings from The Office US | Comedy Bites,2024-11-09T17:00:26Z,2213801,18321,480,Comedy,0:40:17,XmUYtekm_EU,2024-11-14T00:00:00Z,0.008275811601855813,0.026199443261830685,247
MA MAMIE A PÉTÉ LES PLOMBS 😱 #XSHOT,2024-11-09T16:27:36Z,2763203,127408,857,Comedy,0:00:59,xCEyuBLAaQg,2024-11-14T00:00:00Z,0.04610880923334261,0.0067264222026874295,247
Cooking on a Budget Tips and Tricks,2024-11-09T02:15:01Z,1857,0,0,Comedy,0:30:01,9Ze3OWTORcI,2024-11-14T00:00:00Z,N/A,N/A,247
Cooking with Kids Fun and Easy Recipes for the Whole Family,2024-11-09T02:12:34Z,777,0,0,Comedy,0:30:12,NOrWvfAqOe8,2024-11-14T00:00:00Z,N/A,N/A,247
Cooking on a Budget 10 Cheap and Tasty Recipes,2024-11-09T02:12:50Z,882,0,0,Comedy,0:30:09,5YB-InnP3Fk,2024-11-14T00:00:00Z,N/A,N/A,247
Mis Amigos Me Ayudan A Ponerle Nombre A Mi Nueva Mascota 😱😍,2024-11-09T00:41:06Z,5805699,465744,15626,Comedy,0:00:57,0prNGI8go44,2024-11-14T00:00:00Z,0.0802218647573703,0.0335506200831358,247
¿MARBELLA TIENE UNA GEMELA? | BIANCA OSS ✨,2024-11-08T22:00:06Z,213028,3557,238,Comedy,0:08:26,gL5vcrNZkeQ,2024-11-14T00:00:00Z,0.01669733556152243,0.0669103176834411,248
MI HERMANA VINO!! GRACIAS A USTEDES ❤️,2024-11-08T21:16:11Z,3722450,162047,1689,Comedy,0:00:12,I8k93lpShOg,2024-11-14T00:00:00Z,0.04353235100538624,0.010422901997568606,248
"A WC, amitől HÜLYE leszel - A Boldogság Nyomában #1",2024-11-08T14:56:43Z,603129,24943,673,Comedy,0:07:02,3hG1rD-ws70,2024-11-14T00:00:00Z,0.04135599515194925,0.026981517860722448,248
thank you so much for meeting me kartik aaryan it was a dream come true🫶🏻🙏🏻,2024-11-08T12:08:33Z,10716576,479107,2347,Comedy,0:00:25,jz_4ImRXfEE,2024-11-14T00:00:00Z,0.04470709674433326,0.004898696950785524,248
¡Revive a estos inolvidables personajes secundarios de Bob Esponja!,2024-11-13T22:30:14Z,9618,745,3,Entertainment,0:00:28,yDO3Iir7Ldk,2024-11-14T00:00:00Z,0.07745893117072157,0.004026845637583893,243
¿Cómo asustar a Trigon el destructor? #TeenTitansGo #shorts #boing,2024-11-13T19:00:02Z,1747019,64886,0,Entertainment,0:00:51,1y96263pSyY,2024-11-14T00:00:00Z,0.0371409812944221,0.0,243
"John Krasinski Knew His Wife Emily Blunt Was ""The One""",2024-11-13T15:18:21Z,2197871,121381,1144,Entertainment,0:00:48,0Wod2yFs3vg,2024-11-14T00:00:00Z,0.055226626130468984,0.00942486880154225,243
YOUTUBERS CONTROLAM A MINHA VIDA POR 24 HORAS!,2024-11-13T14:28:00Z,4530519,39049,1075,Entertainment,0:15:02,ifr0xJQ0O4I,2024-11-14T00:00:00Z,0.00861910081383612,0.027529514200107557,243
Kids show that knowledge at school is the most important thing,2024-11-13T10:00:07Z,83293579,179868,N/A,Entertainment,0:31:38,7adUE4WZ1QM,2024-11-14T00:00:00Z,N/A,N/A,243
It's satisfying to form a sanrio from sand A05 #mould #satisfying #kineticsand #sand #mold #shape,2024-11-13T07:06:13Z,13700,207,0,Entertainment,0:00:23,dvmsW_W2Hu8,2024-11-14T00:00:00Z,0.01510948905109489,0.0,243
I Tried a Liquid Diet,2024-11-12T19:15:00Z,18463410,610816,1586,Entertainment,0:00:52,Lr2zPyRfIdE,2024-11-14T00:00:00Z,0.0330825129269187,0.0025965266135792122,244
Jaana Samjho Na | Kartik A | Tripati Dhimri | #bhoolbhulaiyaa3 #song #status #shots,2024-11-12T17:30:51Z,871,27,0,Entertainment,0:00:31,HWCVA89tvLI,2024-11-14T00:00:00Z,0.030998851894374284,0.0,244
LARA ABANDONA A RHENNÉ 🐸💓,2024-11-12T13:00:24Z,8902521,14592,N/A,Entertainment,0:10:00,eE461JG65mg,2024-11-14T00:00:00Z,N/A,N/A,244
KeajaiBan DO'A ISTRI🤲 #ELDiko,2024-11-12T12:53:24Z,354,10,6,Entertainment,0:01:01,1P0XVrOOnfU,2024-11-14T00:00:00Z,0.02824858757062147,0.6,244
"Ella baila breaking como una pro... ¡y sus tenis lo saben!"" 🕶️👟 #FuturoDelBreaking #dancevideo #epic",2024-11-12T11:57:57Z,95588561,1544871,9155,Entertainment,0:00:12,mJKgwOBf5zs,2024-11-14T00:00:00Z,0.016161672315581778,0.005926061140380006,244
Having a talk with my ex when I get a gf! 🤣 (4K MEMES)#funny #animation #shorts #shortvideo #viral,2024-11-11T13:28:39Z,1411,34,0,Entertainment,0:00:18,Dm-a2nwe0H8,2024-11-14T00:00:00Z,0.024096385542168676,0.0,245
Tirelessly Attaching Thousands of Bucket Handles in a Day! 🪣🏷️,2024-11-11T11:01:53Z,16948,583,4,Entertainment,0:00:20,AT-4Tv7Z7ls,2024-11-14T00:00:00Z,0.03439933915506255,0.00686106346483705,245
It's satisfying to form a sanrio from sand A03 #mould #satisfying #kineticsand #sand #mold #shape,2024-11-11T10:51:21Z,20030,384,0,Entertainment,0:00:20,bFvATnirau4,2024-11-14T00:00:00Z,0.019171243135297056,0.0,245
Explorando a praia secreta da cidade de Peruíbe,2024-11-11T00:08:35Z,68,2,0,Entertainment,0:05:19,X56YCpC66UI,2024-11-14T00:00:00Z,0.029411764705882353,0.0,245
I Tested the Aztec “Death” Whistle,2024-11-10T17:23:10Z,1357950,28812,158,Entertainment,0:00:30,vxhmLnTiI2I,2024-11-14T00:00:00Z,0.02121727604109135,0.005483826183534639,246
I Built a THEME PARK in my House!,2024-11-10T15:00:27Z,436137,6468,439,Entertainment,0:22:35,VKHbcdnbLDA,2024-11-14T00:00:00Z,0.0148302024363904,0.0678726035868893,246
each episode of #MrPlankton in a nutshell #Netflix #emotionalrollercoaster,2024-11-10T09:00:52Z,927900,58099,288,Entertainment,0:00:27,o7ubWV6n9pc,2024-11-14T00:00:00Z,0.06261342817113913,0.004957056059484673,246
Buying a car in 2023!🤣🤓(4k memes)#animation #funny #shorts #shortvideo #comedyviralvideo,2024-11-10T02:47:48Z,5706,107,0,Entertainment,0:00:17,ALvphvvNKQM,2024-11-14T00:00:00Z,0.018752190676480898,0.0,246
Visita a praia do Castelinho,2024-11-09T21:35:07Z,6,1,0,Entertainment,0:00:51,273rg4QXFrU,2024-11-14T00:00:00Z,0.16666666666666666,0.0,247
Determined Boy Builds a Tunnel in the Mountains ⛰️👷‍♂️,2024-11-09T17:00:39Z,8932,338,11,Entertainment,0:00:20,h2T172ORnOw,2024-11-14T00:00:00Z,0.037841468875951634,0.03254437869822485,247
"MEGA BABiES CARTOONS!!  Smart Baby Adley, Super Niko, & Freeze Navey save the day! New Magic Puffs",2024-11-09T16:00:07Z,9819266,5240,179,Entertainment,0:06:21,VrXyDaLAP20,2024-11-14T00:00:00Z,0.0005336447754852552,0.03416030534351145,247
Tom 🍓 Jerry (Ammu&Nandhu)Real End Twist😍🎈 #shorts #viral #v5familyshow,2024-11-09T13:33:25Z,167426706,2550177,2006,Entertainment,0:01:00,yUH_B98TZzI,2024-11-14T00:00:00Z,0.01523160229885906,0.0007866120665349896,247
Watch Kayla swim along with a Momma Tsintaosaurus! @DinoKids,2024-11-09T11:30:01Z,276141527,2932731,0,Entertainment,0:00:41,0b0MvsVsIEM,2024-11-14T00:00:00Z,0.010620391043176929,0.0,247
క్రిష్ రెండవ పెళ్లి | Director Krish married to a mother with an 11 years old son | Chitramalatelugu,2024-11-09T08:33:43Z,5043,6,1,Entertainment,0:01:53,05VEnL0Kxa4,2024-11-14T00:00:00Z,0.001189767995240928,0.16666666666666666,247
Do Bulls Hate The Color Red?,2024-11-08T19:38:35Z,160370273,3019469,6426,Entertainment,0:00:34,jEEwQotRuxo,2024-11-14T00:00:00Z,0.018828109122193737,0.002128188764315845,248
How Much Tape To Stop A Lamborghini?,2024-11-08T17:00:00Z,709848481,13771465,19436,Entertainment,0:00:15,pS-fFdvyHLE,2024-11-14T00:00:00Z,0.01940056979568292,0.0014113240675556304,248
¿Cuántos años tenían los actores cuando hicieron 'El Chavo del 8'? #chavodel8 #elchavo #chavoland,2024-11-08T16:00:25Z,5776094,146806,615,Entertainment,0:01:00,ZFIKM684rgY,2024-11-14T00:00:00Z,0.025416137618258984,0.004189202076209419,248
"As a dad, I've discovered the ultimate secret to household peace! (Part 2)",2024-11-08T13:48:00Z,288106462,6343603,12554,Entertainment,0:00:33,XyOuIHSu95I,2024-11-14T00:00:00Z,0.022018260041664735,0.001979001523266825,248
DOMINAR A MENTE: A CHAVE PARA VENCER NA VIDA E NO RINGUE 🧠🥊,2024-11-07T21:45:00Z,2,0,0,Entertainment,0:00:07,6wqUVXeCROg,2024-11-14T00:00:00Z,N/A,N/A,249
I Tested the World’s “Blackest” Paint,2024-11-07T15:50:00Z,10478491,303392,1353,Entertainment,0:00:40,Z2WaOeqtrAU,2024-11-14T00:00:00Z,0.028953787334454934,0.004459577048834511,249
A BOLSA DO FUTURO! COPERNI APRESENTA MODELO 3D IMPRESSO EM GEL NA DISNEYLAND PARIS 🌐✨,2024-11-07T15:00:57Z,46,0,0,Entertainment,0:00:15,naUzsB1CaFQ,2024-11-14T00:00:00Z,N/A,N/A,249
Mufasa: The Lion King | Coming Soon 🦁 | Disney Kids,2024-11-07T15:00:25Z,765434,19925,0,Entertainment,0:00:31,F2dI1XNpfPQ,2024-11-14T00:00:00Z,0.026030983729492026,0.0,249
Oliver Opened His Own Police,2024-11-07T12:15:06Z,76999065,166322,N/A,Entertainment,0:43:08,ysB3qOkasLQ,2024-11-14T00:00:00Z,N/A,N/A,249
Can Sisu Stay Hidden? 🤫🌊 | Raya And The Last Dragon  | Disney Kids,2024-11-07T10:00:53Z,855744,28675,0,Entertainment,0:00:58,lWMTcSl8QP4,2024-11-14T00:00:00Z,0.03350885311495026,0.0,249
Effortless Peanut Peeling with a Magic Gadget! 🥜✨,2024-11-06T17:00:37Z,4991,50,2,Entertainment,0:00:20,ZPDJKl40W68,2024-11-14T00:00:00Z,0.010018032458425166,0.04,250
ADLEY found BABY PUFFS!!  Family Roblox with Crazy Babies and Navey is the Mom & Princess Hamsters,2024-11-06T16:00:06Z,1811918,3158,283,Entertainment,0:33:26,4rtPBlk9rjs,2024-11-14T00:00:00Z,0.0017429044802248226,0.0896136795440152,250
Is Now the Time to Invest in Vacation Rentals? Insights from Real Estate Pros | PART 1,2024-11-06T15:12:49Z,22,0,0,Entertainment,0:14:13,PpyjRVVrTgg,2024-11-14T00:00:00Z,N/A,N/A,250
How Trump won in a divided America and what's next? | Fault Lines Documentary,2024-11-13T16:30:02Z,279321,2849,1025,NewsPolitics,0:24:53,7jty5PGLsqI,2024-11-14T00:00:00Z,0.010199734355812846,0.3597753597753598,243
A woman cleans the government bus | Tirunelveli | Sun News,2024-11-13T13:49:49Z,6434201,282698,2783,NewsPolitics,0:00:53,1gnllcRNDto,2024-11-14T00:00:00Z,0.043936768528058105,0.00984442762240978,243
Worried About the Election Result? Politics Change Constantly,2024-11-13T00:00:38Z,77659,4269,738,NewsPolitics,0:02:53,ziFqWpFClCU,2024-11-14T00:00:00Z,0.054971091566978714,0.17287420941672524,243
'Unprecedented': Judge Merchan 'made a mess' of Trump case,2024-11-12T23:00:39Z,858046,15950,3355,NewsPolitics,0:12:13,owcFxLqr35A,2024-11-14T00:00:00Z,0.0185887469902546,0.2103448275862069,244
Melania Trump declined Jill Biden meeting over Mar-a-Lago raid: report,2024-11-12T18:30:13Z,2087780,49257,9840,NewsPolitics,0:05:29,IJFtVm7Me64,2024-11-14T00:00:00Z,0.02359300309419575,0.19976856081369146,244
"Netanyahu might be disappointed in a Trump White House, says former Israeli official",2024-11-12T17:03:30Z,101937,617,602,NewsPolitics,0:10:41,T5p4bOtIwJo,2024-11-14T00:00:00Z,0.00605275807606659,0.9756888168557536,244
"What's driving 500,000+ people to self-deport from the U.S.?",2024-11-12T16:11:58Z,363488,5929,6550,NewsPolitics,0:22:01,NuyIMmLui3U,2024-11-14T00:00:00Z,0.01631140505326173,1.1047394164277282,244
The kush healer chaining up people suffering from drug addiction in Sierra Leone #kush #drugs,2024-11-12T14:01:08Z,1216647,29904,456,NewsPolitics,0:01:00,wbwiYrJCLc0,2024-11-14T00:00:00Z,0.024579027441813443,0.015248796147672551,244
I just met a social worker.,2024-11-12T05:17:29Z,536,14,3,NewsPolitics,0:01:00,gOykY2LzLjg,2024-11-14T00:00:00Z,0.026119402985074626,0.21428571428571427,244
Mafias alientan a pedir asilo en Alemania con promesas falsas a migrantes latinoamericanos,2024-11-11T22:30:11Z,204659,394,62,NewsPolitics,0:09:42,ndRknIZQMcY,2024-11-14T00:00:00Z,0.0019251535480970786,0.15736040609137056,245
¡Turquía Aplasta a Rusia y la Expulsa de Crimea!,2024-11-10T22:53:17Z,89825,3765,200,NewsPolitics,0:39:19,vLsYOxfHB9w,2024-11-14T00:00:00Z,0.04191483440022266,0.05312084993359894,246
Trump's deportation plan will be a 'cost savings' for Americans: Ex-ICE director,2024-11-10T22:00:09Z,410295,12566,3013,NewsPolitics,0:07:01,KGCE7i_OT-Q,2024-11-14T00:00:00Z,0.030626744171876333,0.23977399331529525,246
Bernie Sanders says Americans ‘have a right to be angry’: Full interview,2024-11-10T18:00:15Z,1733017,31521,11365,NewsPolitics,0:09:19,QVlum0tUsTs,2024-11-14T00:00:00Z,0.018188511711079578,0.36055328193902475,246
"Ted Danson on his new comedy series ""A Man on the Inside""",2024-11-10T15:12:50Z,121954,1692,118,NewsPolitics,0:07:52,ow-YDEf9Rpk,2024-11-14T00:00:00Z,0.013874083670892304,0.06973995271867613,246
"Tyrus: I wish this was a joke, but it's not",2024-11-10T02:00:01Z,3550955,68997,5262,NewsPolitics,0:19:03,ak5eGOZFeB8,2024-11-14T00:00:00Z,0.01943054755692483,0.07626418539936519,246
"50-plus bird calls, one OKC boy equals a social media sensation",2024-11-09T23:38:03Z,254045,5169,N/A,NewsPolitics,0:02:53,7Y-KJEfn0ag,2024-11-14T00:00:00Z,N/A,N/A,247
Fox News’ hosts crack up over 'The View's' Trump meltdown,2024-11-09T22:00:06Z,1587718,26477,3905,NewsPolitics,0:05:54,8iK0RLC8jlc,2024-11-14T00:00:00Z,0.016676135182696172,0.14748649771499792,247
Reportera Confronta a “Alito” Moreno - Las Mangas del Chaleco,2024-11-09T20:38:53Z,1217237,65410,2173,NewsPolitics,0:01:00,AfXuhCadfRw,2024-11-14T00:00:00Z,0.05373645395268136,0.033221219996942365,247
