Title,Date,Views,Likes,Comments,Category,Duration,VideoID,Extracted,LTV,CTL,Diff
Se faire mordre par un SERPENT ?,2024-11-10T19:00:12Z,185622,5849,232,PetsAnimals,0:16:57,OrqaxFSoF7M,2024-11-14T00:00:00Z,0.03151027356671084,0.03966489998290306,246
This woman rescued a baby parrot that had fallen out of its nest #parrot #babyparrot #short,2024-11-09T18:53:27Z,10511102,488812,2947,PetsAnimals,0:01:00,t92F4oLaXRQ,2024-11-14T00:00:00Z,0.046504353206733226,0.0060289027274289505,247
CRAZYYYY RIGHT!? 🤪💜 #horse #shorts,2024-11-09T18:16:13Z,5165797,528681,940,PetsAnimals,0:00:09,yKFIwGpyLUk,2024-11-14T00:00:00Z,0.10234258140612185,0.0017780098017519072,247
The BIGGEST FISH caught in Season 1 of River Monsters,2024-11-09T14:15:01Z,2783026,17169,355,PetsAnimals,0:49:15,HIzJrghJuhY,2024-11-14T00:00:00Z,0.006169184190158482,0.020676801211485817,247
Creating A Giant No Filter Vase Aquarium - Step-by-step Aquascape Tutorial,2024-11-09T14:00:44Z,31508,1770,107,PetsAnimals,0:10:22,lF8pam4eLMc,2024-11-14T00:00:00Z,0.056176209216706866,0.060451977401129946,247
I Found an Abandoned Pond Infested with Monsters!,2024-11-09T13:00:02Z,5865084,50075,4183,PetsAnimals,0:27:37,93-bWHzVNPc,2024-11-14T00:00:00Z,0.008537814633174904,0.08353469795307039,247
A Stray Dog with a Giant Worm in Its Nose is Saved by Rescuers,2024-11-09T12:21:02Z,8210383,168981,683,PetsAnimals,0:02:09,v9zxbMx1EiM,2024-11-14T00:00:00Z,0.02058137848136926,0.004041874530272634,247
When Bears Go On A Rampage Caught on Camera!,2024-11-09T12:00:11Z,9962887,44233,3234,PetsAnimals,0:11:45,6Dh_w0HxVO4,2024-11-14T00:00:00Z,0.004439777345662959,0.07311283430922615,247
"The benefits of a guppy ONLY tank

#aquariumcoop #aquariumadvice #aquariumfish #shorts",2024-11-08T14:01:12Z,9262,537,15,PetsAnimals,0:00:54,68WsdCKI1Ow,2024-11-14T00:00:00Z,0.05797883826387389,0.027932960893854747,248
"Meet the Rain Frog – The Grumpiest, Squeakiest Frog Around!",2024-11-08T10:01:03Z,898909,37123,452,PetsAnimals,0:00:47,xrPfvawkDXw,2024-11-14T00:00:00Z,0.041297839937079285,0.012175740107211163,248
Zebra's Daring Move Saves Day #shorts #animaladventure,2024-11-08T05:00:47Z,40,24,0,PetsAnimals,0:01:01,swG0b_WhkKs,2024-11-14T00:00:00Z,0.6,0.0,248
🌈🍰 Puff is whipping up a magical rainbow cake! Taste the colors! #RainbowBaking #thatlittlepuff,2024-11-08T04:02:07Z,8151418,337669,716,PetsAnimals,0:00:19,QbZyWHwfpHo,2024-11-14T00:00:00Z,0.04142457177389259,0.0021204197009497467,248
The bear had been hit by a car and was rescued by a man and then #bear #babybear #short,2024-11-07T23:10:45Z,64108785,1474108,14676,PetsAnimals,0:01:00,fbjyKYTYXCs,2024-11-14T00:00:00Z,0.02299385333850891,0.009955851267342691,249
"I BUILT A $10,000 DREAM CAT CASTLE!!",2024-11-07T23:03:19Z,9139976,18890,5063,PetsAnimals,0:11:14,61oQvi5iNzc,2024-11-14T00:00:00Z,0.002066745033028533,0.2680254102699841,249
The Dragon Who Loved To Dance 🪩 Kind & Caring Bedtime Stories Collection For Kids,2024-11-07T20:00:17Z,218344,997,0,PetsAnimals,2:30:56,MUSJhf2J9RQ,2024-11-14T00:00:00Z,0.00456618913274466,0.0,249
Así empiezo a dar boca a los potros - Doma Racional,2024-11-07T18:49:21Z,30936,538,16,PetsAnimals,0:17:28,i-huQ8qRns8,2024-11-14T00:00:00Z,0.0173907421773985,0.02973977695167286,249
When You Have A Lovely Ride 💖,2024-11-07T17:30:03Z,67440,8676,162,PetsAnimals,0:01:01,ML8O2ewxKV8,2024-11-14T00:00:00Z,0.12864768683274022,0.01867219917012448,249
"This is a WONDERful fish!

#aquariumcoop #aquariumadvice #killifish #shorts",2024-11-07T14:00:56Z,5038,423,18,PetsAnimals,0:01:00,nnB_4N-ByV8,2024-11-14T00:00:00Z,0.08396188963874554,0.0425531914893617,249
She has a big imagination!,2024-11-07T13:17:14Z,1616829,111684,1973,PetsAnimals,0:00:43,DeoH1irIaR8,2024-11-14T00:00:00Z,0.0690759505179583,0.017665914544608002,249
"""Mamu's Surprise Birthday Gift for Waleed: A New Car 😱",2024-11-07T07:23:27Z,270221,3489,64,PetsAnimals,0:09:17,WLPLrXImvuc,2024-11-14T00:00:00Z,0.012911653794486735,0.01834336486099169,249
Cristiano Becomes A Cameraman For A Day (Trying His New Gadget),2024-11-13T14:43:47Z,4003474,491830,9201,Sports,0:00:48,PjmSUJBBvgQ,2024-11-14T00:00:00Z,0.12285080407665942,0.01870768354919383,243
“Ravishing” Rick Rude was a mauler 😨,2024-11-12T20:09:40Z,243543,8746,793,Sports,0:00:34,0n84v4ae6cM,2024-11-14T00:00:00Z,0.035911522811166816,0.09067002058083695,244
Is Intimate Compatibility a Dealbreaker for Your Relationship?,2024-11-12T16:06:31Z,26,0,1,Sports,0:03:32,Ct-3u_dX88g,2024-11-14T00:00:00Z,N/A,N/A,244
Becoming A Dance World Champion 🏆,2024-11-12T08:26:35Z,15908359,655035,4624,Sports,0:01:07,a_U5XdyHlvU,2024-11-14T00:00:00Z,0.04117552288076979,0.0070591647774546394,244
"2 minutes ago: Caitlin Clark delivered a heartbreaking announcement, leaving the entire WNBA stunned",2024-11-12T06:51:24Z,3683,17,2,Sports,0:01:49,EMpZQwUd6nU,2024-11-14T00:00:00Z,0.004615802335052946,0.11764705882352941,244
Everyone wanted a piece of the action tonight 👀 #WWERaw,2024-11-12T04:29:08Z,5689043,123086,515,Sports,0:00:56,eQO5wJ45NPc,2024-11-14T00:00:00Z,0.02163562483180387,0.004184066425101149,244
🤯 A WILD theory on Red Bull’s F1 rivals,2024-11-11T16:58:53Z,4648020,160033,1888,Sports,0:00:56,AOTIIsByJDE,2024-11-14T00:00:00Z,0.03443035959397765,0.01179756675185743,245
It's taking Giants fans a long long time to figure this out.,2024-11-11T14:13:30Z,560,4,0,Sports,0:00:11,Wu-qgCeJtls,2024-11-14T00:00:00Z,0.007142857142857143,0.0,245
Pistons vs. Lakers: The Podcast Drama Unveiled!,2024-11-11T13:30:49Z,453,6,0,Sports,0:00:32,4qvTQDiIGIM,2024-11-14T00:00:00Z,0.013245033112582781,0.0,245
Why Does Anthony Davis Need More Games to Prove Himself?,2024-11-11T13:28:44Z,457,6,0,Sports,0:00:31,OCW68BXdWAs,2024-11-14T00:00:00Z,0.01312910284463895,0.0,245
BILLY JIGSAW AT THE SKATEPARK! #mtb #bikes #biking #tricks #stunts #bmx,2024-11-10T17:59:18Z,85664966,751543,2439,Sports,0:00:11,JuWdL8mIeKo,2024-11-14T00:00:00Z,0.008773049650191888,0.0032453232882216987,246
"NBA Bombshells, Explosive NFL Trades & The College Hoops Stars You NEED to Watch!",2024-11-10T15:12:28Z,128,6,4,Sports,1:22:57,1ej9zE8_-Yk,2024-11-14T00:00:00Z,0.046875,0.6666666666666666,246
Was this out or not? 👀🏏 Ben Stokes' controversial dropped catch in the 2023 Ashes 🏴󠁧󠁢󠁥󠁮󠁧󠁿,2024-11-10T06:00:19Z,3091611,88182,481,Sports,0:00:45,-RMvjfrFGms,2024-11-14T00:00:00Z,0.028522993352009682,0.005454627928602209,246
"Telugu Titans register their 4th win in a row, move to 2nd place | #ProKabaddiOnStar 2024 HIGHLIGHTS",2024-11-09T18:39:39Z,1282252,24680,415,Sports,0:12:31,5Uu53q_12sw,2024-11-14T00:00:00Z,0.019247386629149342,0.016815235008103727,247
Dhruv Jurel single-handedly stabilizes India A for a decent total in 2nd Test against Australia A,2024-11-09T09:42:54Z,263657,15060,105,Sports,0:00:51,f5HuBfV8WDY,2024-11-14T00:00:00Z,0.0571196668398715,0.0069721115537848604,247
Spain 🆚Portugal Match Made a History = 💀Equally Played🔥 #shorts #football,2024-11-08T23:07:08Z,14855,805,5,Sports,0:00:44,DeRYHVwxdJk,2024-11-14T00:00:00Z,0.05419050824638169,0.006211180124223602,248
How to EASILY do a cartwheel! (Tutorial),2024-11-08T15:00:17Z,421819,6790,249,Sports,0:03:34,GAbIx6oQAv4,2024-11-14T00:00:00Z,0.016096951536085383,0.03667157584683358,248
India A SHOOK as Harris survives appeal,2024-11-08T04:04:31Z,2676532,89602,1078,Sports,0:00:59,xBdxWua85k0,2024-11-14T00:00:00Z,0.03347690220030995,0.01203098145130689,248
I Surprised My Dad with a Zidane Shirt,2024-11-07T15:30:16Z,26761969,618806,530,Sports,0:00:31,X3M9j6HPKgQ,2024-11-14T00:00:00Z,0.0231225886256725,0.0008564881400632832,249
My First Race in 5 years... It was a disaster!,2024-11-07T15:00:33Z,1033707,12299,316,Sports,0:37:18,RXw9emoed0k,2024-11-14T00:00:00Z,0.011897955610245457,0.025693145784210097,249
Noah Lyles talking trash after beating IShowSpeed in a race 😂 (via @IShowSpeed),2024-11-07T14:00:19Z,1248138,23861,783,Sports,0:00:11,FXGU5GgzUaw,2024-11-14T00:00:00Z,0.019117277095962146,0.03281505385356859,249
Australia A v India A | First-class match two | Day 1,2024-11-07T07:48:56Z,2052889,23110,1303,Sports,0:08:13,Kz5WiCuTqog,2024-11-14T00:00:00Z,0.011257306167065047,0.056382518390307224,249
Why Patrick Mahomes is Unstoppable!,2024-11-07T03:23:37Z,2438,18,1,Sports,0:00:28,0QDrwQ3ojX0,2024-11-14T00:00:00Z,0.007383100902378999,0.05555555555555555,249
"Kate, Titi and Carra had to take Micah down a few pegs 😂",2024-11-06T20:47:19Z,2586836,127548,788,Sports,0:00:53,rF5R0_itcJY,2024-11-14T00:00:00Z,0.049306566013462005,0.006178066296609904,250
Rio Ferdinand is a big fan of the Arsenal kit 👀,2024-11-06T20:33:37Z,236672,5608,146,Sports,0:00:29,sbuYd7hKHb8,2024-11-14T00:00:00Z,0.023695240670632774,0.026034236804564907,250
The story of “The Legend Killer” Randy Orton,2024-11-06T13:00:33Z,1009551,8322,449,Sports,3:16:03,QHZARoRniXA,2024-11-14T00:00:00Z,0.008243268542153888,0.05395337659216534,250
Kris Dunn: The Underrated Championship Caliber Player Every Team Needs! #nba #basketball #viralshort,2024-11-06T03:52:02Z,485,8,3,Sports,0:00:26,iv_FykRW-so,2024-11-14T00:00:00Z,0.016494845360824743,0.375,250
How Showtime Saved The NBA,2024-11-05T20:16:24Z,80678,806,186,Sports,0:49:37,JV6u3K1gt_A,2024-11-14T00:00:00Z,0.009990331936835321,0.23076923076923078,251
Can the Lakers REALLY Beat the Nuggets This Playoffs?,2024-11-05T03:13:09Z,640,9,2,Sports,0:00:29,eQv5XiauLmY,2024-11-14T00:00:00Z,0.0140625,0.2222222222222222,251
"Bianca Belair slaps Liv Morgan as a high-stakes Battle Royal is set: Raw highlights, Nov. 4, 2024",2024-11-05T01:23:09Z,1316663,22403,1775,Sports,0:03:12,BpdO8H_EVWw,2024-11-14T00:00:00Z,0.017014984092360765,0.07923046020622238,251
Stephen A. RESPONDS to Kevin Durant calling him a ‘clown’ 👀 #shorts,2024-11-04T16:29:58Z,171334,3740,836,Sports,0:00:34,Nwh0as0sLvs,2024-11-14T00:00:00Z,0.021828708837708804,0.2235294117647059,252
Eden Hazard’s reaction is ICONIC (via @A Star Barbers/TT),2024-11-04T16:30:23Z,2291478,65112,643,Sports,0:00:12,yn5-OOI1cN0,2024-11-14T00:00:00Z,0.02841484840788347,0.009875291804890036,252
Celtics Championship Run? Lakers Playoff Hopes & Cowboys Disappointments | Keep It A Buck Ep. KOBE24,2024-11-03T13:00:50Z,161,2,0,Sports,1:02:29,i61YfQszTsM,2024-11-14T00:00:00Z,0.012422360248447204,0.0,253
Cody Rhodes has become the inaugural Men’s Crown Jewel Champion,2024-11-02T20:51:16Z,1669510,82276,1809,Sports,0:00:36,YqCXTx1vKCc,2024-11-14T00:00:00Z,0.04928152571712658,0.021986970684039087,254
How A Midfielder With 99 Shot Accuracy BROKE Football,2024-11-02T16:00:25Z,660843,17547,1125,Sports,0:17:49,VTrL__eHKiA,2024-11-14T00:00:00Z,0.026552448917518987,0.06411352367926142,254
We Won Every Game at the State Fair!,2024-11-02T14:00:00Z,7766234,122707,2383,Sports,0:14:43,9QXxid7t9oM,2024-11-14T00:00:00Z,0.015800064741804072,0.019420244973799374,254
The most dramatic start to a race ever!,2024-11-02T13:00:37Z,460496,2489,325,Sports,0:04:51,tFGrJEBn0_A,2024-11-14T00:00:00Z,0.005405041520447518,0.1305745279228606,254
The Finale!!,2024-11-02T10:51:32Z,1606452,76130,1981,Sports,1:19:08,Z6RZs5Nxvno,2024-11-14T00:00:00Z,0.04739014922325722,0.02602127939051622,254
"Roman Reigns and The Usos stand united before WWE Crown Jewel: SmackDown highlights, Nov. 1, 2024",2024-11-02T02:42:16Z,2375777,63123,2947,Sports,0:11:57,yAiBp4GtR4Q,2024-11-14T00:00:00Z,0.026569412869978958,0.046686627695134895,254
É mentira que você só pode ir pros lençóis de junho a setembro!,2024-11-13T22:30:08Z,3116,113,0,TravelEvents,0:00:43,YK_TJroEJZY,2024-11-14T00:00:00Z,0.03626444159178434,0.0,243
A Somewhere for Riku | A USA Road Trip Story,2024-11-13T18:41:20Z,7425577,297,7,TravelEvents,0:00:16,steL4p1Q_wQ,2024-11-14T00:00:00Z,3.99968918240293e-05,0.02356902356902357,243
A Duel In The Sky 😱,2024-11-13T18:30:01Z,26057570,1512449,10116,TravelEvents,0:00:25,15UcdsKoKK4,2024-11-14T00:00:00Z,0.05804259568332734,0.0066884899920592366,243
🚍 Imagine taking a road trip in this LUXURY motorhome! #rv #motorhome #luxurytravel,2024-11-13T17:39:56Z,288873,11145,218,TravelEvents,0:01:00,44597BABU4U,2024-11-14T00:00:00Z,0.038580968107092044,0.01956034096007178,243
This is a VERY gassy Baboon! 💨 #fart #funnyanimals #farmlife #animals #monkey,2024-11-13T15:31:15Z,154212,12377,1029,TravelEvents,0:00:56,ADPpT50HPps,2024-11-14T00:00:00Z,0.08025964256996862,0.08313807869435243,243
How To Survive In A Subway Tunnel 😵,2024-11-13T13:30:09Z,43100695,2409465,11742,TravelEvents,0:00:27,ExVUZoMcpqM,2024-11-14T00:00:00Z,0.05590315887017599,0.004873280998063886,243
ஸ்ரீ குமரன் தங்கமாளிகையின் காதணியை காதலி விதவிதமாய் காதணி திருவிழா #karur #jwellery,2024-11-13T12:07:08Z,763,27,0,TravelEvents,0:01:01,-Jz1zJbIk-A,2024-11-14T00:00:00Z,0.035386631716906945,0.0,243
Let’s Run the Vegas Half Marathon!,2024-11-13T02:17:53Z,11374577,535847,1163,TravelEvents,0:00:59,uUZG7COSXmw,2024-11-14T00:00:00Z,0.04710918041171992,0.00217039565398332,243
Creating a Dream Mountain Retreat: Building a Scenic Stone-Accented House 🏔️✨ #MountainLiving,2024-11-13T02:00:30Z,2,0,0,TravelEvents,0:22:50,n5ow9Mr0orM,2024-11-14T00:00:00Z,N/A,N/A,243
Colonna Gallery 🇮🇹 | Discover Rome’s Hidden Treasure in 4K Walking Tour,2024-11-12T21:00:30Z,153646,3087,207,TravelEvents,0:46:46,SRpi_re3xfU,2024-11-14T00:00:00Z,0.02009163922262864,0.06705539358600583,244
How To Survive Falling Into A Volcano 😱,2024-11-12T18:30:33Z,30517188,1628157,16254,TravelEvents,0:00:35,c7nAzKMoqjk,2024-11-14T00:00:00Z,0.05335213060915049,0.009983066743563428,244
VISITAMOS SODOMA - A CIDADE DESTRUÍDA DA BÍBLIA,2024-11-12T15:01:06Z,1595489,70491,3458,TravelEvents,0:35:03,ucr4np-7fko,2024-11-14T00:00:00Z,0.04418143904470667,0.04905590784639174,244
Visiting the Slave Trade Market In East Africa,2024-11-12T14:00:53Z,550869,29171,N/A,TravelEvents,0:00:53,pYFQOq_4AZk,2024-11-14T00:00:00Z,N/A,N/A,244
"I Found a Forgotten Village using Satellite Imagery… Then Explored It!""",2024-11-12T14:00:32Z,257281,7039,486,TravelEvents,0:25:50,S37QZerAeEk,2024-11-14T00:00:00Z,0.02735919092354274,0.06904389828100582,244
The Dark Side of Dubai - The Dubai They Don't Want You to See or Know | Full Documentary,2024-11-12T13:30:00Z,3105867,22072,2705,TravelEvents,0:17:33,-YGzHxsqIec,2024-11-14T00:00:00Z,0.007106550280485288,0.12255346139905762,244
How Embalming A Body Works 🤔,2024-11-11T18:30:54Z,4353099,292200,2212,TravelEvents,0:00:31,y2hHECBg_ng,2024-11-14T00:00:00Z,0.0671245933069751,0.00757015742642026,245
How An Anchor Piercing Works 😮,2024-11-11T15:30:05Z,26922394,1193303,7718,TravelEvents,0:00:26,EAOCZ7KAWpo,2024-11-14T00:00:00Z,0.04432380716217139,0.006467762169373579,245
Climbing Mt Fuji was a MISTAKE 😭,2024-11-11T15:10:55Z,19186695,1255616,4754,TravelEvents,0:00:51,AeP0wmTehbI,2024-11-14T00:00:00Z,0.06544201593864915,0.003786189408226719,245
Transforming a Cliffside Gem: Renovating an Amazing Old House & Revitalizing the Garden 🌿🏠✨,2024-11-11T02:00:20Z,1,0,0,TravelEvents,0:22:39,gAfUCNtgrXI,2024-11-14T00:00:00Z,N/A,N/A,245
⚠️UN PUEBLO a una hora en LANCHA de tierra firme. - NUEVA VENECIA,2024-11-10T23:30:12Z,231789,3989,234,TravelEvents,0:37:45,h_W6F02L_2M,2024-11-14T00:00:00Z,0.017209617367519598,0.05866131862622211,246
Olha a audácia desse pessoal,2024-11-10T23:30:05Z,49,2,0,TravelEvents,0:01:27,4wvYpn4TKL4,2024-11-14T00:00:00Z,0.04081632653061224,0.0,246
Sandra upgrades to a G550. #sckaviation,2024-11-10T21:00:05Z,1026268,35821,267,TravelEvents,0:01:00,C1JJ-XAbVzM,2024-11-14T00:00:00Z,0.03490413810037924,0.007453728259959241,246
Firing A Gun In A Submarine 🤯,2024-11-10T18:30:03Z,24992380,1286691,3638,TravelEvents,0:00:28,2WGfZctuBpE,2024-11-14T00:00:00Z,0.05148333211963006,0.0028274076681969484,246
Viaje A La Ciudad Más REMOTA Del Mundo,2024-11-10T18:00:54Z,981753,24423,1113,TravelEvents,0:59:55,v4HdJkbK0xg,2024-11-14T00:00:00Z,0.02487692932947493,0.04557179707652623,246
"Com 14 kg de chocolate, saiu a minha Árvore de Natal.🎄Gostou?",2024-11-10T15:21:49Z,6389292,387564,6552,TravelEvents,0:01:00,i2L8fDsXE_k,2024-11-14T00:00:00Z,0.060658364025309844,0.016905594946899093,246
The Iconic Shredded Painting 🤯 (explained),2024-11-10T13:30:35Z,23339840,1642976,6188,TravelEvents,0:00:33,wUNxJ3wmiv4,2024-11-14T00:00:00Z,0.07039362737705143,0.00376633620941511,246
Rainy Autumn Walk in ENGLAND: Exploring a 1000-Year-Old COTSWOLDS Village,2024-11-10T10:00:10Z,477546,10570,486,TravelEvents,0:54:13,CG6-y_yiAtw,2024-11-14T00:00:00Z,0.022133993374460263,0.04597918637653737,246
The beauty of Yosemite National Park 🏞️ #yosemite #yosemitenationalpark #california #nationalpark,2024-11-10T09:22:07Z,291,7,0,TravelEvents,0:00:53,N3ZnO5C2M5E,2024-11-14T00:00:00Z,0.024054982817869417,0.0,246
Ukrainian Lady Barber Is A HAIR TRANSFORMATION MACHINE  🇵🇱,2024-11-09T22:52:21Z,72630,1137,124,TravelEvents,0:46:25,0ChFNRMe9ig,2024-11-14T00:00:00Z,0.015654688145394464,0.1090589270008795,247
Sealed Within A Wall 😵,2024-11-09T18:30:09Z,36168824,2034238,13823,TravelEvents,0:00:34,D3rAQdzrQ-I,2024-11-14T00:00:00Z,0.05624285710809951,0.006795173426118281,247
Rebuilding A Jaw With Rib Bone 😮,2024-11-09T15:30:16Z,9458204,410987,3620,TravelEvents,0:00:25,sCyJwyaKanI,2024-11-14T00:00:00Z,0.04345296422026846,0.008808064488657792,247
I built the World's BIGGEST Dog House!,2024-11-09T13:00:14Z,10171223,71860,8868,TravelEvents,0:17:01,EzY-psQ_9Cw,2024-11-14T00:00:00Z,0.00706503042947736,0.1234066239910938,247
CAMPING IN HEAVY RAIN WITH A 3-ROOM INFLATABLE TENT,2024-11-09T11:45:01Z,33367504,293501,8648,TravelEvents,0:34:11,S7QGFa7tchE,2024-11-14T00:00:00Z,0.008796013031121536,0.0294649762692461,247
Back to Basics! Transforming a Wooden House & Revitalizing the Garden 🌿🏡 #HomeMakeover,2024-11-09T02:00:21Z,0,0,0,TravelEvents,0:11:46,fibRUBnjeIM,2024-11-14T00:00:00Z,N/A,N/A,247
How To Escape A Raging Bull 😨,2024-11-08T13:30:35Z,30709516,1478516,8337,TravelEvents,0:00:33,w4e-3_a-f0Q,2024-11-14T00:00:00Z,0.04814520684728473,0.005638762110115819,248
"Staying in a Spy's Home, Encounter with Wild Himalayan Mastiff & Motorcycle Breakdown | RL Talkshow",2024-11-08T13:03:00Z,564521,9878,514,TravelEvents,0:24:39,C0G2bIsUSiQ,2024-11-14T00:00:00Z,0.017498020445652154,0.052034824863332656,248
Fly Around the World VR - Tobago Cays (short) a Caribbean Paradise - 8K 360 Video,2024-11-08T12:56:02Z,384863,233,10,TravelEvents,0:03:02,ON3MEIOl-Qk,2024-11-14T00:00:00Z,0.0006054102368894906,0.04291845493562232,248
Dance Fitness #zumba #dance,2024-11-08T12:43:35Z,1498,38,0,TravelEvents,0:01:01,9LWg2_vqVbQ,2024-11-14T00:00:00Z,0.025367156208277702,0.0,248
@ || 51 || 8 November 2024,2024-11-08T03:45:34Z,16,3,3,TravelEvents,0:00:16,20w3RFTQ4-A,2024-11-14T00:00:00Z,0.1875,1.0,248
ASMR Experience the BEST Thai Massage in Krakow Poland!,2024-11-07T23:43:06Z,18883,150,9,TravelEvents,0:42:54,mPoHff4GZwc,2024-11-14T00:00:00Z,0.007943653021236032,0.06,249
Smash Bros creator helped a cosplayer by explaining Link’s sword! #masahirosakurai #zelda #cosplay,2024-11-13T00:34:02Z,26597410,1743734,7067,Gaming,0:00:54,Q-5v4Ly9QYo,2024-11-14T00:00:00Z,0.06556029327667619,0.004052797043585776,243
I’m a lil late to this trend,2024-11-12T22:32:35Z,640,17,8,Gaming,0:00:12,FAWO8_3y_co,2024-11-14T00:00:00Z,0.0265625,0.47058823529411764,244
"IShowSpeed’s $1,000 Gift Leaves a Kid in Tears! 😱❤️#ishowspeed #speed #fyp #viralshort #beautiful",2024-11-12T22:28:12Z,10233,1097,19,Gaming,0:00:42,KKaDaAXz4Xo,2024-11-14T00:00:00Z,0.10720218899638424,0.01731996353691887,244
Descubre a Esta Hechicera | Desafío Pixel Art 🎮 #shorts,2024-11-12T16:15:02Z,15141,473,80,Gaming,0:00:18,XWYoEpzg5n4,2024-11-14T00:00:00Z,0.03123968033815468,0.16913319238900634,244
Winning a victory royal battle royal chap 2 remix,2024-11-12T00:58:42Z,17,4,0,Gaming,0:29:32,jHAtIUChc3k,2024-11-14T00:00:00Z,0.23529411764705882,0.0,244
Magic sword turned into a Cartoon Cat Horror Thrills Lava funny video fun,2024-11-11T16:30:08Z,7708,129,0,Gaming,0:00:14,fgDaLTDUdDw,2024-11-14T00:00:00Z,0.01673585884795018,0.0,245
The Roulette of OP Mobs in Minecraft!,2024-11-11T11:00:29Z,21062014,67753,1611,Gaming,0:17:15,Pa-OvUGWqeg,2024-11-14T00:00:00Z,0.003216833869733445,0.02377754490576063,245
¿PUEDES SOBREVIVIR a las TORRES MÁS ALTAS de LUCKY BLOCK? 😂😱 NOOB vs PRO vs HACKER en MINECRAFT,2024-11-10T18:57:45Z,3625803,38095,1098,Gaming,0:22:00,tqr0WIwljRY,2024-11-14T00:00:00Z,0.010506638115749808,0.028822680141750885,246
새로운 왕조의 탄생 [T1scord 2024 Ep.18],2024-11-10T18:17:35Z,2758524,68626,4978,Gaming,0:25:50,MPcUGG8zvrc,2024-11-14T00:00:00Z,0.024877796966783685,0.07253810509136478,246
A musica perfeita🥰🥰,2024-11-10T15:07:54Z,4,2,0,Gaming,0:00:50,DRGjn5z8KNU,2024-11-14T00:00:00Z,0.5,0.0,246
BOTAFOGO X CUIABÁ | AO VIVO COM IMAGENS DO BRASILEIRÃO SERIE A | ASSISTA AGORA | JOGO DE HOJE | PES,2024-11-10T09:55:47Z,8456,27,0,Gaming,2:16:05,bIkivRPnQMg,2024-11-14T00:00:00Z,0.003192999053926206,0.0,246
A great sacrifice #viral #shortsfeed #minecraft,2024-11-10T09:01:01Z,15170,326,4,Gaming,0:00:17,xSXfdeLN1dM,2024-11-14T00:00:00Z,0.02148978246539222,0.012269938650306749,246
CRUZEIRO X CRICIÚMA | AO VIVO COM IMAGENS DO BRASILEIRÃO SERIE A | ASSISTA AGORA | JOGO DE HOJE |PES,2024-11-10T01:05:20Z,6156,33,0,Gaming,1:09:30,ZF7XEwPRo60,2024-11-14T00:00:00Z,0.005360623781676413,0.0,246
JUVENTUDE X BAHIA | AO VIVO COM IMAGENS DO BRASILEIRÃO SERIE A | ASSISTA AGORA | JOGO DE HOJE | PES,2024-11-10T00:53:28Z,19555,85,0,Gaming,2:02:20,3S-9noZKqJ0,2024-11-14T00:00:00Z,0.004346714395295321,0.0,246
FORTALEZA X VASCO | AO VIVO COM IMAGENS DO BRASILEIRÃO SERIE A | ASSISTA AGORA | JOGO DE HOJE | PES,2024-11-10T00:48:29Z,7014,38,0,Gaming,1:08:00,AVNsFFKKvCc,2024-11-14T00:00:00Z,0.005417735956658112,0.0,246
VITÓRIA X CORINTHIANS | AO VIVO COM IMAGENS DO BRASILEIRÃO SERIE A | ASSISTA AGORA | DIRETO DO PES21,2024-11-09T22:15:18Z,6548,49,0,Gaming,2:16:03,BlK83UfZuIA,2024-11-14T00:00:00Z,0.007483200977397679,0.0,247
The Start of a Brand New City -  Segunda Beach | SB 1,2024-11-09T14:00:07Z,580712,15664,696,Gaming,0:44:56,7mFGEO6Rw5k,2024-11-14T00:00:00Z,0.02697378390665252,0.04443309499489275,247
PALMEIRAS X GRÊMIO | AO VIVO COM IMAGENS DO BRASILEIRÃO SERIE A | ASSISTA AGORA | JOGO DE HOJE | PES,2024-11-09T04:12:40Z,27756,88,0,Gaming,2:14:45,MKVyAS8ZPqM,2024-11-14T00:00:00Z,0.0031704856607580345,0.0,247
INTERNACIONAL X FLUMINENSE | AO VIVO COM IMAGENS DO BRASILEIRÃO SERIE A | ASSISTA AGORA | DIRETO PES,2024-11-09T02:29:02Z,18170,52,0,Gaming,2:23:03,avfCPNWRc44,2024-11-14T00:00:00Z,0.0028618602091359385,0.0,247
Todos los códigos de The Wraith (Geometry Dash 2.2 Vault),2024-11-09T01:59:50Z,1631383,93057,714,Gaming,0:00:19,DjYUZ0pxZEc,2024-11-14T00:00:00Z,0.057041786018366014,0.007672716722009091,247
A Dirty Interview,2024-11-08T18:21:47Z,207525,20944,1450,Gaming,0:08:31,JiLC3xAZJ4o,2024-11-14T00:00:00Z,0.10092278038790507,0.06923223834988541,248
⚡ ¿Puedes identificar a este Pokémon? | Reto de Pixel Art 🎮 #shorts,2024-11-08T16:30:08Z,16170,591,123,Gaming,0:00:18,ZUJx3GBEPBQ,2024-11-14T00:00:00Z,0.03654916512059369,0.20812182741116753,248
1v4 just a second🤯 #foryou #freefire #shorts,2024-11-08T02:22:25Z,123,9,0,Gaming,0:00:24,X6Yu-gHMJ1c,2024-11-14T00:00:00Z,0.07317073170731707,0.0,248
I'm not wearing a disguise,2024-11-08T00:04:16Z,5012,20,N/A,Gaming,0:00:08,_UHTc0Yz4eE,2024-11-14T00:00:00Z,N/A,N/A,248
How fast is a Greatsword?,2024-11-07T18:30:30Z,26741492,1383427,13689,Gaming,0:00:57,ULAwSbzSLgM,2024-11-14T00:00:00Z,0.051733351302911595,0.009894992652304747,249
Hammer Jam Film: A New Character appears!,2024-11-07T12:00:19Z,4530288,111580,3494,Gaming,0:01:26,GajGrj7HLQM,2024-11-14T00:00:00Z,0.024629780711513262,0.031313855529664814,249
CRUZEIRO X FLAMENGO | AO VIVO COM IMAGENS DO BRASILEIRÃO SERIE A | ASSISTA AGORA | JOGO DE HOJE |PES,2024-11-07T03:43:29Z,10910,66,0,Gaming,2:22:00,aIUcJRYkZTc,2024-11-14T00:00:00Z,0.006049495875343721,0.0,249
¿Por qué el imperio Romano de Oriente cambio a los escudos redondos?  #historia #shortvideo,2024-11-06T17:45:45Z,5085,438,1,Gaming,0:00:56,uMefXD-MW-c,2024-11-14T00:00:00Z,0.08613569321533923,0.00228310502283105,250
INTERNACIONAL X CRICIÚMA | AO VIVO COM IMAGENS DO BRASILEIRÃO SERIE A | ASSISTA AGORA | DIRETO PES21,2024-11-06T15:33:33Z,4611,20,0,Gaming,2:07:29,JwFy86Jnib4,2024-11-14T00:00:00Z,0.004337453914552158,0.0,250
BAHIA X SÃO PAULO | AO VIVO COM IMAGENS DO BRASILEIRÃO SERIE A | ASSISTA AGORA | JOGO DE HOJE | PES,2024-11-06T15:10:28Z,5642,32,0,Gaming,2:07:20,sbwUP-g6puo,2024-11-14T00:00:00Z,0.005671747607231478,0.0,250
BOTAFOGO X VASCO | AO VIVO COM IMAGENS DO BRASILEIRÃO SERIE A | ASSISTA AGORA | JOGO DE HOJE | PES,2024-11-06T15:04:43Z,8222,29,0,Gaming,2:07:17,OVEsyMjcWYI,2024-11-14T00:00:00Z,0.003527122354658234,0.0,250
GTA V : Franklin & Shinchan Found A Secret Devil Ghost In GTA 5 In Telugu,2024-11-06T11:15:01Z,181760,1596,137,Gaming,0:22:41,GceSNlO-xD0,2024-11-14T00:00:00Z,0.00878080985915493,0.08583959899749373,250
a terrible chase Siren Head Cartoon Cat Head Lava funny video fun,2024-11-06T04:00:00Z,6092,78,0,Gaming,0:00:06,aFZozoWShlo,2024-11-14T00:00:00Z,0.012803676953381483,0.0,250
Saving my Chickens from a Lava Tsunami in Minecraft #minecraft,2024-11-05T18:03:01Z,84394751,1673379,8179,Gaming,0:01:01,CS_4rq_bZsg,2024-11-14T00:00:00Z,0.01982799854460143,0.004887715215740128,251
Stealing a Super Car in Minecraft…,2024-11-05T17:01:04Z,583030,16794,140,Gaming,0:00:51,zKAZawjp2iM,2024-11-14T00:00:00Z,0.02880469272593177,0.008336310587114445,251
Magic sword turned into a Slendrina Lava funny video cartoon,2024-11-05T16:30:01Z,4078,85,0,Gaming,0:00:14,9js3HIrVWx8,2024-11-14T00:00:00Z,0.020843550760176556,0.0,251
The Search for Minecraft's Far Lands,2024-11-05T02:19:23Z,4242826,37498,5861,Gaming,3:24:44,r_zCM4ueMAY,2024-11-14T00:00:00Z,0.008837977329261205,0.1563016694223692,251
