Title,Date,Views,Likes,Comments,Category,Duration,VideoID,Extracted,LTV,CTL,Diff
vin genyen nan 2boul Cho pou aswè a jodi 13 Novembre 2024 #lotto #boulcho #boulcholoto #culture,2024-11-13T21:43:31Z,63,0,0,FilmAnimation,0:05:26,ce_InQ9sDiY,2024-11-14T00:00:00Z,N/A,N/A,243
The Amateur | Official Trailer,2024-11-13T17:01:08Z,15297286,221943,9404,FilmAnimation,0:02:25,DCWcK4c-F8Q,2024-11-14T00:00:00Z,0.014508652057626432,0.04237123946238448,243
The Grinch’s Christmas Plan! 🎅🎁 | Dr. Seuss' the Grinch | Movie Moments | Mega Moments,2024-11-13T15:00:09Z,2961402,2745,0,FilmAnimation,0:04:15,6EeFqCSy7Sc,2024-11-14T00:00:00Z,0.0009269258276991776,0.0,243
Tom & Jerry 😺🐭| A Frienemy in Need! 🧀| Compilation | Cat and Mouse | Cartoon for Kids | @cnindia,2024-11-13T09:50:09Z,28789730,73759,N/A,FilmAnimation,1:02:04,s0VruXmA__k,2024-11-14T00:00:00Z,N/A,N/A,243
men 2boul Cho pou aswè a kouri all fè fich ou jodi 12 Novembre 2024 #lotto #boulcholotto,2024-11-12T21:44:42Z,15,0,0,FilmAnimation,0:05:50,YRAmzJ9i1SY,2024-11-14T00:00:00Z,N/A,N/A,244
"Not the chicken?! 😱Don't miss #Moana2, only in theaters November 27!",2024-11-12T17:01:04Z,483420,11675,0,FilmAnimation,0:00:30,v5Q2ddKBHIY,2024-11-14T00:00:00Z,0.02415084191800091,0.0,244
¡Juguemos a fingir con PAW Patrol! #shorts,2024-11-12T17:00:57Z,3244407,55365,0,FilmAnimation,0:01:00,w7OlfWYhrVU,2024-11-14T00:00:00Z,0.01706475174045673,0.0,244
La rutina de Peppa Pig a la hora de dormir | Peppa Pig en Español Episodios Completos,2024-11-12T17:00:38Z,2145002,3813,N/A,FilmAnimation,2:05:35,_70t4BK-LRc,2024-11-14T00:00:00Z,N/A,N/A,244
¿Cómo podemos ayudar a Huhu para que duerma? 😴🛌 #Momonsters #clan #tve,2024-11-12T16:30:11Z,58126805,754972,0,FilmAnimation,0:00:59,XVdjNmBgV-E,2024-11-14T00:00:00Z,0.012988362253868934,0.0,244
The adventure begins...Bluey’s World is officially open! 💙🧡 | Bluey,2024-11-12T02:24:07Z,3031553,39650,N/A,FilmAnimation,0:00:16,Em1R0m7Z2E4,2024-11-14T00:00:00Z,N/A,N/A,244
Jolly Gingerbread Cookies | Full Animated Family Christmas Movie | The Bumble Nums,2024-11-11T15:00:36Z,22721006,12323,0,FilmAnimation,0:16:25,YA36bHeOTVM,2024-11-14T00:00:00Z,0.0005423615486039659,0.0,245
Mission: Impossible – The Final Reckoning | Teaser Trailer (2025 Movie) - Tom Cruise,2024-11-11T14:00:07Z,27401295,372647,18422,FilmAnimation,0:02:01,NOhDyUmT9z0,2024-11-14T00:00:00Z,0.013599612719033899,0.049435524772774235,245
How the Grinch Stole Christmas - The Grinch Hates Christmas!,2024-11-11T14:00:53Z,662312,438,0,FilmAnimation,0:02:50,lNLe4svWH6g,2024-11-14T00:00:00Z,0.0006613197405452415,0.0,245
Shaun the Sheep 🐑 Farm Tech gone wrong - Cartoons for Kids 🐑 Full Episodes Compilation [1 hour],2024-11-11T12:00:23Z,2367751,7909,0,FilmAnimation,1:00:08,M8ppDTbaWfA,2024-11-14T00:00:00Z,0.003340300563699477,0.0,245
"Getting Ready for the Launch of Bluey's World in Brisbane, Australia! 💙 🌍 | Bluey",2024-11-11T10:45:20Z,13643514,214804,N/A,FilmAnimation,0:00:31,R3i7IkuPL3Q,2024-11-14T00:00:00Z,N/A,N/A,245
Right in the Target | Tom and Jerry | #shorts #cartoons #tomandjerry #kids,2024-11-11T10:00:03Z,894170,13993,0,FilmAnimation,0:00:53,26eF04-oduQ,2024-11-14T00:00:00Z,0.01564914949058904,0.0,245
A doctor’s insistence #movie #film #shorts #show #viralvideo,2024-11-11T06:38:49Z,4682,286,6,FilmAnimation,0:00:41,sgQcuobeFTU,2024-11-14T00:00:00Z,0.061085006407518155,0.02097902097902098,245
Vin fè lajan avèk aswè a jodia 10 Novembre 2024 la #lotto #boulcholotto #lo #culture #boulcho #music,2024-11-10T20:30:30Z,31,0,0,FilmAnimation,0:05:11,ZZ5qhc81J_E,2024-11-14T00:00:00Z,N/A,N/A,246
Seconde Guerre Mondiale | The Russian Officer | John Malkovich (Film complet en français),2024-11-10T20:00:10Z,2323192,13990,907,FilmAnimation,1:47:03,EFEQSJ78Fdo,2024-11-14T00:00:00Z,0.006021887127710495,0.06483202287348105,246
A Aventura Congelante de Elsa e o Cristal do Ártico,2024-11-10T18:55:20Z,1418,6,0,FilmAnimation,0:04:43,Vq4CvNTJgyw,2024-11-14T00:00:00Z,0.004231311706629055,0.0,246
stewie has a birthday party || Family Guy Recap #familyguy #animatedshorts  #shorts,2024-11-10T18:11:33Z,180,12,0,FilmAnimation,0:00:45,ntjen-q5bHs,2024-11-14T00:00:00Z,0.06666666666666667,0.0,246
"Babies, Minions and Bubble Gum: A DESPICABLE SUPERCUT (Best Scenes) ⚡ 4K",2024-11-10T14:00:01Z,4227867,9318,0,FilmAnimation,0:29:08,1NA4seng3Bw,2024-11-14T00:00:00Z,0.0022039482320517652,0.0,246
We all need a friend like Socqueline! #miraculous  #miraculousladybug  #mlbs5  #derision,2024-11-10T13:00:55Z,1191315,42226,0,FilmAnimation,0:00:42,ozGcf6sM1H8,2024-11-14T00:00:00Z,0.035444865547735065,0.0,246
Mafia et Crime organisé: Quand Naples tombe aux mains d'ados violents - Enquête Mafia Italienne KM,2024-11-10T12:30:06Z,1062336,7070,376,FilmAnimation,0:51:10,8Q5Ak_cnraA,2024-11-14T00:00:00Z,0.0066551448882462795,0.053182461103253184,246
The Thermos | The Fixies | Cartoons for kids | Learning videos,2024-11-10T11:00:10Z,1492765,1995,0,FilmAnimation,0:41:33,Bp6StdH1Iww,2024-11-14T00:00:00Z,0.0013364461251436093,0.0,246
Bicongo a la maca,2024-11-10T10:24:23Z,428,3,4,FilmAnimation,0:01:27,-E_3yuNS7n8,2024-11-14T00:00:00Z,0.007009345794392523,1.3333333333333333,246
Behind the Scenes: Inside a virtual movie production set with DJI Ronin 2 🎬 @thecinemajunkies,2024-11-10T08:45:01Z,111057889,1031451,1019,FilmAnimation,0:00:20,db6gAI_vLSE,2024-11-14T00:00:00Z,0.0092875077069041,0.0009879286558450184,246
Madame Balthazar a Un comportment de kpô ….,2024-11-09T23:23:11Z,70,0,0,FilmAnimation,0:01:34,D-ji5Fj9Zh0,2024-11-14T00:00:00Z,N/A,N/A,247
Paw Patrol | ¡Rubble y PAW Patrol van a pedir dulce o truco! con Skye y Chase | 1 hora | Nick Jr.,2024-11-09T17:01:00Z,19187101,45041,0,FilmAnimation,1:00:09,uXs9_n2FtUo,2024-11-14T00:00:00Z,0.002347462495767339,0.0,247
Do the Spidey | Marvel's Spidey and his Amazing Friends | Disney Jr. Live on Tour | @disneyjr,2024-11-09T14:45:02Z,6218318,783,0,FilmAnimation,0:01:22,Nc2zWSPzd4c,2024-11-14T00:00:00Z,0.00012591829494728316,0.0,247
Dança da Imitação com a Turminha! 🎶 Copie Todos os Movimentos! 🕺🐾#infantil #aprenderbrincando,2024-11-09T14:00:02Z,9962451,119987,0,FilmAnimation,0:00:14,ad1pyuZRdPM,2024-11-14T00:00:00Z,0.012043923729210813,0.0,247
Rubble & a Patrulha Canina Saem por Doces ou Travessuras! com Skye & Chase | 1 Hora | Nick Jr.,2024-11-09T13:01:09Z,6687992,15824,0,FilmAnimation,1:00:09,y30AzXLHUu0,2024-11-14T00:00:00Z,0.002366031538315237,0.0,247
Dog Show - An Actual Short,2024-11-09T13:00:09Z,14065372,917183,4304,FilmAnimation,0:00:53,7p579TYx46c,2024-11-14T00:00:00Z,0.06520858460053527,0.004692629497057839,247
George is a Space Monkey! #shorts,2024-11-09T12:00:45Z,318420,4522,0,FilmAnimation,0:00:34,bFzBoqu6Hu8,2024-11-14T00:00:00Z,0.014201369260724829,0.0,247
A Christmas Dream | 2024 Christmas Movie | Exclusive Hallmark Movie | Lorenzo Pozzan,2024-11-09T11:00:12Z,837944,3505,181,FilmAnimation,1:34:16,7ktREoLFzuE,2024-11-14T00:00:00Z,0.004182857088301843,0.05164051355206847,247
Banda A Loba - Te Esperando Aqui ( Clipe Oficial),2024-11-08T21:00:08Z,5553266,40250,884,FilmAnimation,0:02:51,xWHCKTY8yas,2024-11-14T00:00:00Z,0.007247987040419098,0.021962732919254657,248
"How an FBI ""Scam"" Caught 7 Congressmen",2024-11-08T16:30:01Z,2348482,56503,2225,FilmAnimation,0:24:51,8bmMEZIj270,2024-11-14T00:00:00Z,0.02405937111717271,0.03937844008282746,248
The Ultimate “Inside Out 2” Recap Cartoon,2024-11-08T16:00:56Z,6168259,112902,4061,FilmAnimation,0:04:59,xfNaAsSvjUA,2024-11-14T00:00:00Z,0.01830370611869573,0.03596924766611752,248
Conheça o Conde Mickula | A Casa do Mickey Mouse,2024-11-08T15:26:20Z,743225,18411,0,FilmAnimation,0:00:29,0iS4lQKMbGE,2024-11-14T00:00:00Z,0.024771771670759193,0.0,248
Drifting a Sim is ALOT Harder than Real Life….,2024-11-13T19:53:35Z,1253,48,2,AutosVehicles,0:00:46,8nW_GPoJdDE,2024-11-14T00:00:00Z,0.03830806065442937,0.041666666666666664,243
Lamborghini Revuelto Opera Unica: The Ultimate Hybrid Masterpiece Unveiled in Shanghai,2024-11-13T14:15:01Z,172,7,0,AutosVehicles,0:00:58,G9XHw2E_Sno,2024-11-14T00:00:00Z,0.040697674418604654,0.0,243
Train on a Truck?? #train #railroad #truck #locomotive #heavyhauler,2024-11-13T01:00:27Z,332260,4493,120,AutosVehicles,0:00:58,hF8XpqSShZs,2024-11-14T00:00:00Z,0.01352254258713056,0.026708212775428446,243
Mini Cooper Powered By TWO Hyabusa Engines at The SEMA Show #sickcarsandtrucks #hyabusa #semashow,2024-11-12T18:31:28Z,2054927,72269,796,AutosVehicles,0:00:15,SUuNkCa4IK8,2024-11-14T00:00:00Z,0.03516864589350376,0.011014404516459339,244
Buffalino Camper Tricycle: The Ultimate Minimalist Camper on 3 Wheels,2024-11-12T17:59:12Z,2032,30,6,AutosVehicles,0:06:26,kF2wHo5CE18,2024-11-14T00:00:00Z,0.014763779527559055,0.2,244
Dünya Şampiyonu Toprak Razgatlıoğlu’a BMW’den M1000RR Jesti ! #shorts #bmw #wsbk,2024-11-12T14:35:00Z,463410,7969,95,AutosVehicles,0:00:38,hxxyr5JZmOs,2024-11-14T00:00:00Z,0.01719643512224596,0.011921194629188104,244
2025 Ford Bronco - The Ultimate Off-Road SUV,2024-11-12T07:18:53Z,194,4,0,AutosVehicles,0:08:13,oQ14gozE7ow,2024-11-14T00:00:00Z,0.020618556701030927,0.0,244
Capacitando a la nueva😅🥰 #humor #almacen #situacioneslaborales #bimberos,2024-11-11T19:36:00Z,22074,308,3,AutosVehicles,0:00:16,GeNIbbWDE0I,2024-11-14T00:00:00Z,0.013953066956600526,0.00974025974025974,245
Picking Up UBER Riders In A Mclaren!,2024-11-11T19:11:08Z,656330,21321,766,AutosVehicles,0:19:28,NHzJ8Wx-mhI,2024-11-14T00:00:00Z,0.03248518275867323,0.03592702030861592,245
Nova Ram 1500 | A picape que está redefinindo o poder,2024-11-11T18:15:42Z,6089259,110,18,AutosVehicles,0:00:55,Ks5LApGnNZ8,2024-11-14T00:00:00Z,1.8064595380160377e-05,0.16363636363636364,245
SPENDING 24 HOURS AT A PRIVATE RACE TRACK,2024-11-11T18:00:21Z,677767,16524,616,AutosVehicles,0:25:06,cHmU8fjMy9c,2024-11-14T00:00:00Z,0.024380059814065897,0.03727910917453401,245
"I Tested the BEST All Terrain Tires in the Dry, Wet, Snow, and Dirt!",2024-11-11T17:30:10Z,492335,5529,859,AutosVehicles,0:15:19,hNcbWbdKsQE,2024-11-14T00:00:00Z,0.011230158327155291,0.15536263338759268,245
"Rebuilding A Flooded $2,000,000 McLaren P1 | Part 15",2024-11-11T17:00:06Z,3469963,137758,5265,AutosVehicles,0:54:43,6JDa4h-AYwI,2024-11-14T00:00:00Z,0.03970013513112387,0.03821919598135862,245
Grader Working on leveling gravel to create a new toll road,2024-11-11T15:47:11Z,541,12,0,AutosVehicles,0:00:13,ddKL7UMoxh0,2024-11-14T00:00:00Z,0.022181146025878003,0.0,245
How To Make Mini A Fan AT home Diy Mini Fan science projects,2024-11-11T14:05:21Z,4466,20,4,AutosVehicles,0:04:58,Jrpe9XnyhA8,2024-11-14T00:00:00Z,0.0044782803403493054,0.2,245
How to Reset a Transmission Control Module Chevy (No Tools!),2024-11-11T13:00:57Z,188501,1670,34,AutosVehicles,0:08:31,p0Qs-MAGh0U,2024-11-14T00:00:00Z,0.008859369446315934,0.02035928143712575,245
Detailed wash after a long road trip,2024-11-11T12:09:31Z,886528,63133,181,AutosVehicles,0:00:59,Vhm00uckCVE,2024-11-14T00:00:00Z,0.07121376876985273,0.0028669633947380926,245
#GoGRAND – the new Opel Grandland,2024-11-11T07:36:31Z,18067337,5231,68,AutosVehicles,0:01:19,9yrTJ2lbeuM,2024-11-14T00:00:00Z,0.00028952800293701277,0.012999426495889888,245
I Flew My Parents Onto a Deployed Aircraft Carrier,2024-11-10T18:00:01Z,1239216,35143,1730,AutosVehicles,0:08:03,1519F-YFLC0,2024-11-14T00:00:00Z,0.028359059276187527,0.049227442164869246,246
The 2025 Honda CRV Hybrid Is A Solid Choice For Families Seeking Space & Efficiency,2024-11-10T17:35:58Z,228343,2546,363,AutosVehicles,0:32:03,GBhWXR9FoHk,2024-11-14T00:00:00Z,0.011149892924241164,0.14257659073055773,246
What It's Like to Live with a 2025 Bentley Continental GT Speed (POV),2024-11-10T14:00:35Z,410983,7483,279,AutosVehicles,0:32:59,cmLWsHeVFr0,2024-11-14T00:00:00Z,0.01820756576306076,0.037284511559534946,246
Why A V12 Vantage Is The Aston To Buy In 2025!,2024-11-10T12:00:04Z,123274,4514,312,AutosVehicles,0:21:02,4JZy5P8yG8k,2024-11-14T00:00:00Z,0.03661761604231225,0.06911829862649535,246
You would have never seen a Corvette C7 in India before #supercar,2024-11-10T10:56:11Z,1702448,54255,667,AutosVehicles,0:00:11,-tp1dxHaav4,2024-11-14T00:00:00Z,0.0318688147890567,0.012293797806653765,246
I Bought a Baby Honda NSX!,2024-11-10T10:02:43Z,1244517,29719,1791,AutosVehicles,0:21:02,FuKTi9dG09c,2024-11-14T00:00:00Z,0.02387994699951869,0.060264477270433055,246
¡Espectacular rescate! Conductor sobrevive a una muerte segura!!!,2024-11-09T20:00:07Z,206649,2062,61,AutosVehicles,1:02:19,ojVv-Kl06rs,2024-11-14T00:00:00Z,0.009978272336183577,0.029582929194956354,247
Not a gangster #shorts,2024-11-09T19:58:57Z,6945015,73188,670,AutosVehicles,0:00:06,7FyL2dNczhc,2024-11-14T00:00:00Z,0.010538206180980171,0.009154506203202711,247
I Built a Mini Moto GP Bike,2024-11-09T16:00:13Z,3684542,40518,4146,AutosVehicles,0:13:53,IHZ_E8h_KZc,2024-11-14T00:00:00Z,0.010996753463524096,0.10232489264030802,247
"""2025 Tata Harrier vs Competitors: A Complete Comparison""",2024-11-09T13:07:48Z,878,5,0,AutosVehicles,0:08:06,ismLXk2LFWU,2024-11-14T00:00:00Z,0.0056947608200455585,0.0,247
Transforming A Warship In 20 Minutes: Our 4-year Journey,2024-11-09T13:00:06Z,857882,20000,1222,AutosVehicles,0:23:58,P0LP0e2fBOY,2024-11-14T00:00:00Z,0.02331322955837749,0.0611,247
1. Wheel Loader Caterpillar 992G Loading Coal On The Truck,2024-11-09T04:58:00Z,1115,18,0,AutosVehicles,0:00:15,cP7y7Fss1M0,2024-11-14T00:00:00Z,0.016143497757847534,0.0,247
🔴PORQUE O FAROL DA MOTO QUEIMA RÁPIDO? PEGA A VISÃO E A SOLUÇÃO!🔴,2024-11-09T00:00:32Z,147,13,1,AutosVehicles,0:04:23,1oQRvmgufWE,2024-11-14T00:00:00Z,0.08843537414965986,0.07692307692307693,247
Amazon Mini Jeep gets a Turbo,2024-11-08T20:00:10Z,2612201,47534,1501,AutosVehicles,0:39:49,PpfZHwaIWfM,2024-11-14T00:00:00Z,0.01819691516847287,0.03157739723145538,248
Inside The World's Most Advanced Fighter Jet | F-35,2024-11-08T17:00:05Z,3108943,52943,2585,AutosVehicles,0:29:02,2cLBF4g1Ifw,2024-11-14T00:00:00Z,0.017029260427096928,0.04882609599002701,248
Škoda Kylaq: A new era for Škoda in India's popular sub 4 metre SUV segment #skodakylaq #skodaindia,2024-11-08T11:23:48Z,1176,67,0,AutosVehicles,0:00:53,jsLyiNAwwXs,2024-11-14T00:00:00Z,0.05697278911564626,0.0,248
A Cross Culture with Yaris Cross HEV,2024-11-08T05:00:24Z,37127494,9470,464,AutosVehicles,0:03:11,cLvyzRWFMx0,2024-11-14T00:00:00Z,0.00025506704007547613,0.048996832101372755,248
Heavy Equipment Komatsu Bulldozer Working on leveling gravel for the construction of a new toll road,2024-11-07T22:10:54Z,1938,23,0,AutosVehicles,0:00:15,Oi-wdm2IoZE,2024-11-14T00:00:00Z,0.011867905056759546,0.0,249
Driving the Porsche 992 GT3 Cup car is a DREAM🙌🏻,2024-11-07T15:00:43Z,5128259,78868,114,AutosVehicles,0:00:18,d7Shylq5TnE,2024-11-14T00:00:00Z,0.015379098442570861,0.0014454531622457778,249
अच्छे से TESTING कर ली | Electric vs Petrol Scooty,2024-11-07T13:30:32Z,4571962,154684,245,AutosVehicles,0:00:52,f4W9cEciUoI,2024-11-14T00:00:00Z,0.03383317709114818,0.001583874220992475,249
Guy Turns His Minivan into a Luxury Apartment,2024-11-07T11:15:35Z,685330,47702,1750,AutosVehicles,0:01:00,nG0vu-goceQ,2024-11-14T00:00:00Z,0.06960442414603184,0.03668609282629659,249
The 10 Most Reliable Cars REVEALED!,2024-11-07T11:14:43Z,708408,16109,1253,AutosVehicles,0:11:51,WIezI0WzrXQ,2024-11-14T00:00:00Z,0.022739720612980092,0.07778260599664784,249
'QUÉ MÁS QUIERES' nominada en los Latín Grammy 2024! | The Warning,2024-11-13T20:23:45Z,388572,14896,291,Music,0:00:12,BiRsYek9PRw,2024-11-14T00:00:00Z,0.03833523774229744,0.019535445757250268,243
Getting paid from your music just got a whole lot easier 🤑🤑,2024-11-13T17:57:41Z,1002269,90,1,Music,0:00:20,nivvl3ItGlQ,2024-11-14T00:00:00Z,8.979625230352331e-05,0.011111111111111112,243
A song of hope from Portugal 🇵🇹 Victoria Nicole steps away from the piano & into our karaoke booth,2024-11-13T17:21:09Z,196133,6225,0,Music,0:00:29,NaKPMWX-igE,2024-11-14T00:00:00Z,0.03173866712893802,0.0,243
“Coffee legs and old timey telephones” is a song by what artist?,2024-11-13T16:39:13Z,668279,34825,170,Music,0:00:54,6wGGrmBb49M,2024-11-14T00:00:00Z,0.05211146841364161,0.004881550610193826,243
Rafael Oliveira- A MÃO DO ARADO (Harpa Cristã 394),2024-11-13T15:42:35Z,436643,7876,175,Music,0:03:31,u2xwKW7xGnY,2024-11-14T00:00:00Z,0.018037618832776433,0.022219400711020822,243
Reto a Celeste de hacer la coreo que le identifica 😱,2024-11-13T14:48:44Z,2087472,163833,352,Music,0:00:59,WbcleEHE76k,2024-11-14T00:00:00Z,0.0784839269700384,0.0021485292950748627,243
"La Vaca Lola, La Serie! ¡Únete a sus increíbles aventuras llenas de música y enseñanzas!",2024-11-13T14:00:48Z,314918,6108,0,Music,0:00:37,m6-VRVucEUY,2024-11-14T00:00:00Z,0.019395525184333698,0.0,243
A SNOWY WINTER NIGHT II Winter Ambience Relaxing Music,2024-11-13T10:00:16Z,63,3,0,Music,1:06:34,q5GUtjCZnGU,2024-11-14T00:00:00Z,0.047619047619047616,0.0,243
"“A BEBÊ QUER O QUE” MC Cebezinho , MC Don Juan, MC GP, Menor Richard - DJ Oreia",2024-11-12T21:11:32Z,59622752,234427,3375,Music,0:04:11,MQZsHwf2EOA,2024-11-14T00:00:00Z,0.003931837966821793,0.014396805828680144,244
Daisy Ridley Missed The Inbetweeners Movie Reshoots To Film Star Wars!,2024-11-12T17:00:56Z,459733,7161,322,Music,0:00:23,unPIOpl5wf0,2024-11-14T00:00:00Z,0.015576432407506096,0.044965786901270774,244
For A Thousand,2024-11-12T15:43:35Z,17,0,0,Music,0:02:19,H8cq-WASjNY,2024-11-14T00:00:00Z,N/A,N/A,244
VIVA A PRIMAVERA! | videoclipe infantil com Mabô e Fifi #músicainfantil #desenhoinfantil,2024-11-11T20:45:02Z,683891,9980,0,Music,0:00:40,OnEVuwOgiFI,2024-11-14T00:00:00Z,0.014592968762565965,0.0,245
"Somethin’ ‘Bout A Woman (ft. Teddy Swims) comes out this Friday, November 15! ​⁠@thomasrhettmusic",2024-11-11T19:18:17Z,616536,52243,955,Music,0:00:38,9P8gQriND7M,2024-11-14T00:00:00Z,0.08473633332035761,0.018279960951706448,245
02 - YSY A - DE REPENTE (PROD. BAXIAN),2024-11-11T03:00:42Z,1778000,28581,861,Music,0:03:03,sqqmJEneUsI,2024-11-14T00:00:00Z,0.016074803149606298,0.030124908155767818,245
01 - YSY A - DUELE (PROD. EMIRSITO),2024-11-11T03:00:47Z,2580098,48152,2275,Music,0:02:29,rQJj1-i8KDA,2024-11-14T00:00:00Z,0.01866285699225378,0.04724622030237581,245
10 - YSY A - CURANDO MI KARMA (PROD. ORODEMBOW),2024-11-11T03:00:11Z,1540051,16115,467,Music,0:02:55,HS06JQIS2pg,2024-11-14T00:00:00Z,0.010463939181234908,0.028979211914365498,245
What Makes A Good Album Cover? - Charlie Lubbock,2024-11-10T11:00:25Z,296,10,3,Music,0:08:10,vEWi15k-Ow4,2024-11-14T00:00:00Z,0.033783783783783786,0.3,246
Crack The Code - Nik Burnham / Prod. Tecza,2024-11-09T19:23:53Z,22,1,0,Music,0:00:46,VaFSg3FEEhk,2024-11-14T00:00:00Z,0.045454545454545456,0.0,247
HENN x HIBRID - NEKEM EZ A FLESS (Official Music Video),2024-11-09T18:44:44Z,4717429,23469,383,Music,0:03:21,Q8UuqLAGqHE,2024-11-14T00:00:00Z,0.004974955637912092,0.01631940005965316,247
Confundi a mente da Tatá 😂O programa Lady Night completo tá lá no @Multishow 💜,2024-11-09T15:09:00Z,232439,13764,253,Music,0:00:45,yW1MzxWxjbc,2024-11-14T00:00:00Z,0.059215536119153846,0.01838128451031677,247
quando eu vi o zé bochecha comecei a bochechar ❣️😆,2024-11-09T15:00:01Z,16884685,169156,0,Music,0:00:28,0SdF11-ovwM,2024-11-14T00:00:00Z,0.010018309491708018,0.0,247
"Lady Gaga, Bruno Mars - Die With A Smile (Lyrics)",2024-11-09T14:36:16Z,225378039,1500844,73695,Music,0:04:10,zgaCZOQCpp8,2024-11-14T00:00:00Z,0.006659229118592162,0.04910237173217203,247
"Float like a butterfly, sting like a bee #conductor #classicalmusic #orchestra #symphony #music",2024-11-09T14:00:33Z,5273769,250478,976,Music,0:00:33,ZNmBigN4yCQ,2024-11-14T00:00:00Z,0.047495064725057164,0.00389654979678854,247
Streamers SING Payphone 😭🔥,2024-11-09T03:48:23Z,25775785,913577,7477,Music,0:00:29,PNavWSxemNs,2024-11-14T00:00:00Z,0.03544322704429759,0.008184312871274123,247
HEREDERO - Sabor a Derrota (Video oficial),2024-11-09T00:00:26Z,48583492,289874,11130,Music,0:03:18,KI3pWvM19Pc,2024-11-14T00:00:00Z,0.005966512246587791,0.03839599274167397,247
그대 내 맘에 들어오면은 (조덕배) Come into My Heart (Jo Deok Bae) ❤️ #조덕배 #그대내맘에들어오면은 #발라드,2024-11-08T23:44:15Z,519,22,18,Music,0:00:54,2ZQ61o7pKVs,2024-11-14T00:00:00Z,0.04238921001926782,0.8181818181818182,248
ROSÉ & Bruno Mars - APT. (Official Music Video) + Lyrics,2024-11-08T23:08:22Z,21978684,96273,1624,Music,0:02:54,brXJGufx1tI,2024-11-14T00:00:00Z,0.0043802895569179665,0.01686869631153075,248
Avenged Sevenfold - Seize the Day / Lyrics,2024-11-08T18:56:22Z,1036329,1474,24,Music,0:05:35,7PhxACIldH8,2024-11-14T00:00:00Z,0.0014223282374612694,0.016282225237449117,248
"Aline Barros, Sarah Beatriz - A Promessa Nasceu (Clipe Oficial)",2024-11-08T15:00:08Z,1643770,20146,785,Music,0:05:14,MqTAbY0aysU,2024-11-14T00:00:00Z,0.012255972550904324,0.03896555147423806,248
Musica Infantil 🎩🧚‍♀️Dom Frederico e a Bela Fada Uma Aventura Divertida 💍#shorts #crianças #infantil,2024-11-08T15:00:19Z,12288494,243326,0,Music,0:00:40,8ch_RwaPp8U,2024-11-14T00:00:00Z,0.019801124531614697,0.0,248
"Amado Batista - A VOZ DO AMOR - DVD ""Pétala""",2024-11-08T13:59:03Z,1579698,8384,434,Music,0:04:28,YH3b3hNkOXw,2024-11-14T00:00:00Z,0.005307343555540363,0.05176526717557252,248
We Wish You a Merry Christmas Dance with Lyrics 💃🎄#wewishyouamerrychristmas #christmasdance,2024-11-08T12:15:02Z,292376,4686,35,Music,0:00:15,PSEL1MUaf5c,2024-11-14T00:00:00Z,0.016027307302925002,0.007469056764831413,248
Mike Bahía - AMOR A MITAD (Visualizer),2024-11-08T01:00:07Z,2978614,23483,621,Music,0:03:12,ACykkAwf9rw,2024-11-14T00:00:00Z,0.007883868134642489,0.02644466209598433,248
"KAROL G, Feid, DFZM ft. Ovy On The Drums, J Balvin, Maluma, Ryan Castro, Blessd - +57",2024-11-08T00:00:06Z,224901129,1600036,160927,Music,0:05:02,5r5UePOgMQU,2024-11-14T00:00:00Z,0.0071143973670314475,0.10057711201497967,248
Viktor Sheen – Cígo a káva (feat. Saul) [Text],2024-11-07T23:00:14Z,2477677,9261,98,Music,0:03:15,I-30JqXDMgQ,2024-11-14T00:00:00Z,0.003737775343598056,0.010582010582010581,249
A for Apple ABC song #shorts #abcsong #nurseryrhymes,2024-11-07T23:00:37Z,441022,9851,0,Music,0:01:00,jAMBd6s4IVs,2024-11-14T00:00:00Z,0.022336754175528658,0.0,249
Pretending I Can’t Sing And Then Surprising Everyone with a Rap Remix🇮🇩,2024-11-07T23:00:35Z,1014905,48034,484,Music,0:00:50,fIusSxNx2Ic,2024-11-14T00:00:00Z,0.04732856769845453,0.010076196027813632,249
Todo Se Lo Debo a El,2024-11-07T18:10:37Z,1226948,6356,56,Music,0:03:56,dFOXP7eHjjs,2024-11-14T00:00:00Z,0.005180333640871496,0.00881057268722467,249
The Wildlife of Yellowstone | BBC Earth,2024-11-13T17:00:31Z,3243404,15103,401,PetsAnimals,0:37:33,OmtH_3gSVBE,2024-11-14T00:00:00Z,0.004656527524785688,0.026551016354366682,243
Can a terrified terrier find a home? | The Dog House 🐶 | Dog Stories,2024-11-13T11:28:14Z,30925,996,24,PetsAnimals,0:04:16,V_txAGFALxk,2024-11-14T00:00:00Z,0.032206952303961194,0.024096385542168676,243
Live feed from a Barn Owl nest box. - Additional Camera angles,2024-11-13T10:03:31Z,28476,137,0,PetsAnimals,0:00:00,K2keQ345dDM,2024-11-14T00:00:00Z,0.004811068970361006,0.0,243
Será se ele bateu a senha? KkkKkkkKk,2024-11-12T14:24:11Z,76823,3844,5,PetsAnimals,0:00:39,9LB18WdOPQc,2024-11-14T00:00:00Z,0.05003709826484256,0.0013007284079084287,244
Hamster Adventures In The Movie World: Squid Game 2024,2024-11-12T14:00:01Z,465486,2782,191,PetsAnimals,1:03:31,a_6cbRTv5KY,2024-11-14T00:00:00Z,0.005976549241008322,0.06865564342199856,244
Barn Owl 4 eggs hatched now  - Watch the owlets 24/7 live stream  🦉❤️🦉,2024-11-12T09:23:38Z,17532,134,0,PetsAnimals,0:00:00,2ZueK4xu0SA,2024-11-14T00:00:00Z,0.007643166780743783,0.0,244
A Mother's Watchful Guidance: Ducklings Step Out into the World #duckling #chicks,2024-11-12T06:30:48Z,2265704,35130,39,PetsAnimals,0:00:11,qNnZKJNeA9U,2024-11-14T00:00:00Z,0.015505114525110076,0.0011101622544833476,244
A música é muito boa 🤣🐎,2024-11-11T20:45:00Z,1078905,23481,44,PetsAnimals,0:01:01,MEsDrUg9U-0,2024-11-14T00:00:00Z,0.02176373267340498,0.0018738554576040202,245
Hilarious But Useful Dog Walking Tips,2024-11-11T20:34:27Z,767737,8053,68,PetsAnimals,0:00:19,ifyU9KHdomY,2024-11-14T00:00:00Z,0.010489269111687988,0.008444058114988204,245
Lonely Dog Gets The BEST Surprise Ever | The Dodo,2024-11-11T20:00:01Z,2787053,330331,4656,PetsAnimals,0:00:58,1x7N9BOPRiY,2024-11-14T00:00:00Z,0.118523400882581,0.014094953243867515,245
Getting my Pomeranian to choose from a walk or a bath 🛁 using @sirius-alpha #dog #pomeranian,2024-11-11T19:08:55Z,4115249,259446,2277,PetsAnimals,0:00:12,4LmSBZaXFtI,2024-11-14T00:00:00Z,0.06304503081101533,0.008776392775375223,245
Buffalo 🦬 Moo sound#humba humba sound of a cow,2024-11-11T09:25:13Z,2538864,12722,14,PetsAnimals,0:00:06,e0Mh6CT11yQ,2024-11-14T00:00:00Z,0.005010902513880223,0.0011004559031598806,245
Don’t eat in a toilet.  #puppy #japan #cutedog,2024-11-11T08:00:44Z,205,14,0,PetsAnimals,0:00:14,ocBWn67Agtk,2024-11-14T00:00:00Z,0.06829268292682927,0.0,245
#A I dance #ytshorts#shortsvideo#creator razia,2024-11-11T04:30:05Z,7,2,0,PetsAnimals,0:00:59,ExLhTMkIhUY,2024-11-14T00:00:00Z,0.2857142857142857,0.0,245
Lions and Wild Dogs: A Clash of Survival,2024-11-11T01:43:33Z,3888104,84410,539,PetsAnimals,0:00:23,qpOq8XlzX1c,2024-11-14T00:00:00Z,0.02170981023141356,0.006385499348418434,245
Cat Won't Stop Hissing At Her Pet Sitter | The Dodo,2024-11-10T22:00:32Z,5510919,565644,2086,PetsAnimals,0:01:00,uHdGgkz1j04,2024-11-14T00:00:00Z,0.1026405940642568,0.003687831922551994,246
Um CÃO pode MORRER DE TRISTEZA? 🐶😔 COMO EVITAR?,2024-11-10T20:00:15Z,3485,274,17,PetsAnimals,0:04:37,mweX36OO2G0,2024-11-14T00:00:00Z,0.07862266857962698,0.06204379562043796,246
My Golden Retrievers Gentle Approach to a Terrified Rescue Puppy,2024-11-10T19:00:16Z,4452234,71399,3580,PetsAnimals,0:06:34,YGkSDyh8zYE,2024-11-14T00:00:00Z,0.016036668333245737,0.050140758273925404,246
