Title,Date,Views,Likes,Comments,Video_ID,Category,Extracted: ,LTV,CTL,Diff
Rerooting a haunt couture frankie monster high doll #shorts,2022-04-28T19:00:04Z,1212251,89226,196,GO3BXy57iKs,Entertainment,,7.36035689,0.2196669132,1151
LLEVO LA MILANESA A OTRO NIVEL! #shorts,2022-04-27T23:00:15Z,3100407,284406,958,yxKyYBjh9ZA,Entertainment,,9.173182747,0.3368424014,1152
Heroic Dog Stops Truck To Get Help For Owner Having Seizure | An Animal Saved My Life | A&E #shorts,2022-04-27T15:00:06Z,3578038,282196,4064,4A0ng6vFLZg,Entertainment,,7.886892202,1.440133808,1152
On a classé les 5 meilleures céréales...,2022-04-27T08:00:18Z,765210,59475,2104,7hSI_H8mgQA,Entertainment,,7.77237621,3.537620849,1152
What Is A FingerScooter??,2022-04-25T23:58:43Z,3503287,157498,661,bVXOAIu-oJs,Entertainment,,4.495720733,0.4196878691,1154
"Now you are taking a bath, look at Naina|| # the labraa😃😀😀",2022-04-25T09:54:42Z,197,8,2,d2rlImfo0ik,Entertainment,,4.060913706,25,1154
Why Srikant Slapped The RTO Officer? | The Family Man | Manoj Bajpayee | Amazon Prime Video #shorts,2022-04-25T08:13:06Z,6601885,245972,613,zHzzrq29vFs,Entertainment,,3.725784378,0.2492153578,1154
Hot Dogs a la Parrilla 🔥💨🌭 #Shorts,2022-04-24T18:31:40Z,266994,24118,63,VT04Jj36Jcw,Entertainment,,9.033161794,0.2612156895,1155
When You Think You've Hooked a Giant Redfish... #fishing #shorts #shortsvideo #shortsfeed,2022-04-24T12:42:41Z,169402,8139,118,i4eaCrhAymg,Entertainment,,4.804547762,1.449809559,1155
||A Cinematic Rice Ceremony|| Anurup's Rice Ceremony,2022-04-23T18:30:39Z,13,3,0,nI5FrSIS_IY,Entertainment,,23.07692308,0,1156
,,,,,,,,#DIV/0!,#DIV/0!,#VALUE!
,,,,,,,,#DIV/0!,#DIV/0!,#VALUE!
Everyone receives a certain amount of speaking time each day,2022-05-15T02:10:10Z,14328395,980149,2065,uiAR5PubdTc,FilmAnimation,,6.840605664,0.2106822534,1134
Maul vs General Grievous - A Clone Wars Story Arc We Never Got To See - Star Wars Fast Facts #Shorts,2022-05-14T16:00:50Z,937979,71828,409,chMY6b94c50,FilmAnimation,,7.657740738,0.5694158267,1135
The Colorful Fixies Construction Ride | The Fixies | Cartoons for Children | #ConstructionSet,2022-05-14T15:00:15Z,14044162,11775,0,RSqNkMRAJaE,FilmAnimation,,0.08384266715,0,1135
How to Successfully Escape a Cult? The JOAQUIN PHOENIX Story (Documentary Part 1),2022-05-13T21:11:37Z,111572,2493,230,CY9rk2Csya0,FilmAnimation,,2.234431578,9.225832331,1136
TUTORIAL: How to animate the world around you!,2022-05-10T21:03:19Z,3113365,114915,721,U8fBQ-u1x10,FilmAnimation,,3.691022415,0.6274202672,1139
A inteligência de Lois - Superman 2 (1980) #Shorts,2022-05-10T02:24:48Z,3062812,279134,5054,li8XI7ExjM4,FilmAnimation,,9.113651115,1.810599927,1139
Sonic le salva la vida a una tortuga | #Shorts,2022-05-07T15:00:12Z,15038821,437931,0,x8nQhg1t9bs,FilmAnimation,,2.912003541,0,1142
"Diane EDIT - ""bad girls do it well"" | The bad guys !!SPOILERS!!",2022-05-06T23:08:32Z,2836874,174006,886,nNIcJORARzo,FilmAnimation,,6.133723246,0.5091778444,1143
Ben 10 Misses the School Bus (Minecraft Animation) #shorts,2022-05-03T19:17:42Z,1012499,35846,90,95AIlN3W2hk,FilmAnimation,,3.540349176,0.2510740389,1146
I Built a Roller Coaster for $50! #creatornow,2022-05-03T02:27:55Z,382354,13564,201,_4fpOXZQWUI,FilmAnimation,,3.547497868,1.481863757,1146
Abuela's Best & Weirdest Meals! | Spin the Wheel | The Casagrandes,2022-05-01T13:59:46Z,3191614,14344,0,05DQVrViAS0,FilmAnimation,,0.4494277817,0,1148
O hip hop do pônei | My Little Pony: Contando a sua história | #shorts #MLP @mylittleponyofficial,2022-04-30T14:00:33Z,120365,7143,0,l9gmDf7hdj0,FilmAnimation,,5.934449383,0,1149
George Builds a Classroom Castle! 🐵 1 Hour of Curious George Adventures 🐵 Cartoons for Children,2022-04-30T11:00:49Z,20737170,29072,0,XqPI-dktG2o,FilmAnimation,,0.1401927071,0,1149
A Ram Sam Sam #shorts | Comptine bébé - HeyKids,2022-04-30T08:57:09Z,6685046,111843,0,Xk5KgdjX99s,FilmAnimation,,1.673032616,0,1149
Leaves From The Vine (Little Soldier Boy) 🍃 | Avatar #Shorts,2022-04-27T13:59:52Z,518646,52207,1128,TPwA3DECSbU,FilmAnimation,,10.06601805,2.160629801,1152
You got turned into a genie (FINALE) #wishes #wish #pov #youtubeshorts #shorts,2022-04-27T03:30:12Z,2984710,267276,267,FaIWA_wbp34,FilmAnimation,,8.954839834,0.09989673596,1152
"Are You a Mexican or a Mexican't - Once Upon A Time In Mexico (Johnny Depp, Danny Trejo 4K HD Clip)",2022-04-27T02:30:00Z,152833,4848,79,2K-v1TvMPlI,FilmAnimation,,3.172089797,1.629537954,1152
Meu Amigãozão - O Filme: a maior aventura de todas!,2022-04-25T22:17:13Z,326733,9467,0,DrRfWsKHTRs,FilmAnimation,,2.89747286,0,1154
Trash a Friend | S2 E15 | Full Episode | Coop & Cami Ask the World | @disneychannelanimation,2022-04-25T19:45:00Z,1252731,3925,0,2dTbE2GRZJA,FilmAnimation,,0.3133154684,0,1154
Everyone gets three wishes in their lifetime…she hacked the system. (PART 2) #wishes #shorts ￼,2022-04-23T16:00:11Z,52297741,2821517,3862,hrJ4k1z5SJY,FilmAnimation,,5.395103012,0.1368767227,1156
Big Daddy Attacks a Warehouse #nicolascage,2022-04-22T16:00:06Z,204351,11563,409,ChNgP-IZY4k,FilmAnimation,,5.658401476,3.53714434,1157
I Built A Treehouse For $20!,2022-04-22T02:40:37Z,529648,21038,222,5cq1VwCKdRo,FilmAnimation,,3.972072018,1.055233387,1157
Recreating the Netflix Intro with $30 Worth of Yarn 🧶 #Shorts,2022-04-21T20:19:29Z,47248183,2664898,16739,O52HNleBH4w,FilmAnimation,,5.640212662,0.6281291066,1158
It's a Baby Race | Full Episode Season 2 | Bluey,2022-04-20T15:00:27Z,33446093,126886,N/A,xmkCmJtK6X8,FilmAnimation,,0.3793746552,#VALUE!,1159
Can I Fit Inside The World's Largest Water Balloon?,2022-04-18T21:30:01Z,1916311,71879,228,0KTjotkexRc,FilmAnimation,,3.750904733,0.3171997384,1161
He is a Lurking Legend | One Piece #shorts,2022-04-17T10:24:40Z,1402758,88156,553,G59rRDUIKaM,FilmAnimation,,6.284476724,0.6272970643,1162
Sólo nos necesitamos la una a la otra | My Little Pony: Cuenta Tu Historia | #shorts #MLP #MLPTYT,2022-04-17T09:00:52Z,120675,5784,0,pSxPHX-7IHw,FilmAnimation,,4.793039155,0,1162
Peppa Pig Gets a Boo Boo 🐷🤕 Peppa Pig Official Channel Family Kids Cartoons,2022-04-16T05:00:11Z,13636991,27843,0,ZRHfyOwuSTQ,FilmAnimation,,0.2041726067,0,1163
Paint a Lu-La Easter Egg 🐣💜 | Shaun the Sheep Farmageddon #shorts,2022-04-15T08:15:02Z,419848,10226,0,WwgRUFOC4AY,FilmAnimation,,2.435643376,0,1164
Return of the Roar Part 2 🦁 | S1 E2 | Full Episode | The Lion Guard | @disneyjr,2022-04-14T16:45:04Z,23025707,60674,0,yhswAYgk_LE,FilmAnimation,,0.2635054811,0,1165
Paint a Shaun the Sheep Easter Egg 🐣🎨 #shorts,2022-04-14T10:54:48Z,47918,1218,0,0hu706no19U,FilmAnimation,,2.541842314,0,1165
Paint a Shaun the Sheep Easter Egg 🐣🎨 #shorts,2022-04-14T10:17:14Z,263914,5688,0,fg99ImQdg8I,FilmAnimation,,2.155247543,0,1165
Building a Man From a Robot - Bicentennial Man (Robin Williams 4K HD Clip),2022-04-14T01:00:14Z,119811,3436,24,_UwFFW7wnAA,FilmAnimation,,2.867850197,0.6984866123,1165
The Lincoln Lawyer Season 1 Trailer | Rotten Tomatoes TV,2022-04-13T22:59:34Z,299254,1130,60,u-sLh8-ohzc,FilmAnimation,,0.377605646,5.309734513,1166
What are the top 10 trending songs  is most trending song now What song is trending right now 2022,2022-04-13T09:30:47Z,1599,119,1,Rtunm0PUI6U,FilmAnimation,,7.442151345,0.8403361345,1166
4 personajes que pueden superar a GOJO  #short,2022-04-12T22:57:52Z,1485440,134784,1019,MHtmnZM7k7Q,FilmAnimation,,9.07367514,0.7560244539,1167
little sunflower,2022-04-12T22:06:06Z,15,2,0,8le1U8Ic0Vs,FilmAnimation,,13.33333333,0,1167
Peppa Pig Official Channel | The Biggest Marble Run Challenge with Peppa Pig,2022-04-12T05:00:09Z,27584457,76149,0,J1mAMtJ9T4s,FilmAnimation,,0.2760576364,0,1167
A Great Fall #Shorts,2022-04-10T22:04:53Z,42402236,881588,3096,_9ar9j40zQ8,FilmAnimation,,2.079107338,0.3511844535,1169
Cool Anime,2022-04-10T14:06:11Z,106,6,0,hGZLUtpxpss,FilmAnimation,,5.660377358,0,1169
"Todas Vezes Em Que a Bella Mordeu o Lábio em Crepúsculo! | Sim, Contamos #Shorts",2022-04-09T21:00:10Z,126550,12944,148,XwcIX1cZlyw,FilmAnimation,,10.22836823,1.143386897,1170
How Did Yoda Become A Jedi?,2022-04-09T14:02:50Z,272580,32732,161,frNotZR-rYU,FilmAnimation,,12.00821777,0.4918733961,1170
Building A Movie Theater With $50,2022-04-09T03:39:27Z,1758246,75792,228,cBl842IwrOo,FilmAnimation,,4.310659601,0.3008233059,1170
POV: Your daily life has a timer! ⏰#outoftime #time #caught #shorts #pov,2022-04-08T22:00:07Z,29593627,1537915,1255,JyA1l6_OoTM,FilmAnimation,,5.196777671,0.08160398982,1171
Dr. Bright! SCP-963 is Not a Joy Buzzer!,2022-04-08T14:10:00Z,297541,34968,328,4WkeBE9ztTo,FilmAnimation,,11.75232993,0.9380004576,1171
,,,,,,,,#DIV/0!,#DIV/0!,#VALUE!
,,,,,,,,#DIV/0!,#DIV/0!,#VALUE!
Ali-A Fortnite Icon Skin REVEALED! 😍,2022-05-15T19:00:03Z,639657,30857,875,6NWWTEQdvks,Gaming,,4.823991608,2.835661276,1134
A COFAGRIGUS Of Every Type?! #Shorts,2022-05-15T14:00:21Z,1084276,79781,1346,sKViM5V6_vY,Gaming,,7.35799741,1.687118487,1134
A Mind-blowing Trap | Chess Opening Tricks to WIN Fast #shorts,2022-05-15T08:16:36Z,14735299,1041927,2439,XnD6LlDPeAw,Gaming,,7.070959334,0.2340854974,1134
This is why rust is the best game ever... #shorts,2022-05-15T03:39:06Z,210,11,0,rUgj4Isy5io,Gaming,,5.238095238,0,1134
Aphmau is the CUTEST Enderman!,2022-05-14T20:15:00Z,20327693,822695,4550,Rizx-Bgfy0s,Gaming,,4.04716364,0.5530603687,1135
Do you have a creative mind?,2022-05-14T17:15:02Z,13564644,928612,32542,ndFC8dvu1ag,Gaming,,6.845826547,3.504369963,1135
How to Find and Raid an Ocean Monument in Minecraft 1.21,2022-05-14T14:00:09Z,1250314,19198,487,Ox5Y1RsA9JE,Gaming,,1.535454294,2.536722575,1135
PTFS: Meet The C-130 #Shorts,2022-05-14T09:56:35Z,93700,4675,172,XK6hx0O8Y7w,Gaming,,4.989327641,3.679144385,1135
What is a Barbarian in D&D?,2022-05-12T14:00:02Z,162548,19829,311,6LwtSXYbIQk,Gaming,,12.19885818,1.568409905,1137
"CRAFTING A $1,000,000 ULTIMATE PICKAXE",2022-05-12T02:37:39Z,20550914,118623,2007,WVPjSuVWEhg,Gaming,,0.5772152032,1.691914721,1137
Fortnite Sued a 14 Year Old,2022-05-11T19:33:12Z,2702483,42261,1159,E7yyV7bOAbs,Gaming,,1.56378412,2.742481247,1138
BITTEN by a MEAN SPIDER In Minecraft!,2022-05-11T19:18:45Z,16351932,176573,6538,TqYfS-KSfvw,Gaming,,1.079829588,3.702717856,1138
What is a Druid in D&D?,2022-05-11T14:00:11Z,185331,22703,298,NWRbyXhDBaA,Gaming,,12.24997437,1.312601859,1138
how tall is a minecraft warden in real life?,2022-05-10T00:00:12Z,2847476,147561,628,wwQ5BCZTq_c,Gaming,,5.182168348,0.4255867065,1139
Playing Minecraft As A BABY ENDER DRAGON,2022-05-09T18:00:30Z,12937768,117885,2078,kQCXo6rGI8o,Gaming,,0.9111695309,1.762734869,1140
5 Ways to Find a D&D Group,2022-05-09T14:30:00Z,154952,16522,209,0By-2jv-Go4,Gaming,,10.66265682,1.264980027,1140
Are you a psychopath?,2022-05-08T17:15:01Z,10749850,798477,36360,cA2DRag61Xk,Gaming,,7.427796667,4.553669047,1141
What is a Sorcerer in D&D?,2022-05-08T14:00:08Z,280458,33431,364,L0GWTw9I1Iw,Gaming,,11.92014491,1.088809787,1141
Daniel Negreanu gets a STRAIGHT but...,2022-05-07T12:00:01Z,329786,4265,53,0hUpp07jMmI,Gaming,,1.293262904,1.242672919,1142
ACES vs KINGS at a FINAL TABLE 🤯 #Shorts,2022-05-06T19:25:49Z,1066739,18534,127,Li3Nw7U0J48,Gaming,,1.73744468,0.6852271501,1143
The Story of Super Mario World,2022-05-06T17:00:27Z,7607725,121372,8973,s2bTQK6vbKI,Gaming,,1.595378382,7.392973668,1143
"I AM NOT A KING , I AM NOT A GOD, I AM SPiCE",2022-05-06T06:39:33Z,77,5,0,qm4aw6yWfv0,Gaming,,6.493506494,0,1143
¿Conoces a Mario Calvo?,2022-05-05T18:12:26Z,203135,20314,151,GUOlLQvbNEY,Gaming,,10.00024614,0.7433297233,1144
I Made a WORKING First Person Car Wash in Fortnite!,2022-05-05T17:18:14Z,2602798,155784,835,GiAcF62yxss,Gaming,,5.985251257,0.5359985621,1144
A REAL FUNÇÃO DO BOTÃO ANALOG DO PS2 e como desligar a luz vermelha! #shorts,2022-05-03T22:15:02Z,1245750,120171,581,gRkt35crkRQ,Gaming,,9.646478025,0.4834777109,1146
Do you have a normal mind?,2022-05-01T17:15:00Z,49934025,2487781,520254,LzKjei45Q-o,Gaming,,4.982135928,20.91237131,1148
I Turned an Entire Planet Into 100% Pure Lunacy - Planet Crafter,2022-04-30T19:01:22Z,10449630,224649,7254,ZTpRsEp-_04,Gaming,,2.149827314,3.229037298,1149
How to Start a Minecraft Survival World the Right Way,2022-04-30T14:00:15Z,2822624,50330,1786,MvhzMpDGfYA,Gaming,,1.783092612,3.548579376,1149
"Minecraft, But You Have An OVERPOWERED Pickaxe",2022-04-29T18:00:14Z,15383513,103191,2293,imfy3qenq6c,Gaming,,0.6707895654,2.222093012,1150
High Noon Leona brings glorious fashion to a skinline that badly needs it (part 4),2022-04-27T16:30:11Z,587033,47724,396,evICK27Ma64,Gaming,,8.129696286,0.8297711843,1152
how mobs fight a minecraft boss 😱 #shorts,2022-04-25T14:21:49Z,1039329,61746,247,GsyR-RTvUkM,Gaming,,5.940948439,0.4000259126,1154
How To Get A Gaming Desktop For $200,2022-04-25T09:45:01Z,3942600,165605,1142,jIwaZasaWR4,Gaming,,4.200400751,0.6895927055,1154
"Jeanne d'Arc in Fate is... weirdly accurate, in a way?",2022-04-24T18:00:10Z,1093811,81839,1280,j-03VJQB0Gs,Gaming,,7.482005575,1.564046482,1155
How to Get a SUPER RARE!!! 😜😜😜- Call of the Wild #Shorts,2022-04-24T14:37:46Z,273328,13943,297,vUba79PMAqQ,Gaming,,5.101197097,2.130101126,1155
Making a Toca Life Fortune Teller!? 🔮 (Toca Life Box printable!) #tocalifebox #tocalifeworld,2022-04-23T22:36:53Z,370809,5043,112,cH4nLL0AEQA,Gaming,,1.359999353,2.220900258,1156
Minecraft dungeons com a família! - Casal viril,2022-04-23T16:22:57Z,21,5,1,IzTC_Lc_Zak,Gaming,,23.80952381,20,1156
Mojang added a new source of lore to Minecraft (music disc 5),2022-04-22T14:15:01Z,2892044,296092,1267,Qvh-azWckaU,Gaming,,10.23815682,0.4279075423,1157
I Made a WORKING Doctor Strange Portal in Fortnite!,2022-04-21T17:15:28Z,1402711,101240,399,9jBMPDBAq-0,Gaming,,7.21745249,0.3941129988,1158
What is a Werebear in D&D?,2022-04-20T14:00:06Z,299703,38468,379,5cxbI-AGCD0,Gaming,,12.83537369,0.9852344806,1159
How to Set Up a 2 Point Sling - Airsoft Tips & Tricks #shorts #evike #airsoft #sling,2022-04-20T01:00:01Z,70266,2746,23,a2D_2Cv2lqU,Gaming,,3.908006717,0.8375819374,1159
Me learning a new chess opening,2022-04-19T18:00:10Z,5018042,250712,1365,ITUkJdKejlM,Gaming,,4.99621167,0.5444494081,1160
What is a Werewolf in D&D?,2022-04-19T14:00:09Z,162894,20950,191,DRur4getvLE,Gaming,,12.86112441,0.9116945107,1160
How to Turn a Mob Spawner Into an XP Farm in Minecraft,2022-04-18T14:00:14Z,2070284,31325,889,YASAk8QMXzY,Gaming,,1.513077433,2.837988827,1161
Sonilla doesn't know why she is in a bunny costume (First Uploaded Animation Remake),2022-04-18T11:00:31Z,35,0,1,m6JPp3cEfjM,Gaming,,0,#DIV/0!,1161
A Septic Pump Most Companies Can't or Won't Do,2022-04-15T21:00:03Z,1832712,101927,1470,8RjJGDQM8BQ,Gaming,,5.561539402,1.44220864,1164
,,,,,,,,#DIV/0!,#DIV/0!,#VALUE!
,,,,,,,,#DIV/0!,#DIV/0!,#VALUE!
Easiest hack to crack a Coconut | How to get coconut meat with ease | Kitchen Hacks,2022-05-14T06:29:00Z,219834,3536,76,psvweFdIncU,HowtoStyle,,1.608486403,2.149321267,1135
Cook a meal with a $20 rice cooker! No stove needed!,2022-05-14T05:01:33Z,1138126,55381,236,Zdz46pVRvCY,HowtoStyle,,4.865981447,0.4261389285,1135
I wrote a VEGAN COOK BOOK! Vegan Fast Food! #Shorts,2022-05-12T16:57:59Z,75205,6386,127,GX88jmPrzU0,HowtoStyle,,8.491456685,1.988725337,1137
Yoga pose to release tension and trauma from the hips,2022-05-12T14:10:37Z,1158807,29221,489,6q6t3I_UfxU,HowtoStyle,,2.521645106,1.673454023,1137
The best way to put on a duvet cover - Which?,2022-05-12T13:59:48Z,841601,7591,349,FzbpdAawx4Y,HowtoStyle,,0.9019713617,4.59754973,1137
Mexican salsa in a molcajete | Villa Cocina #shorts,2022-05-11T14:19:29Z,256635,13524,143,vv-h5IajBh0,HowtoStyle,,5.269741072,1.057379474,1138
I love a good ✨voluminous✨ high ponytail 💁‍♀️,2022-05-08T03:40:44Z,4636417,267457,1122,rCiH6sTqon0,HowtoStyle,,5.768613997,0.4195066871,1141
Why Chinese people doing this? And how to use chopsticks in a Chinese restaurant!,2022-05-08T01:58:22Z,19090195,903803,2575,btRDpvWTmBo,HowtoStyle,,4.734383279,0.2849072198,1141
Mom status❤ love mom with our son 😘🥰 Happy mother's day status #whatsappstatus #4kstatus #shorts,2022-05-07T23:31:27Z,73,21,0,eOTSTfbRgA4,HowtoStyle,,28.76712329,0,1142
Making an Ice Cream Slime!,2022-05-07T18:00:10Z,20696805,320942,0,eQml96VGV34,HowtoStyle,,1.550683789,0,1142
A Router Instead of a Jointer? Let's Find Out! | How to Straighten a Board Fast & Easy #Short,2022-05-06T21:10:38Z,222441,6513,75,bgRIVqtRilg,HowtoStyle,,2.927967416,1.151543068,1143
Brewing ginger beer using a homemade ginger bug!,2022-05-06T16:32:18Z,432203,26365,174,tygBM0FPjtQ,HowtoStyle,,6.100142757,0.6599658638,1143
What’s The BEST Bread? #shorts,2022-05-06T15:30:20Z,4219752,158281,5129,7HoSw3467CI,HowtoStyle,,3.750955032,3.240439472,1143
Helicopter Drawing 4T4 #shorts,2022-05-06T03:15:50Z,8752,367,4,QNA9Irl1e3c,HowtoStyle,,4.193327239,1.089918256,1143
Cleaning a worm-infested rug #shorts #rugcleaning #asmr #insider,2022-05-05T19:00:30Z,394809,12395,236,_2-5DUTVvnU,HowtoStyle,,3.139492767,1.903993546,1144
How to Use a Pimple Patch 🤔 | FaceTory,2022-05-04T20:58:37Z,358217,5905,59,uPOAZ51uc14,HowtoStyle,,1.648442145,0.9991532599,1145
How to plant onions with seeds and get a large harvest for the season,2022-05-03T15:48:26Z,154551,4028,25,lb-9s13K9cQ,HowtoStyle,,2.606259422,0.6206554121,1146
Destroying A Shoe For The Perfect Fit! Bespoke Gaziano & Girling Shoes | #Shorts,2022-05-02T16:00:26Z,78964743,1755388,9705,kXJCTUcsnF8,HowtoStyle,,2.223002233,0.5528692232,1147
Turning Ice into a Diamond 🧊💎 #shorts,2022-05-01T21:05:06Z,61857753,4893356,6732,FIRQSAwF0bI,HowtoStyle,,7.910659154,0.1375742946,1148
CH inti auto rikshaw drawing #shorts,2022-05-01T03:15:22Z,8392,378,5,WRTHyPtCZcI,HowtoStyle,,4.5042898,1.322751323,1148
Streax Insta Shampoo Hair Colour Natural Black | How To Color Your Hair Naturally At Home #shorts,2022-04-30T20:10:52Z,338,3,0,_vu6aMjMNFs,HowtoStyle,,0.8875739645,0,1149
How to make a Ginger Bug (Ginger Beer Starter),2022-04-29T15:37:00Z,720120,32979,270,ApcbznhB2KE,HowtoStyle,,4.579653391,0.8187028109,1150
How To Tattoo A Line,2022-04-28T01:52:43Z,1033108,26701,160,HXdqBcwyiYo,HowtoStyle,,2.584531337,0.5992284933,1151
making a Coachella packing list bujo spread! 🌴#YouTubeCoachellaSweepstakes #youtubepartner #shorts,2022-04-24T18:50:36Z,214654,10540,62,Ie9CMGOiesw,HowtoStyle,,4.910227622,0.5882352941,1155
Ciasto a'la Kinder Bueno w 10 minut bez pieczenia?! #shorts #szybkieciasto #ciastobezpieczenia,2022-04-24T17:16:07Z,754285,34117,193,qFPZTv2OIZ0,HowtoStyle,,4.523091404,0.565700384,1155
Easy watercolor painting | Learn how to paint an epic watercolor landscape,2022-04-24T07:00:30Z,1077435,17157,35,vWt5h2sGZ28,HowtoStyle,,1.592393045,0.203998368,1155
YOU don’t need a pasta machine!,2022-04-23T13:24:46Z,7892191,578232,3870,0Ghov-4dE8E,HowtoStyle,,7.326634644,0.6692815341,1156
How To Make The Ultimate Lasagna,2022-04-21T17:00:20Z,1951306,38476,728,qEowX-vOb4E,HowtoStyle,,1.9718076,1.892088575,1158
How To Find The Center of a Circle Quick and Easy,2022-04-20T18:38:43Z,161684,1837,49,3H2vaRxiIaM,HowtoStyle,,1.136166844,2.667392488,1159
How to plant potatoes and get a lot of big tubers,2022-04-20T12:34:52Z,1831450,43953,257,70GdTMnb5Ng,HowtoStyle,,2.399901717,0.5847154915,1159
How To Make a Paper Ninja Star (Shuriken) with Paper,2022-04-20T02:00:07Z,1224,8,0,dXMhZcJLP9A,HowtoStyle,,0.6535947712,0,1159
Satisfying  Video || A beautiful Ring box  #Shorts,2022-04-19T12:20:54Z,959219,49227,462,7vQUiX4fpA8,HowtoStyle,,5.131987586,0.9385093546,1160
How to Make a Boxed Cake Mix Taste GOURMET! (EASY BAKING HACK),2022-04-19T03:33:46Z,450232,20109,262,46QCyXEloBs,HowtoStyle,,4.466364008,1.302899199,1160
Good Friday Special | Are you in a tomb? I English,2022-04-17T08:47:58Z,100,12,0,fOf-cfIbWRo,HowtoStyle,,12,0,1162
How to Unclog a Toilet | Basic Life Skills,2022-04-16T01:00:01Z,3115212,31942,902,-AYj9YUZnUk,HowtoStyle,,1.025355578,2.823868261,1163
"Homemade crusty loaf, with or without a dutch oven",2022-04-14T18:00:05Z,1543570,39539,1471,OI2-6Ps2Hcc,HowtoStyle,,2.561529441,3.720377349,1165
Best Hair Product For A Wet-Look Finish? | Ask MFH | #Shorts,2022-04-14T16:27:18Z,160313,3560,42,osq_d-_slq4,HowtoStyle,,2.220655842,1.179775281,1165
This is YOUR sign to get a MULLET!,2022-04-13T15:00:24Z,309359,15618,173,UVZUTGkNifY,HowtoStyle,,5.048503519,1.107696248,1166
How to bath new born baby in village style.#how to bath#new born baby,2022-04-11T16:42:20Z,382,11,0,WRRfoTGckWc,HowtoStyle,,2.879581152,0,1168
Cow | गाय चित्र | Drawing  #shorts,2022-04-11T03:15:44Z,5469,322,0,QpCMbxwsvHo,HowtoStyle,,5.887730847,0,1168
श्री राम जी आसान चित्र🚩 #shorts,2022-04-10T03:15:11Z,72144,3289,0,P-82niJYuSg,HowtoStyle,,4.55893768,0,1169
How To Make a Brush in PROCREATE #Shorts,2022-04-09T14:00:10Z,1215360,85774,288,8XALsx1gXnE,HowtoStyle,,7.057497367,0.335766083,1170
How To Make The Best Croissants At Home,2022-04-08T17:00:23Z,2012351,37286,794,djnNkLi_K6E,HowtoStyle,,1.852857677,2.129485598,1171
My Moms Stuffed Pepper Recipe | The Golden Balance,2022-04-08T15:00:03Z,13883271,876437,7120,2MJF6QSgAwU,HowtoStyle,,6.312899892,0.8123801254,1171
Making a CUSTOM BART SIMPSON rug! (Part 1) #art #diy #howto #rugtufting #satisfying #craft,2022-04-08T02:00:05Z,224358,9379,36,gxubQAVrFXA,HowtoStyle,,4.18037244,0.3838362299,1171
,,,,,,,,#DIV/0!,#DIV/0!,#VALUE!
,,,,,,,,#DIV/0!,#DIV/0!,#VALUE!
ENNY ft. Jorja Smith - Peng Black Girls Remix | A COLORS MOMENT,2022-05-14T13:00:11Z,197936,14243,115,WSHPLamwxUI,Music,,7.195760246,0.8074141684,1135
"AMAIA sobre CHANEL: ""A mí ella me parece increíble, como baila y como canta"" #Eurovision2022",2022-05-14T07:00:06Z,245945,7507,177,SathKzJZxV4,Music,,3.052308443,2.357799387,1135
When The Enemy Wins The Game For You 🤣🤣🤣 (Apex Legends) #shortvideo #shorts,2022-05-13T17:52:08Z,138,2,0,rhPbfxAEu2M,Music,,1.449275362,0,1136
Ready to Rock|Assam concert|13 May 2022 #shorts #shortsvideo #pawandeeprajan,2022-05-13T13:18:28Z,23426,2382,16,mcO7uW6RQkE,Music,,10.16818919,0.67170445,1136
He's A Pirate 🏴‍☠️ #shorts,2022-05-12T22:28:30Z,386196,40377,374,T6irRjWVh6Y,Music,,10.45505391,0.9262699061,1137
El Día que Luis Miguel Conquistó a Corea #shorts,2022-05-12T21:49:03Z,1044206,55138,347,-YVLUXXxsIk,Music,,5.280375711,0.6293300446,1137
A Igreja Canta - Rádio Gospel Online 24 Horas Ao Vivo,2022-05-12T19:56:22Z,1667775,11473,0,2WbnG0-k9Eo,Music,,0.6879225315,0,1137
"socho ham kitne majbur the Jo Na karna tha vah Kar Gaye 🌷Mr,Abulaish,Alam",2022-05-12T14:47:51Z,41,7,0,X43e8fV-OBA,Music,,17.07317073,0,1137
Rush E on the Most Beat-Up Old Piano Ever,2022-05-12T05:39:20Z,12952440,342556,3769,Cn3VlFwwDl4,Music,,2.644721767,1.10025806,1137
Gibby is too Fat For The Gravity Cannon  Broken 🤣🤣 (Apex Legends) #shorts #shortvideo,2022-05-11T17:13:23Z,1148,28,0,gx3rCXSNviQ,Music,,2.43902439,0,1138
"She's a heartbreaker, She's a Firecracker 🕺 | Ranveer Singh | #jayeshbhaijordaar | #yrfshorts",2022-05-11T13:30:03Z,786860,37224,135,9uWVjHNmOQs,Music,,4.730701777,0.3626692456,1138
A-Lin《摯友 Best Friend》Official Music Video,2022-05-11T12:00:14Z,34291244,88442,3484,vGqpGFH3vh8,Music,,0.2579142361,3.939304855,1138
Finger Dance Shoes Song #Shorts. Tiny Shoes.  W.O. and L.O. Yinz,2022-05-11T06:40:31Z,220,1,0,Ih2dFdR8SCM,Music,,0.4545454545,0,1138
Osage bow from a 100 year old fencepost #novembersouth #traditionalarchery #archery #osage,2022-05-10T23:41:43Z,4331526,137150,698,_rQwF7_fPdI,Music,,3.166320599,0.5089318265,1139
A Night in Tunisia - Charlie Parker Solo Intro,2022-05-10T11:46:55Z,167616,10962,185,uCSkOL0D_3E,Music,,6.539948454,1.687648239,1139
Yeh log kitne cute lag rhe hain na.... just look at sayisha👀she is so cute😘 #pawandeep #shorts,2022-05-10T07:03:46Z,9779,427,3,TfSfv6js7zc,Music,,4.366499642,0.7025761124,1139
Becoming A Youtube Sensation OVERNIGHT 🤯 (w/Charles Berthoud).,2022-05-09T12:00:22Z,121072,6128,77,euGI0PZy9Lg,Music,,5.061451037,1.256527415,1140
Desert Race Song #Shorts.  W.O. and L.O. Yinz,2022-05-08T07:21:10Z,88,5,0,EMI8yP1Mbj4,Music,,5.681818182,0,1141
The Best Way To Start Your Ranked Game 😎😎 (Apex Legends) #shorts #shortvideo,2022-05-07T14:30:58Z,670,18,0,rRTqRPCE9YQ,Music,,2.686567164,0,1142
This simple trick goes a long way! #shorts,2022-05-06T19:38:09Z,44470,3074,25,qkmuJb-yctQ,Music,,6.912525298,0.813272609,1143
How to Play the Invincibility Theme from Mario,2022-05-06T07:36:31Z,1793099,49605,403,NKpJ9QHbBsU,Music,,2.766439555,0.812418103,1143
A Party Ain’t A Party Without SelvaRey,2022-05-05T20:47:25Z,683133,29081,311,IPNEjhBlMM4,Music,,4.257004127,1.069426773,1144
One Clipped Off The Zipline Back To The Lobby 🤣 (Apex Legends) #shortvideo #shorts,2022-05-03T14:19:02Z,1771,35,2,2UyZAqil-gg,Music,,1.976284585,5.714285714,1146
Ala Barfi|Pawandeep Rajan|unseen|coversong #pawandeeprajan #shorts #shortsvideo #mohitchauhan,2022-05-03T10:04:26Z,5235,483,6,_3-VmzlquT4,Music,,9.226361032,1.242236025,1146
How Many Ways Can You Play a Bb?,2022-05-02T21:00:17Z,558171,17551,171,s1o_lYQSXTY,Music,,3.144376902,0.9743034585,1147
When you date a METAL guitarist...,2022-05-02T15:18:42Z,1443383,53717,1206,ffr-q93jE2c,Music,,3.721604037,2.245099317,1147
💕 A Ram Sam Sam 👏👏👏 | Comptines à gestes pour bébé | BB LouLou,2022-05-02T13:00:21Z,22839986,68274,0,QgiZLOl1Vlc,Music,,0.2989231254,0,1147
How to Change a Violin String,2022-05-01T20:08:19Z,49643,1836,16,qLEvGsdosKc,Music,,3.698406623,0.871459695,1148
A Random Wraith Spawned From Out Of No Where?????? 🤣🤣🤣 (Apex Legends) #shorts #shortvideo,2022-05-01T19:59:59Z,1740,34,4,7ZHMZ0-69g0,Music,,1.954022989,11.76470588,1148
Vibing to Firecracker on loop | She’s A Firecracker | Jayeshbhai Jordaar | Ranveer Singh #yrfshorts,2022-05-01T08:30:10Z,965205,42973,158,hArIwoyIGV4,Music,,4.452214814,0.3676727247,1148
How to play A Sky Full Of Stars by Coldplay on piano in 15 seconds 🔥🎹 #pianoteacher #pianotutorial,2022-04-30T07:16:15Z,340829,10968,37,BVxz-ngWyvI,Music,,3.218036024,0.3373450036,1149
