Title,Date,Views,Likes,Comments,Video_ID,Category,Extracted: ,LTV,CTL,Diff
SYMPTOMS OF A BAD AC COMPRESSOR,2022-05-14T18:39:48Z,828102,3111,148,F3Ncw2oapbw,AutosVehicles,6/22/2025,0.3756783585,4.757312761,1135
How to make something stand out in a picture using GIMP,2022-05-13T20:39:27Z,57,1,0,DhPOTQe4XTk,AutosVehicles,,1.754385965,0,1136
Isuzu D-Max - The smart choice or just a disappointment? | ReDriven used car review,2022-05-13T08:00:03Z,205692,4437,422,65bqDhOj1G8,AutosVehicles,,2.157108687,9.510930809,1136
Fixing A Neglected Craftsman Mower #shorts #mower,2022-05-10T19:28:34Z,185676,5144,184,7HdqrQ0TDBQ,AutosVehicles,,2.770417286,3.576982893,1139
SETTING A NEW TEMPO – FIAT PRESS CONFERENCE,2022-05-10T17:40:36Z,245081,326,56,dBozCcFdJUg,AutosVehicles,,0.1330172474,17.17791411,1139
How to Start the Engine if the Smart Key has a Discharged Battery (In Push Button Starters),2022-05-09T05:58:15Z,329869,2758,37,V7WMW7sWkMU,AutosVehicles,,0.8360894779,1.341551849,1140
How to start the engine without pressing the brake pedal (Push Button Starters),2022-05-09T04:40:25Z,616639,5452,196,DZ5zW4dXtVc,AutosVehicles,,0.8841477753,3.595011005,1140
Новый 2022 Mercedes-Benz A-class sedan. ASMR 🔊,2022-05-06T14:38:44Z,519740,16959,645,K5nogU-Li6A,AutosVehicles,,3.262977643,3.803290288,1143
Baby song☺☺# short #video😘😘koyel s.vlog💖💖💖,2022-05-06T10:08:24Z,9,1,0,mGiHABHkAIA,AutosVehicles,,11.11111111,0,1143
A Peek Inside the All-Electric EQS SUV | #shorts,2022-05-04T10:15:00Z,67782,3485,69,9rBpm6u53o4,AutosVehicles,,5.14148299,1.979913917,1145
"WARNING, PLEASE KEEP IN MIND. All your problems are not a DIY Job. You may need a shop. #JTtheCarGuy",2022-05-03T19:00:15Z,200697,4449,308,VGOoQNpjl-4,AutosVehicles,,2.216774541,6.922904023,1146
You're only a 20-minute install away from completely transforming the ride & feel of your Tacoma.,2022-05-03T16:50:03Z,864124,15701,384,9TGnSquXWSg,AutosVehicles,,1.816984599,2.445704095,1146
The 2022 BMW i4 Is a 540-Horsepower Electric M3 Rival,2022-05-03T15:56:13Z,1010202,16742,2555,qmqm5FrRN8A,AutosVehicles,,1.657292304,15.26102019,1146
The Lexus LX600 has an insanely luxurious back seat! 🤯,2022-05-03T09:04:26Z,8260598,443413,4290,hr7GqjiT7wc,AutosVehicles,,5.367807512,0.9674953148,1146
How To Check For Warped Rotors or A Sticky Brake Caliper Easy Fix!,2022-05-01T21:18:15Z,73403,1552,42,yBCand1SZns,AutosVehicles,,2.114354999,2.706185567,1148
Who of you likes to take a walk with the Kia Sportage?! #shorts | jessicarmaniac | PHEV | Hybrid,2022-05-01T07:13:40Z,1409988,32864,301,Vpcegry6TCk,AutosVehicles,,2.330799978,0.915895813,1148
The New 2022 Audi S8 Is a Luxury High-Performance Sedan,2022-04-30T16:06:38Z,767752,19053,2112,tHzSK-wEkQQ,AutosVehicles,,2.481660745,11.08486852,1149
"The ""Odd Rod"" is a 470bhp V8-Swapped Mad Max Style Miata | Top Gear American Tuned",2022-04-29T17:00:16Z,184968,7242,425,Y7tTK1M5JBQ,AutosVehicles,,3.915271831,5.868544601,1150
ALL These RVs are Towable by a Toyota Tacoma! #shorts,2022-04-28T21:01:38Z,112724,4753,72,a_zlLqOzcmE,AutosVehicles,,4.216493382,1.514832737,1151
Who knew the Koenigsegg Regera was a Transformer! 🤯 #shorts #Koenigsegg #supercars #hypercar #hd #ig,2022-04-24T02:00:10Z,25278098,744300,1012,cCnn7v3F644,AutosVehicles,,2.944446216,0.1359666801,1155
What’s a heel/toe downshift? And why should you care?,2022-04-23T03:19:00Z,175446,8344,82,6Bvb2h3aVJY,AutosVehicles,,4.755879302,0.9827420901,1156
Apply A Ceramic Hyperwax To Your Windshield In Under A Minute! - Chemical Guys - Dirty Shorts,2022-04-22T14:30:09Z,148544,6002,43,W8hsxN93tQ8,AutosVehicles,,4.040553641,0.7164278574,1157
The $110K Cadillac CT5-V Blackwing is the end of an era. 😕,2022-04-21T05:33:06Z,2161436,201654,1403,bxWpSclaqrI,AutosVehicles,,9.329630857,0.6957461791,1158
FIRST LOOK: BMW i7 - All-Electric Luxury Saloon with a Backseat Cinema | Top Gear,2022-04-20T12:00:18Z,557830,8163,1498,VOE3fUMD9vo,AutosVehicles,,1.463349049,18.35109641,1159
RS3 Engine in a MK7 Golf R | Owner Spotlight,2022-04-18T12:00:01Z,610553,13988,1046,-gq4Q2SI3w0,AutosVehicles,,2.291037797,7.477838147,1161
WARNING. This why your Push to Start button ignition switch has a No Crank No Start. KIN bad #shorts,2022-04-17T21:30:04Z,329038,3363,88,oCag1CMPlYg,AutosVehicles,,1.022070399,2.61671127,1162
COMO REGULAR A SUSPENSÃO A ROSCA EM CASA,2022-04-16T21:27:00Z,75689,1235,48,9nzQxrCmJS8,AutosVehicles,,1.631676994,3.886639676,1163
The $28K Civic Si is REALLY GOOD! 👀,2022-04-15T15:00:05Z,2689934,214619,2278,c1uep1hh16g,AutosVehicles,,7.978597244,1.061415811,1164
How to paint brake calipers like a Pro 🎨🎨🎨,2022-04-14T22:06:58Z,1414664,67513,386,Z5N3a7UaHjo,AutosVehicles,,4.772369976,0.5717417386,1165
I HAVE A CRUSH ON THE 2023 Wagoneer L Carbide | NY AUTO SHOW,2022-04-13T22:52:48Z,248991,3412,253,twdtXJlW5uY,AutosVehicles,,1.370330655,7.415005862,1166
How to avoid a tint ticket 🤫,2022-04-13T20:25:32Z,3693639,117597,1965,l3iQp1FiQy4,AutosVehicles,,3.183770802,1.670960994,1166
मेवाती आशिकधुलाई देखें A Talim sayar mewati,2022-04-13T11:43:45Z,73,4,0,hLuARqNVWK4,AutosVehicles,,5.479452055,0,1166
"Ja Morant & Anthony Edwards are delivering all the sauce, get it by April 17 at Popeyes on Uber Eats",2022-04-12T18:50:48Z,2988211,161788,980,mgoUWwSLtkM,AutosVehicles,,5.414209371,0.6057309566,1167
If you've never been in a private jet plane you NEED to see this #shorts,2022-04-11T16:00:17Z,138906902,2896551,5092,HPEVOui9PiY,AutosVehicles,,2.085246275,0.175795282,1168
Holley Sniper Stealth Blowing Fuel into a Big Block on the Dyno #shorts,2022-04-11T00:53:31Z,396505,10171,271,L24B4w-PpgA,AutosVehicles,,2.565163113,2.664438108,1168
Newb Dirt Bike Tips | Look like a Pro!,2022-04-10T22:54:35Z,3182388,125191,897,tyMx7iiGCdw,AutosVehicles,,3.933869786,0.7165051801,1169
Proteja e melhore pinturas ESCURAS com a Blend Black Spray!,2022-04-09T22:00:08Z,219233,5653,117,Sl5yZL9dmjA,AutosVehicles,,2.578535166,2.069697506,1170
Como poupar tempo ao remover a sonda lambda | AUTODOC #autodoc,2022-04-08T09:16:32Z,183893,2332,24,fwce8q2BBaA,AutosVehicles,,1.268128749,1.02915952,1171
Is buying a USED Kia Stinger worth the risk?,2022-04-08T08:01:25Z,768709,16250,1482,Gby6H8Rq7-s,AutosVehicles,,2.113933881,9.12,1171
👌🏻Aprende a Lubricar el Kit de Arrastre de Tú Moto y Prolonga su Vida Útil.,2022-04-08T01:11:49Z,874066,52376,331,h5-rdgjVQWQ,AutosVehicles,,5.992224843,0.6319688407,1171
OH YA!! The Greenlight Dually BIGFOOT! #shorts #bigfoot,2022-04-07T18:00:08Z,1766666,36526,0,RdhxQSi5QsI,AutosVehicles,,2.067510214,0,1172
How To Start A Lamborghini Countach | Lets Drive It,2022-04-06T14:47:22Z,3535296,174540,3031,wLby005Zq4o,AutosVehicles,,4.937068919,1.736564684,1173
Mercedes Benz A Class W176 2015 Ambient Lighting Upgrade Retrofit UK - Afterone UK,2022-04-05T22:36:41Z,69333,1245,31,4DsKEzt9dGg,AutosVehicles,,1.79568171,2.489959839,1174
Starting engine number 3 - AN-225,2022-04-05T12:40:29Z,27208324,563924,37088,W_ZvxgtBtM0,AutosVehicles,,2.072615719,6.576772757,1174
Is the NEW 2023 Acura Integra A-Spec a BETTER car than a Honda Civic Si?,2022-04-03T21:30:01Z,462571,12078,2525,Uuc_QzRYpwQ,AutosVehicles,,2.611058627,20.9057791,1176
,,,,,,,,#DIV/0!,#DIV/0!,#VALUE!
,,,,,,,,#DIV/0!,#DIV/0!,#VALUE!
JE FAIS UNE SKINCARE A MA FILLE DE 13 ans ( spécial été ) ❤️,2022-05-15T16:51:11Z,9200700,366078,2956,_PfpnvWYTjs,Comedy,,3.97880596,0.8074781877,1134
A Peek at Pico - SNL,2022-05-15T04:41:53Z,5304088,135710,5420,PLOJutxxj_Q,Comedy,,2.558592542,3.993810331,1134
Filming a silent movie #shorts,2022-05-14T15:37:19Z,6181946,605454,2818,NFIGF8N35CQ,Comedy,,9.79390632,0.4654358547,1135
Box of Lies with Millie Bobby Brown | The Tonight Show Starring Jimmy Fallon,2022-05-14T03:57:11Z,10171078,255438,3394,kY8stpY4rrc,Comedy,,2.511415211,1.328698158,1135
A Challenge For Any Man 😂😂 - K-Von,2022-05-14T00:00:03Z,1994524,137604,1592,Fz1NOzMafVQ,Comedy,,6.899089708,1.156943112,1135
QUANDO A PESSOA É AZARADA - KEIRA RIFF,2022-05-13T23:00:13Z,8589550,661397,1003,tYnwEsYAwQI,Comedy,,7.700019209,0.1516487072,1136
#PostMalone and #TheKidLaroi gave each other one of a kind tattoos! #shorts,2022-05-13T17:38:18Z,138463,6277,39,Z9iZ9GYzQ0I,Comedy,,4.533341037,0.6213159152,1136
GUESS THE SPED UP SONG 🎶,2022-05-12T17:52:24Z,22387650,823157,5354,DEA0j-PK0AA,Comedy,,3.676835219,0.6504227019,1137
The Difference between a great drummer and a good drummer,2022-05-12T08:57:48Z,1783512,76271,1862,tEbeqKUtsiQ,Comedy,,4.27645006,2.441294856,1137
How the Mean Girl is introduced in movies💁🏼‍♀️😭 #shorts #meangirls #moviescenes,2022-05-10T23:49:26Z,28258047,1891926,6351,It2rdE7GaSw,Comedy,,6.695176068,0.3356896623,1139
Brandon Rogers was attacked at a show,2022-05-10T21:55:32Z,1290232,134863,516,w_ZoaUM7HXc,Comedy,,10.45261627,0.382610501,1139
Turn Your Weber Kettle Grill Into A Smoker,2022-05-10T11:29:08Z,178790,4541,137,M8yaxMjXWqI,Comedy,,2.539851222,3.016956617,1139
a te cosa fa ridere?,2022-05-10T08:26:04Z,2968775,79007,476,Re8ff6XA_l8,Comedy,,2.66126601,0.6024782614,1139
Safest way to use the toilet 😂 #shorts,2022-05-09T20:00:01Z,3582631,132899,481,0WJ0-2BARH8,Comedy,,3.709536371,0.3619289837,1140
IF YOU HAVE A SIBLING YOU CAN RELATE TO THIS 😂 - #shorts,2022-05-09T01:34:37Z,38512788,999904,2876,3elEkljj_7w,Comedy,,2.596290874,0.2876276123,1140
Lo que sufrimos los hombres a diario. #Shorts,2022-05-08T20:00:00Z,2396807,114680,3234,2Gbn9g4fsXw,Comedy,,4.784698977,2.820020928,1141
14 Types of Teachers in the Staff Room,2022-05-08T13:00:02Z,10438219,127679,8555,XCLzlfFsP-k,Comedy,,1.223187596,6.70039709,1141
Robbing a Bank Drive Thru,2022-05-07T23:00:47Z,21188754,1189538,4850,78G-DQhILng,Comedy,,5.614006373,0.407721317,1142
I just had a moment 😂,2022-05-05T14:49:37Z,3834800,266476,4546,N230QH98po0,Comedy,,6.948889121,1.705969768,1144
video con UNA SOLA VOCALE (a parte il titolo),2022-05-05T11:15:10Z,1736202,61126,1832,cSQQHfxbel0,Comedy,,3.520673286,2.997087982,1144
Elizabeth Olsen Weighs in on if the Scarlet Witch Is a Hero or Villain in Doctor Strange,2022-05-05T04:00:28Z,1439203,54332,1676,26qgYl10IEw,Comedy,,3.775144993,3.084738276,1144
Is Washing Windows a Good Side Hustle?,2022-05-05T01:41:57Z,55401038,2610106,8691,2WXXf7SmGbk,Comedy,,4.711294398,0.3329749826,1144
A MENINA FEIA EM QUALQUER FILME ADOLESCENTE - KEIRA RIFF,2022-05-04T21:00:19Z,6722891,590188,3079,wHQdXtctjbE,Comedy,,8.778782818,0.5216981708,1145
When You Have A Project Due Tomorrow & You Don’t Have The Board,2022-05-03T22:23:12Z,2776812,115023,324,qNZ5xgXONLQ,Comedy,,4.142268184,0.2816827939,1146
What does a Shamrock Shake taste like??,2022-05-03T19:00:12Z,801791,33875,460,lXVMV8MMMVM,Comedy,,4.224916468,1.357933579,1146
I left Pop Rocks in Raspberry Gin for a week,2022-05-03T17:39:08Z,11827792,1037740,5470,_sUBhn93rQ8,Comedy,,8.773742386,0.5271069825,1146
Nunca más el profe se volvió a meter con ese estudiante 😂,2022-05-02T23:12:10Z,41342135,4892668,10861,lXaMhO-3O58,Comedy,,11.8345799,0.2219852236,1147
COMO MUDAR A COR DA SUA CAPINHA 😱,2022-05-02T22:00:01Z,4339978,413753,1339,6H2GNS_HxfQ,Comedy,,9.533527589,0.3236230311,1147
Is Reselling Shoes a Good Side Hustle?,2022-05-02T10:15:35Z,4668996,314714,1400,8HR4gph7JTE,Comedy,,6.740506953,0.4448483385,1147
Jay Pharoah Does a Denzel Washington Impression #shorts,2022-05-01T22:30:05Z,290880,10730,131,jYR7vosO8To,Comedy,,3.688806381,1.220876048,1148
I Became A Member Of The Royal Family For 43 Minutes,2022-05-01T16:20:12Z,8535485,324382,7899,l0Xw6NMlRQ4,Comedy,,3.800393299,2.435091959,1148
KI A LEGVICCESEBB NÉZŐM?! #7,2022-05-01T13:37:56Z,938713,32993,495,jTIg5gUbEtc,Comedy,,3.514705773,1.500318249,1148
I Hallucinated Using A PingPong Ball (Ganzfeld Effect),2022-04-30T14:33:07Z,299416,17136,236,DsN4rFypeCE,Comedy,,5.723141048,1.377217554,1149
"Jerry Seinfeld has a message for older men wearing jeans: ""you look bad."" #shorts",2022-04-29T18:04:10Z,196915,5963,194,tZepDowJZtA,Comedy,,3.028210141,3.253395942,1150
A MACONHA DO THIAGO VENTURA,2022-04-29T16:12:07Z,3792180,356787,1117,yzyuFbyzj-0,Comedy,,9.408493268,0.3130719449,1150
Are Gumball Machines a Good Side Hustle?,2022-04-29T00:46:19Z,33251235,2295556,10080,RHabx6Rmql4,Comedy,,6.903671397,0.4391093051,1150
The everyday life of fish,2022-04-28T18:48:14Z,44117384,2197653,4455,BG8SONvb-iE,Comedy,,4.981376502,0.2027162614,1151
Фокус 🎩 Как хитрая девочка сделала брата из подушек 👀! Смешно до слез 😂,2022-04-28T10:00:34Z,8983001,213166,N/A,vq4oGSVH0gk,Comedy,,2.372993168,#VALUE!,1151
When The Smart Kid Gets In The Studio,2022-04-27T18:48:49Z,9172756,642929,8988,5B7pBMx_H2k,Comedy,,7.009114818,1.397977071,1152
"I'm such a feminist that I believe in God, because God is a woman... 🎤: Hunter Duncan #Shorts",2022-04-27T16:00:37Z,571861,31549,877,6snRgldK8qo,Comedy,,5.516900086,2.779802846,1152
I'm The Guy From Mr. Beast,2022-04-26T18:45:13Z,72272159,3269168,9497,2ko71sUI0sc,Comedy,,4.523412674,0.2905020482,1153
BTS's Reaction To Trevor Noah's Squid Game Joke At The GRAMMYs 😂 #btsshorts,2022-04-25T15:46:25Z,44898183,1986274,3223,rkwOw1QxvDs,Comedy,,4.423951856,0.1622636152,1154
Superpower ~ You get a Magical Lipgloss 💄 @PragatiVermaa @TriptiVerma,2022-04-25T01:54:18Z,22662402,1517020,1789,_GnynrFZMng,Comedy,,6.69399475,0.1179285705,1154
Superpower~ A world where Your Heartbeat is your Currency 🫀 @Pragati Verma  @Tripti Verma,2022-04-23T02:01:57Z,13757280,904032,6120,fKxks3yaXzk,Comedy,,6.571298978,0.676967187,1156
HOW TO BE A BAD BOY 😈,2022-04-23T02:00:07Z,55657841,1330636,9102,Ijz36jEDJ5U,Comedy,,2.390743112,0.6840338004,1156
,,,,,,,,#DIV/0!,#DIV/0!,#VALUE!
,,,,,,,,#DIV/0!,#DIV/0!,#VALUE!
English alphabet |Learn Alphabet A to Z | ABC Preschool Book Learning A for APPLE Phonetics|#prinit,2022-05-15T01:28:12Z,114044942,290422,0,JhTj_yCWgys,Education,,0.2546557479,0,1134
Como sabemos a caloria dos alimentos?,2022-05-13T14:01:14Z,232163,34052,193,hp0beqkv8ew,Education,,14.66728118,0.5667802185,1136
How to confuse a Python Developer?,2022-05-11T17:00:09Z,2834399,78704,1186,J8CwlpEwHoA,Education,,2.776743853,1.506911974,1138
Crawl Like A Caterpillar 🐛 | Noodle & Pals | Songs For Children,2022-05-11T14:00:18Z,84293452,65539,0,PoZdClg4SQc,Education,,0.07775099779,0,1138
Reakce 😏 Sex a Masturbace je ZLO?,2022-05-11T11:17:46Z,2650,83,3,0eWqqZhO-M8,Education,,3.132075472,3.614457831,1138
Total Hip Replacement,2022-05-10T22:44:14Z,1922534,17594,111,zWb4vbrdP7s,Education,,0.9151463641,0.6308968967,1139
PELICAN SOUNDS | The sound of a Pelican,2022-05-10T21:00:12Z,15965,23,5,_3BZfv0jk1s,Education,,0.1440651425,21.73913043,1139
How DANGEROUS is a BULLET shot in the air? (3D Animation) #Shorts,2022-05-10T04:32:22Z,7067525,512705,1969,t1nRWXw25HM,Education,,7.254378301,0.3840415053,1139
#shorts GLASS Planets | Planet SIZES for BABY | Funny Planet comparison Game for kids | 8 Planets,2022-05-07T23:30:56Z,295952214,3074237,0,SvvZ1Vla3jE,Education,,1.038761278,0,1142
"क्या सही है A or An University | Learn English Articles in 1Minute, English Connection #shorts",2022-05-07T03:29:29Z,3119049,234548,1362,O5BXjIgTNUU,Education,,7.519856213,0.5806913723,1142
How Do Bees Make Honey? | The Science of Food! | SciShow Kids,2022-05-03T10:00:12Z,683404,2503,0,A4YIpGQiD3w,Education,,0.3662548068,0,1146
Blippi Takes a Trip to Netflix! | Netflix Jr #Shorts,2022-05-02T18:30:30Z,332350,6026,0,Z3q92WhtxE0,Education,,1.813148789,0,1147
You Won't Believe How the Rothschild Family Built Their $500B Fortune,2022-05-02T04:00:02Z,775302,42273,867,8W7AF6jyB0o,Education,,5.452455946,2.05095451,1147
Important Lesson From A Psychologist - Dr Julie #shorts,2022-05-01T17:00:14Z,776465,76274,728,JQ9jcQqyrJU,Education,,9.823237364,0.9544536802,1148
Wheels On The Bus (School Version) | Kids Songs | Moonbug Kids - Nursery Rhymes for Babies,2022-04-30T09:00:02Z,148950226,305622,0,3fRIfoPdjLc,Education,,0.2051839787,0,1149
What is perimeter of a Rectangle and how to find it? #math #youtube #mathtrick #shorts #learning,2022-04-30T00:38:41Z,495360,9660,154,BK2P2p1yhpA,Education,,1.950096899,1.594202899,1149
How I Use My Phone as a Camera Monitor #shorts,2022-04-29T23:00:05Z,194180,6537,61,GdCPvENRWHs,Education,,3.366464105,0.9331497629,1150
PHP: Not a programming language,2022-04-29T17:00:34Z,449120,26399,96,lzlhNBpDeps,Education,,5.877939081,0.3636501383,1150
Breaking a BIG myth #LLAShorts 241,2022-04-29T13:30:15Z,14435179,839295,6950,knDkw6w8oAs,Education,,5.814233409,0.8280759447,1150
how to get a better eyesight | Things to do for better eyesight | improve eyesight | Letstute,2022-04-29T11:06:02Z,1152670,49820,147,ddtXqt6XMt8,Education,,4.322139034,0.295062224,1150
How to deep squat! Fixing the problem #shorts,2022-04-27T17:14:42Z,2031178,135084,1024,71mWF9jAw5k,Education,,6.650524966,0.7580468449,1152
Do This the Next Time You’re Studying,2022-04-26T22:22:54Z,13104071,811396,1705,2zUee0Cb318,Education,,6.191938368,0.2101316743,1153
Everything You Wanted To Know About Negative Space (In Under a Minute),2022-04-26T13:13:36Z,10588515,767476,1296,LM56UZkdDBQ,Education,,7.248192971,0.1688652153,1153
The B-Day that Changed D-Day - Extra History #shorts,2022-04-25T17:29:55Z,12447421,764444,2648,7o83vZczieU,Education,,6.141384629,0.3463955502,1154
How Is Cotton Candy Made? | The Science of Food! | SciShow Kids,2022-04-25T10:00:02Z,745136,3058,0,9bNaBpSh0vU,Education,,0.4103948809,0,1154
134 A नियम खत्म ## इस योजना का लाभ उठाए हर वर्ग का व्यक्ति रजिस्ट्रेशन शुरू हो चुके हैं#2022 ।।##,2022-04-25T04:23:45Z,436,12,0,dcbsv0PuPms,Education,,2.752293578,0,1154
Taking Out the Appendix 😱 #shorts,2022-04-23T06:49:45Z,24490449,521955,2515,c9YQf_zsDeM,Education,,2.131259415,0.4818423044,1156
Everything You Wanted To Know About Watercolors (In Less Than A Minute),2022-04-22T14:23:48Z,4552055,436936,998,kvPwV6mm1mg,Education,,9.598653795,0.2284087372,1157
Most of the people are confused in where to invest - Vaasu Challa - #Shorts,2022-04-22T09:19:42Z,1404,78,1,VnWrWB9PGTw,Education,,5.555555556,1.282051282,1157
The World’s Biggest Shawarma?! #romeoeats #RomeyReacts #shorts #shawarma,2022-04-21T14:41:36Z,517953869,4805856,0,dLMd9VJxOSw,Education,,0.9278540595,0,1158
entertainment,2022-04-21T11:36:26Z,341,8,0,1Jxc33oUjy8,Education,,2.346041056,0,1158
Learn how to create a resume in Microsoft Word in 60 seconds? | how to make resume for job? #shorts,2022-04-21T11:28:08Z,1443082,56348,94,4PyxISDyGV0,Education,,3.904698416,0.1668204728,1158
Struggling With A Feeling? Unwelcome Party Guest - Dr Julie #shorts,2022-04-20T16:00:13Z,894322,80770,681,YMdnqu4oD30,Education,,9.031422687,0.8431348273,1159
How to become a millionaire! #LLAShorts 229,2022-04-17T13:30:01Z,6027531,414746,622,9qPz4Cu2RE0,Education,,6.880860505,0.1499713077,1162
6. Frauds using Screen Sharing App / Remote Access- #Shorts,2022-04-17T05:30:08Z,114,1,0,TXgdYcZZivk,Education,,0.8771929825,0,1162
Day in the Life of a Psychology Major,2022-04-16T17:58:31Z,2581666,172793,754,tPTjhjFO_ss,Education,,6.693081134,0.4363602692,1163
OET Reading A Tips to PASS the test!,2022-04-16T09:00:25Z,112796,3574,15,LhZkCizuMzo,Education,,3.168552076,0.4196978176,1163
"All Maps Lie! The Mercator Projection, The Most Commonly Looked at Map In The World, isn't So Right.",2022-04-15T17:37:37Z,5112932,228618,3537,PFM0k53Hr2o,Education,,4.471367896,1.547122274,1164
PICKLING vs FERMENTING - What's the Difference? Quick Grocery Store I.D.,2022-04-15T08:00:03Z,1536581,56293,1611,4ZWEB2t8MJ8,Education,,3.663523107,2.861812303,1164
4. Frauds due to use of Unknown / Unverified Mobile Apps #Shorts,2022-04-15T05:31:16Z,120,4,0,0M71wFN4ang,Education,,3.333333333,0,1164
The myth of Hades and Persephone - Iseult Gillespie,2022-04-14T15:00:46Z,3522380,82528,3144,zLAYGZeVTPQ,Education,,2.342961293,3.80961613,1165
This Is A Grenade Launcher From 1730! #Shorts,2022-04-13T21:00:22Z,24720705,1223703,8270,U-Df0rUjTFw,Education,,4.95011368,0.6758175799,1166
How To Tie The Alberto Knot In Under 50 Seconds #Shorts,2022-04-12T17:00:11Z,1493074,41828,613,MG4QXWfLoC8,Education,,2.801468648,1.465525485,1167
Plummeting Eggs Puzzle / Missing Mole Rat Princess FULL EPISODE 👑 The Creature Cases,2022-04-12T14:00:01Z,10252351,19883,0,IebgHkAh17U,Education,,0.1939360055,0,1167
Can You Draw A UX Wireframe In 57 Seconds?,2022-04-12T11:46:53Z,71320,3291,20,iXzFCPYv0qw,Education,,4.614413909,0.6077180188,1167
,,,,,,,,#DIV/0!,#DIV/0!,#VALUE!
,,,,,,,,#DIV/0!,#DIV/0!,#VALUE!
the new #doctorwho is a charmer 😏 #sexeducation,2022-05-15T17:30:05Z,1024637,41072,157,4vnVSRK96Cw,Entertainment,,4.008443966,0.3822555512,1134
Brits Trying Cannabis For The First Time,2022-05-13T19:00:08Z,4688494,197383,6509,T3IpfShzMnk,Entertainment,,4.209944601,3.297649747,1136
Osvaldo Ríos estuvo a punto de casarse con Shakira,2022-05-13T17:20:28Z,317432,5991,237,0XZ4pmF7jZ0,Entertainment,,1.88733335,3.955933901,1136
The Khatra Khatra Show | द खतरा खतरा शो | Tejasswi Answers A Funny Question | Promo,2022-05-13T15:24:26Z,1545183,89803,38,aU2qvvfKkcs,Entertainment,,5.811803521,0.04231484472,1136
"Saray, Çift Başlı Kurt'a emanet 🏹 - Destan #shorts",2022-05-13T14:26:13Z,337610,15725,60,H-yBG26Nxk0,Entertainment,,4.657741181,0.3815580286,1136
How fast can you solve a Giant Rubik’s cube? 🤔,2022-05-13T00:33:44Z,14421075,788678,1464,he9-5juYuR8,Entertainment,,5.468926554,0.1856270874,1136
Burrito looks like an ad for a diaper #Shorts,2022-05-12T16:00:28Z,152276,6305,117,zbyJggYs-Ak,Entertainment,,4.140508025,1.855670103,1137
Puse a prueba esta herramienta para limpiar los audífonos,2022-05-11T22:37:07Z,10372065,1223530,2538,dizW9i76KDc,Entertainment,,11.79639734,0.2074325926,1138
A 22-Year-Old Woman Trapped In The Body Of An 8-Year-Old #IamShaunaRae,2022-05-10T14:00:09Z,3262960,111880,1138,QHRQ4PB2OEo,Entertainment,,3.428788585,1.017161244,1139
The Most Hyperrealistic Cake Ever Made!,2022-05-07T14:08:14Z,47362540,2400907,6650,pvWTGLCWXwQ,Entertainment,,5.069210815,0.2769786585,1142
sunny smoothie bowl #shorts,2022-05-07T14:00:17Z,11564168,725568,1663,sYpenscAUPo,Entertainment,,6.274277579,0.2291997442,1142
The best worst magicians 😆 | #shorts,2022-05-07T13:00:01Z,33539181,791549,1029,5ptwbBELqrc,Entertainment,,2.360072537,0.1299982692,1142
The BEST Fidgets to Bring to an Amusement Park! 🎢,2022-05-06T19:44:29Z,9559580,396109,1896,pYd-4DfTMXc,Entertainment,,4.143581622,0.4786561275,1143
I Made a Hyperrealistic Self Portrait Cake 😱,2022-05-06T14:17:53Z,44642024,3163744,16455,9sj4c_ue_d4,Entertainment,,7.086918819,0.5201116146,1143
Shorts: Learning to ride a Onewheel,2022-05-06T13:02:46Z,13692487,818151,2126,ICMD4q3OMEs,Entertainment,,5.975181864,0.2598542323,1143
How Legit are the Weapon Combos from the Game Sifu? #shorts,2022-05-06T00:00:11Z,679777,51473,138,qGxRUvoGGys,Entertainment,,7.572042008,0.2681017232,1143
Can you break the 1x1 world record? 🤔,2022-05-05T22:58:03Z,148787588,5832099,12150,dU9l_QYgWxE,Entertainment,,3.919748333,0.2083297969,1144
Matthew Perry Took a Prop from the #Friends Set for Lisa Kudrow #TBT #Shorts,2022-05-05T18:30:39Z,672425,24857,253,naYjx_J2yl8,Entertainment,,3.696620441,1.017821942,1144
How Michelin-Starred Rezdôra in NYC makes a giant raviolo with a runny egg yolk inside #shorts,2022-05-05T16:47:35Z,2290736,67213,725,O_XZoKy3_9M,Entertainment,,2.934122483,1.078660378,1144
sewing my grandma a dress for my ✨wedding✨,2022-05-04T22:00:18Z,10330679,849918,3942,rzZON8M-zCk,Entertainment,,8.227126213,0.4638094499,1145
"Honestly, not a bad workaround for people who are bad with secrets 🤔 #YoungSheldon",2022-05-04T20:00:06Z,2743261,126833,216,Zle99E3bmx8,Entertainment,,4.623439038,0.1703026815,1145
DOCTOR REACTS: HOW TO NOT REMOVE AN INGROWN TOENAIL! #shorts,2022-05-04T14:58:09Z,7541107,111574,788,MeOB1qIG_0Q,Entertainment,,1.479544051,0.7062577303,1145
"Puse a prueba estos rayos x para ver a traves de las paredes ""Walabot""",2022-05-03T22:23:10Z,15634805,1692336,4662,jWiV4bWsDl4,Entertainment,,10.82415802,0.2754772102,1146
How to make a triple beyblade launcher! #Shorts #Crafts,2022-05-03T21:40:21Z,1165407,32338,96,_WnmSLGj_NI,Entertainment,,2.774824589,0.2968643701,1146
BIGFOOT’S GROWL SHOCKS HUNTER | The Proof Is Out There | #Shorts,2022-05-03T21:35:53Z,2740264,118244,7393,wnbia7iD0r8,Entertainment,,4.315058695,6.252325699,1146
A Day In The Life Of Mythical Chef Josh,2022-05-02T10:00:17Z,1412652,97332,558,gelOE49mLxo,Entertainment,,6.890019623,0.5732955246,1147
Amizade Patrick e Bob Esponja | Netflix Brasil,2022-05-01T20:00:05Z,36422668,1003469,0,0Hqr99jDNvg,Entertainment,,2.755067256,0,1148
Rampando lombada com a MTB,2022-05-01T13:58:46Z,3410,94,0,yWbNoW4cuX4,Entertainment,,2.75659824,0,1148
Trilha de aro 26 do grau (A pior burrise q ja fiz em minha vida),2022-05-01T13:23:52Z,70,6,3,gX3t8kflm3g,Entertainment,,8.571428571,50,1148
How to tighten a loose headset | Fix bicycle headset,2022-05-01T09:47:09Z,551165,15389,85,P4me_yAQ8h8,Entertainment,,2.792085855,0.5523425824,1148
Vlad and Niki and useful stories about good behavior from their life,2022-04-30T06:00:06Z,579025144,1845183,N/A,DEWdz8AInfk,Entertainment,,0.3186706172,#VALUE!,1149
How to cover a cake with chocolate ganache #shorts,2022-04-29T17:21:39Z,6875205,494602,1635,DXnAeRpDzxg,Entertainment,,7.193996397,0.330568821,1150
ADLEYS TWiN MERMAiD!! Melody the Lost Mermaid of pirate island is back as a Real Kid! new 3D cartoon,2022-04-29T15:03:19Z,28137301,69809,1701,6IzDQzlcRac,Entertainment,,0.248101266,2.43664857,1150
How To Pressure Wash A Driveway,2022-04-29T00:42:03Z,9096536,328189,963,B6SmN3teXaw,Entertainment,,3.607845888,0.2934284818,1150
How fast can I solve a hamburger? 🍔,2022-04-28T22:48:52Z,27097679,1136670,3343,rzSo0u0eUIc,Entertainment,,4.194713503,0.2941047094,1151
