Title,Date,Views,Likes,Comments,Video_ID,Category,Extracted: ,LTV,CTL,Diff
"Jo Bhi Dekhe Bole, She’s A Firecracker 🎶 🔥 | Jayeshbhai Jordaar | #yrfshorts",2022-04-29T15:00:31Z,1157332,44201,188,bi_6pq1tk1s,Music,,3.81921523,0.4253297437,1150
Aprende a tocar el ritmo de Huapango  #shorts #viral  #guitar #mexico #2022 #huapango,2022-04-29T00:55:51Z,161093,8010,71,2xJymQssJIU,Music,,4.972283091,0.88639201,1150
Drawing Plants vs. Zombies With a Piano (Live MIDI Art),2022-04-28T16:18:10Z,331282,22553,444,2vXjCxALZAY,Music,,6.807795171,1.968695961,1151
FIORE A MARZO 🌼 Una canzone sulla timidezza #shorts,2022-04-28T10:30:00Z,246578,19359,632,aUpM06nfRrk,Music,,7.851065383,3.264631438,1151
People Swimming In The Waterfalls Basin #shorts #youtubeshorts #viral,2022-04-27T21:47:05Z,1645,39,11,3yZKfpBBZBo,Music,,2.370820669,28.20512821,1152
What a voice!! Can’t wait for y’all to hear Alexandra Kay out on the road #shorts #timmcgraw,2022-04-27T13:29:43Z,1488308,76835,1418,lzuYQ9GeY3s,Music,,5.162573876,1.845513113,1152
I Wrote a Song Using Only HATE COMMENTS 3 - Madilyn Bailey #shorts,2022-04-27T12:46:11Z,2530533,168405,13918,bBn4VWiPjBE,Music,,6.654922105,8.26460022,1152
Go Easy on Me Recorder #goeasyonme #adele #recorder #flute #tutorial  #trending #viral #cover,2022-04-26T09:57:01Z,318,6,1,dWGnBpYF4Ic,Music,,1.886792453,16.66666667,1153
streets (doja cat) but as a movie soundtrack (violin solo) #shorts,2022-04-26T01:04:50Z,271664,29936,418,lilViTj0XqI,Music,,11.01949467,1.396312133,1153
THIS TEAM GOT DESTROYED! (At The End) (Apex Legends) #shorts #shortvideo,2022-04-25T21:18:56Z,2373,27,5,NDqN-dzablY,Music,,1.137800253,18.51851852,1154
Como fazer a repicada no pandeiro!,2022-04-24T17:29:05Z,152500,9557,42,mwlAorx6Qyc,Music,,6.266885246,0.4394684524,1155
A Dormir (Feat. ARAFA) ♫ Plim Plim ♫ Canciones Infantiles Para Dormir,2022-04-23T14:00:13Z,23835698,37678,0,281-AzR64Gc,Music,,0.1580738269,0,1156
A MÚSICA MAIS BONITA DO MUNDO,2022-04-22T14:56:36Z,440625,33025,539,UmCHIZT7Djs,Music,,7.495035461,1.632096896,1157
A bop called “Do you trust Scott Morrison?”,2022-04-21T08:24:31Z,361671,19239,520,HiPUs3UrKTw,Music,,5.319475435,2.702843183,1158
,,,,,,,,#DIV/0!,#DIV/0!,#VALUE!
,,,,,,,,#DIV/0!,#DIV/0!,#VALUE!
Une mystérieuse porte a été prise en photo sur Mars…,2022-05-15T14:52:40Z,375680,19744,580,waaAe_eilq4,NewsPolitics,,5.255536627,2.937601297,1134
Student debt: Is a degree worth the financial strain?,2022-05-15T13:11:00Z,192191,2812,1138,tk_Iie0ZyAk,NewsPolitics,,1.463127826,40.46941679,1134
"Florence Welch says when she tries to take a break from music, inspiration draws her back in #shorts",2022-05-13T15:16:44Z,219688,16697,158,Oyb5vDZe10U,NewsPolitics,,7.600324096,0.9462777745,1136
City of a Thousand': Ep. 1 Downtown Phoenix's tent city explodes at alarming rate,2022-05-12T04:28:35Z,1883942,16756,9722,CMQVu26-nIg,NewsPolitics,,0.8894116698,58.0210074,1137
윤석열 대통령의 첫 출근 (feat. 반려견 3마리) / 채널A #shorts,2022-05-11T06:45:55Z,1114856,22849,2562,We4FrY_TcKo,NewsPolitics,,2.049502357,11.21274454,1138
윤석열 대통령 취임식서 35번의 ‘자유’ / 채널A #shorts,2022-05-10T07:36:47Z,159258,4442,402,IIOu_1mcU7Q,NewsPolitics,,2.789184845,9.049977488,1139
한동훈 청문회...한OO 영리법인의 정체? / 채널A #shorts,2022-05-10T04:49:42Z,463923,14644,1184,icgRIl1RPNk,NewsPolitics,,3.156558308,8.085222617,1139
Why It’s So Expensive To Live In The U.S.,2022-05-09T16:00:44Z,2170789,16096,4848,xANwNonI9aw,NewsPolitics,,0.7414815535,30.11928429,1140
Raise the Next Generation in a Community of Like-Minded People,2022-05-07T20:30:02Z,277117,21696,520,GfqIRpHTioU,NewsPolitics,,7.829184063,2.396755162,1142
DRIVING LESSON 14 - ROAD SIGNS FOR DRIVING TEST,2022-05-06T17:00:09Z,386205,3034,161,BziEPo4aNFI,NewsPolitics,,0.7855931435,5.306526038,1143
Hannity roasts Joy Behar for a ‘derange[d]’ Trump blame moment,2022-05-05T20:15:02Z,655497,13600,1422,_OmvHLpmvKs,NewsPolitics,,2.074761593,10.45588235,1144
"A Ayuso:""Llaman vagos a quienes reciben una ayuda para comer pero ensalzan a los que van de palco""",2022-05-05T11:05:52Z,3357487,87723,2653,SJ30_BAF5uI,NewsPolitics,,2.612757696,3.024292375,1144
"Cuerpo ""resucita"" antes de ser enviado a la morgue #Shorts",2022-05-04T19:39:29Z,471595,14703,121,Z20hZkWFpv4,NewsPolitics,,3.117717533,0.8229613004,1145
"DEG DEG; Muxu salka kuhaaya qilaafka A Madobe & Deni, Kenya oo Ahmed Madobe kacodsaday inuu Deni",2022-05-04T15:02:18Z,1845,20,5,Ph5olxehdu4,NewsPolitics,,1.08401084,25,1145
"The Power of Big Oil, Part Three: Delay (full documentary) | FRONTLINE",2022-05-04T02:00:09Z,1165365,9993,1480,R8UOJqs5F9Q,NewsPolitics,,0.8574995817,14.81036726,1145
I Don’t Care What The Bible Says | Ana Kasparian,2022-05-03T21:01:37Z,328662,17881,9272,yQOyx0k6YG8,NewsPolitics,,5.440543781,51.85392316,1146
To Destroy a Human Life Is a GREAT EVIL,2022-05-03T18:15:03Z,1296929,71691,6829,TUGtAMUcjBE,NewsPolitics,,5.527750555,9.525602935,1146
La India compra petróleo ruso a precio de saldo,2022-05-03T11:00:00Z,232773,7062,559,3G9bUTYTq2E,NewsPolitics,,3.033857019,7.915604645,1146
"DEG DEG; Qorshe xumida Deni iyo A Madobe, jabkii kudhacay maamulada Jubaland & Puntland, NN oo",2022-04-29T07:38:53Z,2152,25,1,We0FnH3J1Ys,NewsPolitics,,1.161710037,4,1150
"김정은, 열병식서 할아버지처럼 ‘흰 원수복’ / 채널A #shorts",2022-04-27T07:41:24Z,215538,2267,132,YTTLSZPLYBc,NewsPolitics,,1.051786692,5.822673136,1152
The Power of Big Oil Part Two: Doubt (full documentary) | FRONTLINE,2022-04-27T02:00:08Z,1178033,8109,1296,qMe-BYUIPLU,NewsPolitics,,0.6883508357,15.98224195,1152
The Bin Laden Papers: Examining the documents seized from the al Qaeda leader's compound,2022-04-26T13:52:36Z,4929204,38877,6870,GyHZqX6QlSU,NewsPolitics,,0.7887074668,17.6711166,1153
Bolsonaro defende perdão a Silveira e volta a dizer que ''só Deus'' o tira da presidência #shorts,2022-04-25T19:03:45Z,123487,1973,234,qXMhjy3E8Nw,NewsPolitics,,1.597739033,11.86011151,1154
The world's biggest meat company is built on corruption and it's growing in Australia | Four Corners,2022-04-25T11:15:00Z,1281292,9131,N/A,NYfIXLkoB68,NewsPolitics,,0.7126400539,#VALUE!,1154
How Truck Driving Became One Of The Worst Jobs In The US | Risky Business | Business Insider,2022-04-22T16:17:37Z,2486185,38465,8399,Xyq2963BlsI,NewsPolitics,,1.547149548,21.83543481,1157
How London became the dirty money capital of the world | FT Film,2022-04-22T04:02:42Z,1948373,32408,3622,gyk12Wf_TeQ,NewsPolitics,,1.663336538,11.17625278,1157
"The Queen's a Barbie Girl, in a Barbie World!",2022-04-21T12:10:25Z,118826,4489,110,EKZaleiFZYI,NewsPolitics,,3.777792739,2.450434395,1158
Breaking the Calabrian Mafia in Italy | Foreign Correspondent,2022-04-21T10:00:12Z,3224059,26838,N/A,xZSa4B37sZs,NewsPolitics,,0.8324289351,#VALUE!,1158
The Fight Against A US Mining Company in Jamaica Continues,2022-04-20T13:00:28Z,621285,10607,1859,mVluoyJEXn0,NewsPolitics,,1.707268001,17.52616197,1159
"김건희 여사, 이번엔 노란 스카프‧양말 / 채널A #shorts",2022-04-20T08:07:43Z,1643279,14478,2025,VcR9GJg9kvA,NewsPolitics,,0.8810433286,13.9867385,1159
The Power of Big Oil Part One: Denial (full documentary) | FRONTLINE,2022-04-20T02:00:04Z,3267896,20520,3366,QAAbcNl4Lb8,NewsPolitics,,0.6279269597,16.40350877,1159
Debanhi Escobar habría entrado a una empresa de transporte de carga | Shorts | DPC,2022-04-19T22:59:29Z,177304,2798,66,185JnDpYG8o,NewsPolitics,,1.578080585,2.358827734,1160
Meghan Markle Hands Out a Luxury Gift in The Hague!,2022-04-19T16:00:11Z,1301243,12109,720,C7_zfoHm7JM,NewsPolitics,,0.9305717687,5.945990586,1160
HIV Prevention is a Vibe,2022-04-19T15:44:38Z,1497820,316,N/A,L0mDzflQgq8,NewsPolitics,,0.02109732812,#VALUE!,1160
Will There Be A Fourth Wave Of Covid-19 In India?,2022-04-19T12:27:00Z,131027,3905,204,rd_7Y1nsE80,NewsPolitics,,2.98030177,5.224071703,1160
Arvind Kejriwal Tell Story of a Girl | Free Women Bus Rides in Delhi #Shorts,2022-04-19T11:15:02Z,632238,81150,1029,x-MllkLV9-Q,NewsPolitics,,12.83535631,1.268022181,1160
How The World’s Longest-Running Sardine Cannery Packs 60 Million Cans A Year | Big Business,2022-04-17T15:00:09Z,3261126,26405,1402,ChgaQ8-WbKE,NewsPolitics,,0.8096896593,5.309600454,1162
The robot with a human face! 😱 | Newsround | #SHORTS,2022-04-17T13:30:04Z,30531,428,0,Pufx5Q-LtW0,NewsPolitics,,1.401853853,0,1162
Stan Lee was a victim of elder abuse,2022-04-17T01:05:14Z,4040350,436384,2409,ap9PHHYKEYM,NewsPolitics,,10.80064846,0.5520367383,1162
Le mystérieux naufrage du Titanic a-t-il enfin une explication ?,2022-04-16T20:28:00Z,130750,5115,69,qdb9sLJq9X4,NewsPolitics,,3.912045889,1.348973607,1163
On a comparé les boutiques officielles de Marine Le Pen et d'Emmanuel Macron,2022-04-16T19:52:18Z,190334,4224,217,qxHh51-uc8o,NewsPolitics,,2.219256675,5.137310606,1163
"DEG DEG; Beesha Mareexaan oo war culus kaso yeeray, Rooble & A Madobe oo dagaal ayaan kaga hortageyn",2022-04-16T07:29:09Z,14452,150,28,tnYoxe7VHTc,NewsPolitics,,1.037918627,18.66666667,1163
Take a sneak peak behind the wheel of our new Ford Mustang Mach-E GT at the NY Auto Show!,2022-04-15T23:49:16Z,76778,3531,209,KulqyW0JSBI,NewsPolitics,,4.598973664,5.919003115,1164
How Crocs Became a Fashion Statement | WSJ The Economics Of,2022-04-15T16:26:15Z,819479,10771,398,kO5FURUKTi4,NewsPolitics,,1.314371692,3.695107232,1164
WAR DEG DEG AH; Gudoomiyaha Garbahaarey oo kaso yeeray hadal kaixiyay A Madobe iyo RW Rooble,2022-04-15T07:09:13Z,2643,37,6,iEPqSRLWXm4,NewsPolitics,,1.399924328,16.21621622,1164
,,,,,,,,#DIV/0!,#DIV/0!,#VALUE!
,,,,,,,,#DIV/0!,#DIV/0!,#VALUE!
Not a Game Prop #shorts,2022-05-15T16:00:56Z,14726,425,128,napa7bZ8FyA,NonprofitActivism,,2.886051881,30.11764706,1134
🥦¿Qué NO decirle a alguien que tiene un #TCA?,2022-05-13T10:00:14Z,5194,328,0,QhFLcYJtHn4,NonprofitActivism,,6.314978822,0,1136
Oracion A San Judas Tadeo Para El Dinero #oracion #dinero #money  #sanjudastadeo  #tadeo #sanjudas,2022-05-09T21:31:09Z,58354,1822,252,LABcDjBLMww,NonprofitActivism,,3.122322377,13.83095499,1140
God Has a Plan #shorts | Jentezen Franklin,2022-05-06T16:00:13Z,11105,1387,38,RnjJAPsx6nA,NonprofitActivism,,12.48986943,2.739726027,1143
A Second Chance at a Blessing - Bishop T.D. Jakes,2022-05-05T22:30:10Z,4619994,66215,12082,wVjgMKFS114,NonprofitActivism,,1.43322697,18.24662086,1144
The Book of Revelation - Session 1 of 24 - A Remastered Commentary by Chuck Missler,2022-05-04T01:00:12Z,501235,10055,404,hGmj2-7H7TU,NonprofitActivism,,2.006045069,4.017901542,1145
Você Sabia? A história de Grande Otelo #shorts,2022-04-29T23:00:00Z,18260,957,2,a2-lZo2Ills,NonprofitActivism,,5.240963855,0.2089864159,1150
How's the Josh of Indian Army? Jai Hind Proud of Indian Army,2022-04-27T07:54:33Z,16669468,788880,2547,eKuFbjVhf4M,NonprofitActivism,,4.732484564,0.3228627928,1152
The Health Benefits Of Learning a Foreign Language | Daria Zaikovskaia | TEDxOulu,2022-04-25T20:07:24Z,735986,18633,302,wiRhY8TU9qQ,NonprofitActivism,,2.531705766,1.620780336,1154
reacción del banquillo a sweet pain,2022-04-22T06:52:20Z,1160108,58936,246,OSAdS7DKUWQ,NonprofitActivism,,5.080216669,0.4174019275,1157
Minsung looking like a married couple and Changbin and Felix's reaction to them || Minsung,2022-04-19T14:58:45Z,730767,92053,323,OZAkKmzz4X8,NonprofitActivism,,12.59676477,0.3508848164,1160
4-year-old Shravan is fighting blood cancer | Save him with a bone marrow transplant | GiveIndia,2022-04-19T10:17:58Z,17412,434,13,SycIfREcNQo,NonprofitActivism,,2.492533885,2.995391705,1160
Careers in the Social Sector | Transitioning to a Research Career,2022-04-18T07:27:04Z,22487,194,1,rq7xsaIgFqY,NonprofitActivism,,0.8627206831,0.5154639175,1161
9 Gifts of the Holy Spirit CLEARLY Explained,2022-04-17T13:00:09Z,276658,9709,3820,xJ3Lv4A3_PM,NonprofitActivism,,3.509387041,39.34493769,1162
*ASMR* Packing an order for Sarah!,2022-04-17T01:53:58Z,49677775,1970267,10001,UmG-qZb3324,NonprofitActivism,,3.966093489,0.5075961786,1162
A Feast of Miracles | Revelation: The Riches of His Glory Part 3 | Dr. Dominic Allotey,2022-04-16T02:59:41Z,371,20,0,S12_wIk7TxI,NonprofitActivism,,5.39083558,0,1163
A Feast of Miracles | Revelation: The Riches of His Glory Part 2 | Dr. Dominic Allotey,2022-04-15T02:28:57Z,222,11,0,BBi4LFTNyng,NonprofitActivism,,4.954954955,0,1164
A Feast of Miracles | Revelation: The Riches of His Glory | Dr. Dominic Allotey,2022-04-14T01:44:43Z,191,7,0,exk_dctXGqk,NonprofitActivism,,3.664921466,0,1165
A Feast of Miracles | The Hope of His Calling | Dr. Dominic Allotey,2022-04-13T01:51:29Z,243,19,0,FEKS56btO1Q,NonprofitActivism,,7.818930041,0,1166
Ex Porn Performers Share What Really Happens in the Porn Industry,2022-04-12T17:01:26Z,2264038,16649,N/A,t0rdSxVXxrc,NonprofitActivism,,0.7353675159,#VALUE!,1167
A Feast of Miracles | Communion With the Holy Spirit | Dr. Dominic Allotey,2022-04-12T02:00:11Z,244,19,1,kpT7-hb2Q0I,NonprofitActivism,,7.786885246,5.263157895,1167
Como funciona a ALAVANCAGEM no Trade #shorts #forex,2022-04-11T22:00:07Z,18515,1456,27,Ns5kOBENbRw,NonprofitActivism,,7.86389414,1.854395604,1168
Stacy Mendell & Matt Angleman - Can Shelter Pets Heal a Community? #shorts #tedx #animals #healing,2022-04-11T21:00:22Z,37300,1180,15,u0RCR49P6PI,NonprofitActivism,,3.163538874,1.271186441,1168
How to Identify a Demonic Thought,2022-04-11T20:30:07Z,29683,3078,71,pM9oJOZQhI8,NonprofitActivism,,10.36957181,2.306692658,1168
A Feast of Miracles | Sunday Evening Service | Dr. Dominic Allotey,2022-04-11T01:32:05Z,252,16,0,bwliIgd5nHs,NonprofitActivism,,6.349206349,0,1168
A Feast of Miracles | Palm Sunday | Dr. Dominic Allotey,2022-04-10T18:26:54Z,395,25,0,BRfCkNmwrSU,NonprofitActivism,,6.329113924,0,1169
How does a life of rest sound? #shorts,2022-04-09T16:00:09Z,161396,19436,367,8zAAjU3LP50,NonprofitActivism,,12.0424298,1.888248611,1170
A Feast of Miracles | Jericho Hour | Bishop Dominic Allotey,2022-04-09T13:19:35Z,134,7,0,lChLuw_VeEo,NonprofitActivism,,5.223880597,0,1170
A Feast of Miracles | The Essence of Spiritual Understanding Part 2 | Dr. Dominic Allotey,2022-04-09T01:58:10Z,252,15,0,XhL1KEQRr4A,NonprofitActivism,,5.952380952,0,1170
Douglas Thomas - How a typeface helped launch Apollo #shorts #tedx #design #typography #space #NASA,2022-04-08T21:00:17Z,44611,1074,22,N_UEgGZsgFk,NonprofitActivism,,2.407477976,2.048417132,1171
A Feast of Miracles | The Essence of Spiritual Understanding | Dr. Dominic Allotey,2022-04-08T02:08:32Z,247,15,1,qlUIQkKvV_E,NonprofitActivism,,6.072874494,6.666666667,1171
Doctor Finder - How to find a doctor in Germany,2022-04-07T19:18:59Z,6917490,2394,39,f7_CBM5ro70,NonprofitActivism,,0.0346079286,1.629072682,1172
A Feast of Miracles | Developing Spirituality Pt 2 | Dr. Dominic Allotey,2022-04-06T01:39:44Z,237,16,0,N9VzhZ12GuE,NonprofitActivism,,6.751054852,0,1173
"Erzurum’a özgü “İşfe’ lena..."" Duası Okuyan Dadaş Necati Amcaya Rahmet Olsu #erzurumdaramazan",2022-04-05T20:39:23Z,73835,1217,24,5PhEiF9UBY0,NonprofitActivism,,1.648269791,1.972062449,1174
How to Deal With a Controlling Spouse - Dr. Ron & Jan Welch,2022-04-04T14:23:56Z,142585,2716,316,28O_H22-xkg,NonprofitActivism,,1.904828699,11.634757,1175
🦸ఉడుగు చెట్టుకు ఉయ్యాల గట్టి🦸#shorts#youtubeshorts#funny#comedy#bashayoutubechannel,2022-04-04T08:14:47Z,2143,57,1,qjrB0bt5nx8,NonprofitActivism,,2.659822678,1.754385965,1175
Act Like A Man | Pastor Jentezen Franklin,2022-04-03T16:28:07Z,159296,3382,293,BMm6E3jetJo,NonprofitActivism,,2.123091603,8.663512714,1176
4 Ways to Welcome the Presence of the Holy Spirit,2022-04-03T13:00:10Z,177353,12130,3059,KeyEC9Uw1H8,NonprofitActivism,,6.839467052,25.21846661,1176
A Feast of Miracles | Humble Yourself Before God Humbles You | Dr. Dominic Allotey,2022-04-02T01:49:31Z,254,12,0,Ze9Cn6Yp4M4,NonprofitActivism,,4.724409449,0,1177
A Feast of Miracles | God Gives More Grace to the Humble | Dr. Dominic Allotey,2022-04-01T01:53:52Z,261,16,0,zdigOKhU1EQ,NonprofitActivism,,6.130268199,0,1178
A verdadeira família cristã traz transformação na sociedade! #IPP #HernandesDiasLopes,2022-03-31T14:20:00Z,45247,3943,14,QIwC5bWP9QA,NonprofitActivism,,8.714389904,0.3550595993,1179
A Feast of Miracles | Clothed with Humility | Dr. Dominic Allotey,2022-03-31T01:42:52Z,205,14,0,8MxVhQSSFxs,NonprofitActivism,,6.829268293,0,1179
What is a Sleep Study? - What to expect when you stay at Nicklaus Children's Hospital Sleep Lab,2022-03-30T16:01:14Z,930722,3172,N/A,c3L5hN2j7ps,NonprofitActivism,,0.3408106825,#VALUE!,1180
A Feast of Miracles | Fasting & Humility Part 2 | Dr. Dominic Allotey,2022-03-30T01:34:38Z,246,11,0,i2RwbHNCRuQ,NonprofitActivism,,4.471544715,0,1180
Do you have to have sex to have a baby? | Tricky Talks (for kids),2022-03-29T04:13:08Z,147646,192,38,EaOgqvjVrgc,NonprofitActivism,,0.1300407732,19.79166667,1181
,,,,,,,,#DIV/0!,#DIV/0!,#VALUE!
,,,,,,,,#DIV/0!,#DIV/0!,#VALUE!
Homemade pasta without a pasta machine,2022-05-15T11:56:20Z,1036284,46055,317,dszdew0sALg,PeopleBlogs,,4.444245014,0.6883074585,1134
What is a tandoor oven?,2022-05-14T16:00:13Z,578427,48318,325,YuslgRmNN3c,PeopleBlogs,,8.353344502,0.6726271783,1135
FACING 100 FEARS IN 24 HOURS!!,2022-05-14T02:28:23Z,115174162,3197500,56032,guh65wpaGOQ,PeopleBlogs,,2.776230315,1.752369038,1135
What's the best method for piercing your ears?,2022-05-14T01:27:22Z,2271955,73285,0,hMWFMWPuFVo,PeopleBlogs,,3.225636071,0,1135
a traditional korean mushroom dish,2022-05-12T21:00:23Z,524307,42333,120,Y7ELF30UR6U,PeopleBlogs,,8.074086365,0.283466799,1137
"Barbara: You're A Rich Kid, I'm Out! #Shorts | Shark Tank US | Shark Tank Global",2022-05-12T15:59:47Z,414081,17800,418,y8QUHIZ4uW4,PeopleBlogs,,4.298675863,2.348314607,1137
How to Crochet a Solid Granny Square | Very Easy | US Terms,2022-05-12T10:15:43Z,527736,10400,462,USgqlviJ7vc,PeopleBlogs,,1.970682311,4.442307692,1137
Rotina do dia com a Cecília,2022-05-11T16:29:39Z,62,1,0,kMSbBqYpg1w,PeopleBlogs,,1.612903226,0,1138
A  LITTLE BABY  💕,2022-05-09T09:18:18Z,23,3,0,e9vA-STuajY,PeopleBlogs,,13.04347826,0,1140
How To Properly Start A Fire On A Grill,2022-05-08T15:24:47Z,598411,16570,169,La6QV9UiMQk,PeopleBlogs,,2.768999901,1.01991551,1141
Godzilla v/a Kong fight,2022-05-07T16:25:49Z,1,0,0,L-9HeliunzQ,PeopleBlogs,,0,#DIV/0!,1142
What I eat in a day | OMAD without counting calories,2022-05-06T22:14:39Z,672990,32950,209,hJ-9YUD1FXI,PeopleBlogs,,4.896060863,0.6342943854,1143
How To Grow Strawberries - The Definitive Guide,2022-05-06T18:30:09Z,1158277,24385,788,T6-s7NomNTY,PeopleBlogs,,2.105282243,3.231494771,1143
A DAY IN A BUSY LIFE OF A MOM AND BABY|Baby update and Postpartum experiences,2022-05-06T07:05:28Z,3,0,0,pass1oSrfL4,PeopleBlogs,,0,#DIV/0!,1143
he thought it was a ball...,2022-05-06T05:42:54Z,3,1,0,z_czDGIcEmI,PeopleBlogs,,33.33333333,0,1143
Why You Should Use A Diffuser #shorts,2022-05-05T22:23:19Z,738075,17077,59,ustBd9A2V-I,PeopleBlogs,,2.313721505,0.3454939392,1144
Cejas naturales. Aprende a maquillarlas,2022-05-05T20:57:34Z,617701,21922,82,pJEStJtcMxQ,PeopleBlogs,,3.548966247,0.3740534623,1144
100 Days Building A Modern Underground Hut With A Grass Roof And A Swimming Pool,2022-05-05T12:14:45Z,1362932531,7220977,125239,tYf0BoFe9D8,PeopleBlogs,,0.5298117725,1.734377495,1144
TE ENSEÑO A HACER PAN PITA! #shorts,2022-05-04T23:00:16Z,1456266,120891,577,o0Han4c3gcQ,PeopleBlogs,,8.301436688,0.4772894591,1145
How To Remove Unwanted Grass Using A Sod Cutter ✂️✂️✂️,2022-05-02T19:54:12Z,275512,2073,48,Z-P5KwMarYQ,PeopleBlogs,,0.7524173176,2.315484805,1147
When You Realize You're A Vegan #Shorts,2022-05-02T12:00:03Z,8396440,474537,2659,843olPwdOKw,PeopleBlogs,,5.651645221,0.5603356535,1147
5 Reasons NOT to buy a live aboard sailing boat  - (Watch before you buy!),2022-05-01T16:53:07Z,759161,12778,863,02cbrDyE5Ko,PeopleBlogs,,1.683173925,6.753795586,1148
Three of The Biggest Shark Fights In The Tank | Shark Tank US | Shark Tank Global,2022-05-01T15:59:48Z,13016743,147787,6863,IeEQZNeyWKg,PeopleBlogs,,1.13536082,4.643845534,1148
The Sharks Are Moved To Tears With Kronos Owner's Dilemma | Shark Tank US | Shark Tank Global,2022-04-30T15:59:50Z,6465045,95854,3813,aF6V9Yy6MY4,PeopleBlogs,,1.482650159,3.977924761,1149
99.9% Of The NBA Will NEVER Accomplish This 💪,2022-04-29T15:55:54Z,1480437,90959,1463,pbhsT-bd8kE,PeopleBlogs,,6.144064219,1.608416979,1150
3 Steps For A Perfect Makeup Base 👍,2022-04-29T15:30:05Z,6115682,190428,385,iChDOaMSnkc,PeopleBlogs,,3.113765562,0.2021761506,1150
a khuda tu bolde tere baadlo ko,2022-04-29T09:10:08Z,1463,30,0,FWoU9Vh9zKE,PeopleBlogs,,2.050580998,0,1150
hamra la kular || lage la grmiya bhojpuri status || a raja ho hamra la kular lagwayi deta ho,2022-04-29T05:13:00Z,223729,5800,80,l3sB1mjItjk,PeopleBlogs,,2.592422082,1.379310345,1150
Quadriplegic Gives Wife a Standing Hug | Cole & Charisma,2022-04-27T22:30:01Z,2924340,173749,2170,1tNw2QFF2QM,PeopleBlogs,,5.941477393,1.248928051,1152
How to Fix a Headache in Seconds #Shorts,2022-04-27T13:30:13Z,2386421,84836,2107,cMThkDoozj0,PeopleBlogs,,3.554946927,2.483615446,1152
Possibly why a chiffon cake deflates?,2022-04-26T13:00:21Z,92556,2979,34,lm3m3G7r-VI,PeopleBlogs,,3.218591988,1.141322591,1153
This is the Pro XDR Mini,2022-04-25T17:07:47Z,434745,7978,130,b2dnbTJsSec,PeopleBlogs,,1.835098736,1.629481073,1154
I Got An 18th Century Makeover,2022-04-24T21:07:36Z,4229421,188013,5406,XKDhq2UcjIM,PeopleBlogs,,4.445360251,2.875333089,1155
Bad Birdie Get's A Deal ONLY If Robert Makes A Putt  | Shark Tank US | Shark Tank Global,2022-04-23T15:59:52Z,1302066,21481,736,sDkxpFWNpB8,PeopleBlogs,,1.649762762,3.426283693,1156
Spearfishing A 15 Year Old Fish,2022-04-23T14:30:09Z,52792286,2797617,15944,taHpfRSyT3k,PeopleBlogs,,5.299291264,0.5699136086,1156
Is a crepe maker worth it?,2022-04-22T10:00:01Z,5734965,407175,7357,3GmkJ7w0aWI,PeopleBlogs,,7.099868962,1.806839811,1157
Zach Bryan - Something In The Orange,2022-04-22T06:44:15Z,186725726,822964,16547,lA8F9sIhGdg,PeopleBlogs,,0.4407341279,2.010659032,1157
How To Vent & Plumb a Toilet (in 2024),2022-04-21T16:37:12Z,2814461,23566,529,5cWbYMdcYdk,PeopleBlogs,,0.8373184066,2.244759399,1158
ഞങ്ങളുടെ ഈസ്റ്റർ-വിഷു ആഘോഷം | Easter celebration and Family Gathering | A day in our life,2022-04-21T02:59:09Z,653,38,10,VPTAh4aP8y0,PeopleBlogs,,5.819295559,26.31578947,1158
How to remove a menstrual cup mess free #shorts,2022-04-20T16:33:07Z,6181053,110374,1652,3goupRaMMP4,PeopleBlogs,,1.785682795,1.496729302,1159
A hen in her nest 🐓,2022-04-19T23:15:01Z,10612107,767566,2504,g-hPtKGb8yo,PeopleBlogs,,7.232927448,0.3262260183,1160
At least 1 fig we eat has a 💀 female wasp inside. Find out why with me🌱 #fig #howtowithjessie,2022-04-19T20:31:23Z,1074009,12422,201,_UR1CrmMi5k,PeopleBlogs,,1.156601109,1.618096925,1160
Have you ever seen a sunset like that? Please dm for credit/removal.,2022-04-19T10:48:07Z,5,2,1,c4ZyiqzJAW0,PeopleBlogs,,40,50,1160
COMO FAZER A MELHOR PICANHA NA CHURRASQUEIRA ELÉTRICA #Shorts,2022-04-18T21:58:33Z,2124263,231475,541,vrZTQeybVtg,PeopleBlogs,,10.89672042,0.2337185441,1161
How To Pressure Wash A House,2022-04-18T19:17:36Z,194874,7816,68,q9x8E79x-Y8,PeopleBlogs,,4.01079672,0.8700102354,1161
,,,,,,,,#DIV/0!,#DIV/0!,#VALUE!
,,,,,,,,#DIV/0!,#DIV/0!,#VALUE!
What Happens After I Rescue a Colony of Bees,2022-05-15T15:06:30Z,4537319,345960,2394,2uC5A-fsVCI,PetsAnimals,,7.62476696,0.691987513,1134
STUNG by a Fireworm!,2022-05-14T12:00:57Z,5868027,97071,3657,IXr0HyRkRQk,PetsAnimals,,1.654235742,3.767345551,1135
I built my dogs a giant ball pit! #goldendoodle #dogdad #ballpit,2022-05-13T15:11:21Z,4846075,363452,2665,ybkw-5LJOiA,PetsAnimals,,7.499925197,0.7332467561,1136
What Happens When You Mix Fire and a Tornado? ﻿| The Test Lab | BBC Earth Kids,2022-05-12T13:00:30Z,295786,143,N/A,cErokR6s7T8,PetsAnimals,,0.04834576349,#VALUE!,1137
Three ways to bathe a cat without problems. #cats #shorts,2022-05-12T09:21:23Z,10606257,617399,6563,UL6PST0eEcc,PetsAnimals,,5.821082782,1.063007877,1137
Training session with a Belgian Malinois puppy,2022-05-08T23:04:07Z,615705,17757,119,-CsZpa7MK4g,PetsAnimals,,2.884011012,0.6701582475,1141
Lucrezia Conti 6 anni pattinaggio artistico a rotelle - catene di salti in allenamento,2022-05-06T14:28:54Z,198041,4517,52,gXhSViST49M,PetsAnimals,,2.280840836,1.151206553,1143
I Took My Axolotl to the Vet,2022-05-05T22:15:00Z,4084906,35650,1942,BfpGhozN7vE,PetsAnimals,,0.8727251007,5.44740533,1144
✅ Cómo lavarle los dientes a tu perro SIN causarle un TRAUMA,2022-05-05T14:00:31Z,76284,3975,31,s0wJRji8Sr4,PetsAnimals,,5.210791254,0.7798742138,1144
Rottweiler Theo é a única forma de acalmar o Bebê Henry.,2022-05-05T00:34:20Z,931,64,12,OiFlB1mM_DE,PetsAnimals,,6.874328679,18.75,1144
The Power of Pollinators,2022-05-02T14:00:16Z,218152,2371,110,eDxZojp9yNg,PetsAnimals,,1.08685687,4.639392661,1147
How to Stop a Reverse Sneeze in Your Dog,2022-05-01T14:18:48Z,510475,8153,128,uL0bAMh7iaE,PetsAnimals,,1.597139919,1.569974243,1148
Teeny Tiny Baby Is Now King Of The Kittens ❤️ | Dodo Kids | Baby 2 Big,2022-05-01T12:00:05Z,3097163,3621,0,6mPynZPJVM4,PetsAnimals,,0.1169134463,0,1148
A Verdade Sobre A Indústria do Leite E O Bem Estar Animal!,2022-04-29T18:15:01Z,617,71,20,D3mtcZbpSlI,PetsAnimals,,11.50729335,28.16901408,1150
γεννάνε και τα κοκόρια μας,2022-04-29T18:14:00Z,1101,37,1,bu4A1vn_6O4,PetsAnimals,,3.36058129,2.702702703,1150
Pony sits like a Human! | This Esme,2022-04-26T17:01:36Z,329093,19226,226,-t4saPnoWis,PetsAnimals,,5.842117578,1.175491522,1153
David Attenborough Meets a Hedgehog Parasite That Feasts on BLOOD | Micro Monsters | Nature Bites,2022-04-25T16:30:11Z,250530,2238,164,zEhFn9wpAOw,PetsAnimals,,0.8933061909,7.327971403,1154
Ep 62: The Dogs Go on a SURPRISE TRIP! (Part 1),2022-04-24T14:52:26Z,2828061,24717,1329,-lzoPN_Mz0o,PetsAnimals,,0.873991049,5.376866125,1155
