Title,Date,Views,Likes,Comments,Video ID
My Friend Is Trapped in a Game! | Pinkfong & Ninimo Songs | Pinkfong Official,2025-05-15T23:00:44Z,2418397,1814,0,mlhuTzb3n6I
Jesus e a Verdade por Trás das Religiões,2025-05-15T11:48:27Z,1111,531,10,yuvdSHg_8FU
Phonics Song 2 with TWO Words in 3D - A For Airplane - ABC Alphabet Songs & Sounds 188,2025-05-15T02:56:25Z,1415,6,0,hAVmjb7vUl4
AS 7 FRUTAS QUE OS IDOSOS DEVEM EVITAR A TODO CUSTO,2025-05-14T23:42:57Z,5325,121,21,AbDRUuqogwg
Wondering how to land a $75K+ tech job? Learn high demand QA Tech Skills  No Certification required,2025-05-14T22:29:21Z,160,7,1,TtJh5QbJZZs
His FBI Job Led Him to Become a Muslim! | Incredible Revert Story | Reaction Video #revertstory,2025-05-14T20:56:28Z,68,4,0,Zly9EZjLhD4
"If you don't go to lecture as a STEM major, you are much more likely to fail",2025-05-14T18:00:17Z,242,11,6,JTNpSnmGnaA
🦕🎨 Let’s Draw a Brontosaurus Together! ✏️🌟 #BubblesAndFriends #BrontosaurusDrawing #HowToDraw,2025-05-14T15:30:06Z,1203,7,0,EtIZEVfCj70
Love Beyond Magic | The Story of Rakib and Tithi | A Heartwarming Fairy Story #FairyLoveStory,2025-05-14T14:33:31Z,5488,87,2,6KM7dzmkLA4
How One Company Secretly Poisoned The Planet,2025-05-14T14:07:28Z,15466895,530248,37369,SC2eSujzrUY
No TODOS los que te RODEAN vienen de Dios | aprende a DICERNIR las influencias DEMONIACAS,2025-05-14T12:01:02Z,706,23,3,VSY1xgUDwD4
The History of the Serbian Nation,2025-05-14T10:59:23Z,96407,4343,701,EoPpE01uVpQ
كورس التأسيس | The Best Start | الحلقة 8 | جرامر | افراد العائلة | قاعدة a / an و قاعدة الجمع,2025-05-14T04:03:39Z,0,77,3,qLm3Gxw39fI
Mashallah subhan Allah tilawat Quran in a beautiful voice of united state ❤️#shorts #ytshorts #quran,2025-05-14T05:20:04Z,537,13,0,m6KNg322UTo
"PADRE CRUEL: QUISO ABANDONAR A NUESTRO HIJO ""DIFERENTE""",2025-05-14T00:15:29Z,45,1,0,2hdUry-zJV0
🚓 Police Car is Broken! | Car Town | Catch the Thief | Veo Veo | Pinkfong Car Story,2025-05-13T23:00:37Z,5722056,11677,0,VSLgx5HU5fo
Como Retirar Dinheiro do YouTube na Prática - Passo a Passo,2025-05-13T20:01:00Z,2669,306,37,V2M-8W32ASY
"LA VERDAD BÍBLICA SOBRE VOLVER A CASARSE QUE EL NUEVO PAPA NO PREDICA""~BILLY GRAHAM",2025-05-13T13:32:08Z,135,2,0,Jsb7leBI9sA
What Happens If You Hold In a Cough? | Why Do We Cough? | How Cough is Formed? | Dr. Binocs Show,2025-05-13T12:30:45Z,2018862,3963,0,cZELr98g2eU
El ESPIRITU SANTO siempre ha estado CONTIGO | solo necesitas APRENDER a escucharlo,2025-05-13T12:00:04Z,13742,336,4,1GGRM8BEn44
Asma ul husna in a beautiful voice of Islamic video ❤️ #shorts #viralvideo #islam #love #quran,2025-05-13T10:34:16Z,1707,89,2,mKTwES1dtos
Dízimo: A Verdade Que Ninguém Te Conta,2025-05-13T08:00:43Z,11,2,0,dsq30C5lf7I
Did India Avoid A Nuclear War With Pakistan? | Can Modi Change The Narrative Now? | Akash Banerjee,2025-05-12T17:19:07Z,2202648,64904,18120,iQnIHqC0ZyQ
🎁🌟 The Perfect Gift for a Friend Like YOU! 🎶🧑‍🤝‍🧑 #PerfectGift #BubblesAndFriends #MusicAndEmpathy,2025-05-12T14:00:07Z,1396,5,0,VVaq1exw7H0
The Mermaid Who Saved a Life | এক জলপরীর ছোঁয়ায় বাঁচলো ছোট্ট প্রাণ | Heart Touching Short Film,2025-05-12T06:39:37Z,8520,74,0,1Y0WMyOug6E
Life’s a doozy.,2025-05-12T00:54:05Z,881,3,0,ScvQVpFi5LU
"If you will be going to college as a STEM major, this is what you must know and do to succeed!",2025-05-11T22:05:32Z,179,9,6,vTprtnslH9o
Repairing The Worlds Most Broken iPhone! Can I Make A Profit?,2025-05-11T08:09:05Z,39428,1376,217,Q3ZK-FQ-MB0
Make a Special Gift for Mom! 💖 DIY Mother’s Day Scrapbook,2025-05-11T07:00:46Z,3383583,25713,0,rhBo0WcSnrA
How to Become A Full Time Trader! Puerto Rico Mentorship,2025-05-10T20:50:41Z,0,9,1,hYbepYQnWN8
DIBUJA a CRONOS en 1 MINUTO ✍️,2025-05-10T17:00:26Z,315204,15498,108,PdHGPh_wz2g
✅ How to Attach a Light for Surf Casting Long Distance Casting?,2025-05-10T12:47:30Z,6071,39,0,v9Wk5YzH05M
ABC Song Phonics for Toddlers | Learn Alphabet sounds A to Z | ABC Song + More Kids Learning videos,2025-05-10T09:46:51Z,7267220,10329,0,n8-aM3D3ul0
El Secreto del Centurión que Perforó a Jesús,2025-05-10T06:13:39Z,772,31,4,SRoRsc7Bw2c
Mashallah subhan Allah tilawat Quran majeed in a beautiful voice of united state ❤️ #shorts #quran,2025-05-10T05:32:01Z,453,14,0,fXejcf-prkw
5 Must-Check Things Before Buying a Used iPhone (Avoid Wasting Money!),2025-05-10T04:49:53Z,138,0,0,5YM1wmuR50E
Try-a-Job Day | Jobs and Career Pretend Play | Kids Cartoon | Sheriff Labrador,2025-05-09T11:15:16Z,1710888,3645,0,-b9SH-VErIA
​@OfficialPeterRabbit - 💕 A Mom's Love on Mother's Day 💕 | Compilation | Cartoons for Kids,2025-05-09T11:01:41Z,74528,211,0,wbaQvUj5fQc
Mashallah subhan Allah tilawat Quran majeed in a beautiful voice of united state ❤️ #shorts #quran,2025-05-09T04:25:19Z,10751,720,6,Axs0jvpYlo4
Helicopter Rescues a Cow from Mud! | গরু বাঁচাতে এল হেলিকপ্টার | Real Life Cow Rescue Story,2025-05-09T02:24:16Z,27411,822,2,PL0YGD7UcTI
Went to the Girlfriend's Workplace After a Fight,2025-05-08T22:50:29Z,2668049,96936,870,jh8uqxgXbhA
🔥 LEARN ITALIAN with a Magical Story: Il Sussurro del Fuoco (A1-A2),2025-05-08T22:00:06Z,47,8,1,p7CY6qulw4M
تلاوة تثلج الصدور للقارئ عمر بن ضياء الدين 🤍 | Surah An-Nisa - سورة النساء,2025-05-08T19:59:34Z,42187,653,50,Z5mloR7VGu4
Beach Day | Fun Day at the Beach | Summer Song | Kids Songs & Nursery Rhymes | LiaChaCha,2025-05-08T08:00:13Z,2058836,3559,0,DTK_HP4mEoc
The Mermaid & The Lion | A Heart-Touching Story | এক জলপরী ও এক সিংহের অবিশ্বাস্য বন্ধুত্ব  #animals,2025-05-08T05:21:26Z,12129,118,2,Lqw2Smeiafc
