Title,Date,Views,Likes,Comments,Video ID
Do This SECRET Shallowing Drill For A Perfect Release! ✅🏌️‍♂️  #shorts,2022-05-15T11:59:55Z,82427,1824,16,IAdhpjTAh2Y
RK-Bro 4:20 says we just smoked your a** #Short,2022-05-14T14:00:08Z,262042,13102,73,G92Cr-TMmlo
Mike Tyson is trying to be like me! My demo is the only way Canelo Alvarez can beat Dmitry Bivol!,2022-05-14T01:19:19Z,10158,137,83,YtBxJp8d20c
how to fly fish (without a fly fishing rod),2022-05-14T00:00:11Z,703716,30017,269,mXd9Lx7hhrI
Who Is the Greatest French Footballer Ever? Thierry Henry’s Repsonse Will Surprise You #shorts,2022-05-13T13:57:40Z,12313489,392507,5777,VPTna5phZ6c
How Does THE SLOWEST Player in the NBA Warmup?,2022-05-12T22:39:59Z,16031973,945109,1851,5QvSWc3U9tQ
A bounce that (usually) only happens in your dreams,2022-05-12T14:19:19Z,6772679,108930,438,CyFa8vM0SIw
"How a DIY business went from a garage to 500,000 orders a year I DHL",2022-05-12T08:11:03Z,695324,2302,37,v1kOZ8Y6asQ
👀 Ümit Özat’a göre Süper Lig’in en iyi futbolcusu… ❓,2022-05-11T23:52:41Z,275155,4520,317,ddsdqJeoG8w
Switching to a 20 gauge for duck hunting?? Ethan of Locked In Productions reviews his Benelli M2,2022-05-11T14:12:22Z,434089,12199,186,z31RMfSf51A
How To Recover From A Hard Workout #shorts,2022-05-11T14:13:32Z,235730,12255,100,kYWS-TDJ_eo
🇳🇱 A pure artist with the ball at his feet 🕰️🍊 | #Shorts,2022-05-11T12:00:17Z,301099,13915,162,F4yw0P0Cmlo
🙌 UNBELIEVABLE! Jason Holder Takes 4 Wickets In A Row #Shorts,2022-05-11T05:00:13Z,3240688,206623,297,huuW1y3PWD4
Steph Curry Demonstrates To Grizzlies How To Close A Game 4,2022-05-10T20:10:51Z,197232,4678,408,4SvsM8ASrbs
BWF Thomas Cup Finals 2022 | Indonesia vs. Thailand | Group A,2022-05-09T18:54:30Z,521765,1977,78,xWBpC5nZxuI
"The Champions: Season 6, Episode 1",2022-05-09T16:00:31Z,4002488,143946,3284,nnY1_H3Gi3c
I made a 9 on a par 3 (AWFUL golf) #Break75 S2E2,2022-05-06T15:00:15Z,797968,23745,2539,Cgr52vPAO6Q
Jermell Charlo Stops Jeison Rosario With a Brutal Body Shot,2022-05-05T15:21:32Z,458955,10700,456,3ENGoqgZoJY
It’s a Poole Party! Get to know Warriors guard Jordan Poole!,2022-05-04T00:54:40Z,500324,20787,202,Nf8Kl4TrDhU
Scoring a HEADER from the edge of the box! #shorts,2022-05-03T11:00:15Z,7127794,128317,253,XWzGDCnFDno
COMO BATER FALTA | QUAL REGIÃO DO PÉ QUE ACERTA A BOLA?,2022-05-02T14:00:01Z,1387253,78440,350,11y3NygnW98
Zac Efron & a couple of champs at #UFCVegas53 👊,2022-05-01T00:50:32Z,210238,4783,111,mZmUW0ZxMwo
A NO-HITTER! FIVE Mets pitchers combine to toss FIRST NO-HITTER of year! (2nd in franchise history),2022-04-30T04:38:57Z,152954,3693,435,hBq5z31pHYM
This 89-year-old WWII veteran ran for a touchdown 👏,2022-04-29T23:53:38Z,8156970,552481,3904,4JFpdOX_cFw
Collin Morikawa Is Not A Human Being...,2022-04-29T19:06:43Z,1076035,22644,102,q98WTsDX1oM
The McGill Big 3 (HOW TO DO IT CORRECTLY),2022-04-29T17:58:44Z,1238242,61837,379,C89EKtI8a3o
YADIER MOLINA STEALS A BASE!!!,2022-04-29T01:55:37Z,136062,7342,105,lGU7RI6ksBo
Why does The Rock lie about his height?,2022-04-28T21:14:47Z,37007056,1289368,5763,0B5zVFj8ggU
Husker Cornerback Cam Taylor-Britt is a FREAK Athlete 🤯 #shorts,2022-04-28T02:15:07Z,759110,50433,381,Vpl5QTITyyw
"How does Joe Rogan make more than $100,000,000 a year?",2022-04-27T19:31:06Z,221603,7532,102,-5Q0AOByCoM
Jurgen Klopp does a Scouse accent at press conference 😂,2022-04-27T17:51:19Z,394772,7982,190,eC8o3FQVo-k
Under a spell in New Orleans 🎭,2022-04-26T14:18:38Z,36338508,1058243,4973,HCR-qpnvgVk
The NBA Has A Big Bully Problem,2022-04-25T20:11:42Z,1955281,89728,3492,gRYKmqZp4aY
"“I was told often that I was too short to be a high jumper”, Stefan Holm, Olympic champion",2022-04-25T15:00:16Z,861046,17208,98,c4oyZIQjdrs
TE ENSEÑO A HACER SOMBRA DE BOXEO CON MANCUERNAS #shorts,2022-04-24T21:45:22Z,479459,67071,140,YytbaS9AJtQ
How to Become a Lockdown Press Man Cornerback!,2022-04-23T20:48:29Z,298540,14281,36,LIJ5gyPxCyg
Randy Orton jumps out of a cake #Short,2022-04-23T16:00:31Z,586028,24264,76,gbeBYVXWcrA
7 Habits that will make You a GREAT Soccer Player,2022-04-23T13:56:54Z,516287,19039,400,geIYxdG0WVQ
"How does MrBeast make $54,000,000 a year?",2022-04-23T00:15:00Z,1776537,65241,462,2E5NjqOloug
I made a big mistake with Shaq in front of the entire world,2022-04-22T20:25:31Z,16736743,688209,542,BlMihQch4xw
Charles Jourdain Describes His Viral Sparta Kick as a Bananas Moment,2022-04-22T18:26:35Z,2251551,135489,1103,GOfMYzfdiZA
"Introducing Fat Perez, an absolute anomaly of a man",2022-04-22T15:50:09Z,9707635,96780,746,v1qQt9xnyyo
MONEY KICKS vs FLOYD MAYWEATHER IN DUBAI will not happen because of this!,2022-04-22T03:12:31Z,1398,14,13,mpx0c8zcnvo
Mike Tyson should of beat the dude on the jet like this!,2022-04-22T03:01:17Z,105,2,0,0ApQvFfNgLk
"How does The Rock make $270,000,000 a year?",2022-04-22T00:30:00Z,12939906,571213,1753,1bcOCTGf7Yw
