Title,Date,Views,Likes,Comments,Video ID
¿Olor Desagradable en Personas Mayores? ¡Lave bien ESTA ZONA!,2025-04-15T19:21:46Z,2884741,57409,3732,qhhturfwpOI
Can we Build the Most Powerful Launcher on YouTube!?,2025-04-15T18:18:25Z,750,26,26,WMoC27Wxu64
A törökök kiűzéséről,2025-04-15T17:01:03Z,1821,18,1,lHmeTXh13VI
A Kind Stranger Made Crossing Easier for Everyone#shorts,2025-04-13T14:44:14Z,10886,138,2,O6kLqfp-v5c
AI as a New Industry | NVIDIA CEO Jensen Huang on the Future of AI & Energy,2025-04-13T11:30:33Z,961,12,0,e0Nf3tsG43k
AGI Is Coming: Will It Save Us or Replace Us? | The Truth About Artificial General Intelligence,2025-04-12T09:30:12Z,21,0,0,Hol-cv968B0
Need A Mix Value Cash Counter in Ongole? We Got You Covered! ✨ #shorts #aksautomation #trending,2025-04-12T06:30:22Z,29568,115,0,OpyFtMlbAck
Inside Saudi Arabia's $500 Billion ZERO CAR City of the Future!,2025-04-11T17:42:14Z,2197,78,29,bCFiF_xvIew
Building an AI Chatbot on a Raspberry Pi,2025-04-11T16:00:07Z,3057,119,9,rkDKT_NFwQQ
AI vs AGI: Are We Creating a New Form of Consciousness?,2025-04-11T09:30:01Z,54,4,1,0AA8Ew-B9AI
How to create a survey with AI,2025-04-10T17:41:26Z,473,1,0,2zGgetZyuF4
"Pipewire: The How, What and Why of Audio on (Embedded) Linux - Daniel Strübig - ADC 2024",2025-04-10T17:26:14Z,0,0,0,w7xe46-hhQU
Reena’s Hidden Past | A Soldier’s Final Promise | FrameFlick Stories,2025-04-10T10:04:56Z,45,2,0,Pvm-p6SoMIk
This Man Burst A party Paper on groom Then..#shorts,2025-04-09T15:38:34Z,87,0,0,X7LE9IFaXJ0
💻 The Evolution of General Purpose Computing | Jensen Huang at AI Summit India 🚀,2025-04-09T11:30:29Z,1874,10,0,hl6OWpoiVWA
Will AI Replace Web Developers? The Truth You Need To Hear in 2025!,2025-04-09T09:30:23Z,140,0,0,p8VJ9ICS374
COMO A MAIOR MARCA DE ALIMENTOS DO BRASIL FALIU?,2025-04-08T17:00:11Z,47393,2537,93,ALjf68xLbdQ
Summer of '42 Movie Explained | A Cinematic Classic with a Poignant Ending | FrameFlick Stories,2025-04-08T12:17:11Z,114,5,0,SA0_e5fRbBk
Cálculo da Ondulação Geoidal,2025-04-07T22:01:11Z,55,12,2,mfSE-_GY8SY
I Built a Tin Can Steam Engine from a 1963 Mechanix Illustrated Magazine - Does It Work?,2025-04-06T13:34:11Z,2720,90,14,r_CU48q6Ltc
Need a Note Counting Machine in South-Extension? We Got You Covered! ✨ #shorts #trending #ytshorts,2025-04-05T09:00:08Z,6533,43,0,7bz3dU8vszg
🌍 The Importance of Sovereign Data | NVIDIA AI Summit Fireside Chat with Jensen Huang & Masayoshi🔥,2025-04-04T11:30:07Z,2569,33,1,EDUP7_Z8b_Y
"Need a Mix Value Cash Counter in Rohini, Delhi? We Got You Covered! ✨ #shorts #trending #ytshorts",2025-04-04T09:15:03Z,14241,103,0,WcSOBAoFJjw
Jack Ma Thinks We Won’t Need Jobs in the Future... Seriously?! 🤡😂,2025-04-02T08:59:29Z,61,1,1,o-bjXw5Ul28
Making a Water River using Rc tractor. Construction in Mini City @Aakash946,2025-04-02T00:30:35Z,5274549,46571,1520,rha_MwbsPoA
YBD Talks: As novas descobertas da ciência sobre a saúde da mulher,2025-03-31T15:57:25Z,10,0,0,5bg4vcrEJBQ
A Family Torn by the Past | Secrets That Changed Everything | FrameFlick Stories,2025-03-31T07:41:28Z,162,7,0,HNc6N9LGB4c
Need a Cash Counting Machine in Kolhapur? AKS Automation Got You Covered! 💰✅ #shorts #trending,2025-03-31T03:30:07Z,25478,171,1,ELCaiscvvJ4
How To Make a DIY DRONE at Home | Part: 1,2025-03-30T07:25:28Z,766,45,17,L0CD6F7m_7g
Need a Mix Value Cash Counter in Punjab? We Got You Covered! ✨ #shorts #trending #aksautomation,2025-03-30T03:00:58Z,17533,190,1,u_yW3sk2oOQ
Need a Cash Counting Machine in Porbandar? AKS Automation Got You Covered! 💰✅ #shorts #trending,2025-03-30T02:30:13Z,30417,249,2,KgKZ-XhogVo
🔴 Boston Dynamics' NEW Atlas Robot Moves Like a Human! 🤯 Is This the Future,2025-03-29T14:00:19Z,123,3,0,Bq9L7cEhk1A
💪 The Journey of Hard Work and Sacrifice | Jack Ma’s Success Philosophy 🚀,2025-03-29T11:30:14Z,51,3,0,KmrshqQl1v8
Need a Cash Counting Machine in Bhopal? AKS Automation Got You Covered! 💰✅ #shorts #trending #viral,2025-03-29T04:30:23Z,20995,171,0,rnr_ZercyDw
"That's a Fact! Few Men Know This, Very Wise Advice From a 92 Year Old Elderly Woman",2025-03-27T16:28:20Z,15,2,0,5UIB05COSd8
The Boy with Ever-Growing Hair | A Curious Medical Mystery | FrameFlick Stories,2025-03-27T11:12:26Z,529,5,N/A,ZJIPeU8hjrQ
Need a Cash Counting Machine in Solapur? AKS Automation Got You Covered! 💰✅ #shorts #trending #viral,2025-03-27T09:00:40Z,16557,130,0,XJaFt4FJiBw
🚚 Building a Logistics System 🌍 | Jack Ma at Moscow University,2025-03-26T11:30:43Z,573,15,0,xTlrnTjQDbA
A DRONE Delivers Lunch,2025-03-25T13:12:52Z,2210805,98974,2546,UK_Wja0PTsc
A Complicated Connection | Emotions That Changed Everything | FrameFlick Stories,2025-03-25T09:21:50Z,187011,319,1,dNBrGussmjg
The Wardrobe That Changed Time | A Man's Unbelievable Journey | FrameFlick Stories,2025-03-24T09:28:23Z,95,6,0,Wq2QFfzLiGI
🖥️ The Evolution of Computing Platforms 🚀 | Jensen Huang & Mark Zuckerberg,2025-03-22T11:30:06Z,2438,51,3,avRfMwnOQYc
Como aumentar a RAM do Seu Android em 1 Minuto (Sem Root!),2025-03-21T21:07:21Z,102,3,0,YfM304jl9UI
Technical Shivanand  is live! a,2025-03-21T07:24:17Z,121,6,2,Gg4h65ocIkg
PASSO a PASSO😱 COMO JOGAR GTA RP FiveM em QUALQUER TELEFONE (Método infalível 2025),2025-03-17T22:59:59Z,34555,926,258,ED39BkCDBi0
